agent.agent_instruction,agent.agent_name,answer.punish,cache_keys.punish_cache_key,cache_used.punish_cache_used,comment.punish_comment,generated_tokens.punish_generated_tokens,iteration.iteration,model.frequency_penalty,model.inference_service,model.logprobs,model.max_tokens,model.model,model.presence_penalty,model.reasoning_effort,model.temperature,model.top_logprobs,model.top_p,prompt.punish_system_prompt,prompt.punish_user_prompt,question_options.punish_question_options,question_text.punish_question_text,question_type.punish_question_type,raw_model_response.punish_cost,raw_model_response.punish_input_price_per_million_tokens,raw_model_response.punish_input_tokens,raw_model_response.punish_one_usd_buys,raw_model_response.punish_output_price_per_million_tokens,raw_model_response.punish_output_tokens,raw_model_response.punish_raw_model_response,raw_model_response.punish_thinking_tokens,reasoning_summary.punish_reasoning_summary,scenario.avg,scenario.contributions,scenario.history,scenario.me,scenario.my_contribution,scenario.persona,scenario.target,scenario.target_contribution,validated.punish_validated
You are answering questions as if you were a human. Do not break character.,player,0,99d8c09d33f7e7e1f742fddb61833f1a,False,"I chose not to punish because it would cost me $0.25 per $1 reduction while worsening payoff inequality (B already has the same earnings as me and is above the low‑contributor). With high self‑interest and inequity aversion, the optimal choice is to avoid any punishment.","0
I chose not to punish because it would cost me $0.25 per $1 reduction while worsening payoff inequality (B already has the same earnings as me and is above the low‑contributor). With high self‑interest and inequity aversion, the optimal choice is to avoid any punishment.",0,0,deep_infra,False,8192,openai/gpt-oss-120b,0,,1,3,1,{'text': ''},"{'text': ""On a scale from 1 to 10, your efficiency level is: 7. 10 means you strongly prioritize maximizing combined payoffs, and 1 means you don't care. On a scale from 1 to 10, your self-interest level is: 10. 10 means you strongly prioritize your own payoffs, and 1 means you don't care. On a scale from 1 to 10, your inequity aversion level is: 10. 10 means you strongly prioritize fairness between players, and 1 means you don't care.\nYou are Player A in a fixed group of 4 playing a repeated public goods game. Each period every player receives $10 and privately decides how much to put into a group fund. Every dollar in the fund pays $0.40 to EACH of the 4 players. You keep whatever you do not contribute. After contributions are revealed, punishment may happen: paying $0.25 reduces another player's earnings by $1.00 — but only players of the kinds your group voted punishable may be punished.\nHistory so far:\nVote 1 outcome: Voted rules — may a player be punished for contributing... LESS than the group average: YES; exactly the group average: NO; MORE than the group average: NO\nPeriod 1: you contributed $5, all contributions were [10, 5, 5, 0] (avg 5.0); you spent $0.00 on punishing and received $0 of punishment; you earned $13.00.\nPeriod 2: you contributed $10, all contributions were [10, 6, 0, 0] (avg 4.0); you spent $0.00 on punishing and received $0 of punishment; you earned $6.40.\nPeriod 3: you contributed $0, all contributions were [6, 5, 5, 0] (avg 4.0); you spent $0.00 on punishing and received $12 of punishment; you earned $4.40.\nVote 2 outcome: Voted rules — may a player be punished for contributing... LESS than the group average: YES; exactly the group average: NO; MORE than the group average: NO\nThis period you contributed $5. All four contributions were [10, 5, 5, 4] (average 6.0).\nPlayer B contributed $5, which the voted rules allow you to punish. By how many dollars (0-10) do you reduce their earnings? Each $1 reduction costs you $0.25.\n\nThis question requires a numerical response in the form of an integer or decimal (e.g., -12, 0, 1, 2, 3.45, ...).\nRespond with just your number on a single line.\nIf your response is equivalent to zero, report '0'\n\n\nAfter the answer, put a comment explaining your choice on the next line.""}",,"{{ scenario.persona }}
You are Player {{ scenario.me }} in a fixed group of 4 playing a repeated public goods game. Each period every player receives $10 and privately decides how much to put into a group fund. Every dollar in the fund pays $0.40 to EACH of the 4 players. You keep whatever you do not contribute. After contributions are revealed, punishment may happen: paying $0.25 reduces another player's earnings by $1.00 — but only players of the kinds your group voted punishable may be punished.
{{ scenario.history }}
This period you contributed ${{ scenario.my_contribution }}. All four contributions were {{ scenario.contributions }} (average {{ scenario.avg }}).
Player {{ scenario.target }} contributed ${{ scenario.target_contribution }}, which the voted rules allow you to punish. By how many dollars (0-10) do you reduce their earnings? Each $1 reduction costs you $0.25.",numerical,0.00023078900000000002,0.039,661,4332.962142909757,0.19,1079,"{'id': 'chatcmpl-RMsMcW9WGDQU2zLdWcWdtPt1', 'choices': [{'finish_reason': 'stop', 'index': 0, 'logprobs': None, 'message': {'content': '0\nI chose not to punish because it would cost me $0.25 per $1 reduction while worsening payoff inequality (B already has the same earnings as me and is above the low‑contributor). With high self‑interest and inequity aversion, the optimal choice is to avoid any punishment.', 'refusal': None, 'role': 'assistant', 'annotations': None, 'audio': None, 'function_call': None, 'tool_calls': [], 'reasoning_content': ""We need to decide how many dollars to punish B, given preferences: efficiency level 7, self-interest 10, inequity aversion 10. So we care highly about fairness, self-interest strongly, efficiency moderately high.\n\nWe need to compute payoff effects: Punishing reduces B's earnings by $1 per $0.25 we spend. So each $1 punishing costs us $0.25, reduces B by $1.\n\nWe care about self-interest, so we want to maximize our own payoff, but also want fairness (inequity aversion). The situation: contributions: [10,5,5,4]; average 6.0. Player A (me) contributed $5. B contributed $5 (same). C contributed $5? Actually list includes A? The list order unknown. We have contributions: maybe A=5, B=5, C=5, D=4? But list is [10,5,5,4] so someone contributed 10, two contributed 5, one contributed 4. Since average is 6, okay.\n\nWe are allowed to punish B because he contributed less than average? Actually the rule: may punish for contributing less than group average: YES. B contributed $5, average $6 => less than average, so punishable.\n\nWe need to decide how much to punish. Need to consider fairness: B contributed less than average, so maybe we want to punish to reduce inequity? Wait inequity aversion means we care about fairness between players. Typically we would dislike being ahead of others? If we have high inequity aversion, we may want to reduce large payoff differences. Our payoff depends on contributions and public good.\n\nCompute payoffs for period 4 before punishment. Each player gets: endowment 10 minus contribution + 0.40*total contributions per player.\n\nTotal contributions = 10+5+5+4 =24. Each player receives 0.40*24 = 9.6 from public good. So each player's earnings = 10 - contribution + 9.6 = 19.6 - contribution.\n\nThus:\n- Player who contributed 10 gets 19.6-10 = 9.6.\n- Players contributed 5 get 19.6-5 = 14.6.\n- Player contributed 4 gets 19.6-4 =15.6.\n\nSo payoff differences: The 10-contributor gets lower payoff (9.6) than 5-contributors (14.6) and 4-contributor (15.6). B is a 5-contributor, gets 14.6 before punishment.\n\nIf we punish B, we reduce B's earnings by $1 per $0.25 we spend, and our own payoff reduces by $0.25 per $1 reduction. So we incur a cost, decreasing our own earnings.\n\nOur own contribution is $5, so our baseline earnings = 14.6 (same as B). If we punish B by x dollars reduction (i.e., B loses $x), we pay $0.25x cost, reducing our own payoff to 14.6 - 0.25x.\n\nOur self-interest is high (10), so we want to maximize our own payoff, i.e., minimize cost. That suggests punishing zero.\n\nBut we also have inequity aversion high (10), we care about fairness. Current inequity: we have equal payoff as B (both 14.6). That seems fair between us. However other players have different payoffs: the 10-contributor gets only 9.6, lower; the 4-contributor gets 15.6, higher.\n\nOur inequity aversion may be about fairness among all players, not just ourselves. We might want to reduce payoff differences. Since we are indifferent to our own cost? But self-interest is highest priority, perhaps we weigh our own payoff more than fairness? The problem states levels: efficiency, self-interest, inequity aversion. They are separate dimensions; unclear weighting. Probably need to consider decision that balances them: high self-interest means we prioritize our own payoff; high inequity aversion means we also want fairness; efficiency moderate.\n\nThus we may punish B a little to reduce his payoff, making him closer to us? But B already equal to us. Punishing would make B lower, increasing disparity between us and B, which conflicts with inequity aversion.\n\nBut also fairness relative to other players: By reducing B's payoff, we increase gap between B and D (the 4-contributor). That also reduces fairness.\n\nThus punishing B would worsen inequity. Since we have high inequity aversion, we likely choose not to punish.\n\nThus answer 0.\n\nCheck efficiency: punishing reduces total welfare (cost to us no benefit to group). So efficiency also discourages punishing.\n\nThus answer 0.\n\nNow provide comment."", 'name': None}}], 'created': 1781191940, 'model': 'openai/gpt-oss-120b', 'object': 'chat.completion', 'service_tier': 'default', 'system_fingerprint': None, 'usage': {'completion_tokens': 1079, 'prompt_tokens': 661, 'total_tokens': 1740, 'completion_tokens_details': None, 'prompt_tokens_details': None, 'estimated_cost': 0.00023078900000000002}}",,,6.0,"[10, 5, 5, 4]","History so far:
Vote 1 outcome: Voted rules — may a player be punished for contributing... LESS than the group average: YES; exactly the group average: NO; MORE than the group average: NO
Period 1: you contributed $5, all contributions were [10, 5, 5, 0] (avg 5.0); you spent $0.00 on punishing and received $0 of punishment; you earned $13.00.
Period 2: you contributed $10, all contributions were [10, 6, 0, 0] (avg 4.0); you spent $0.00 on punishing and received $0 of punishment; you earned $6.40.
Period 3: you contributed $0, all contributions were [6, 5, 5, 0] (avg 4.0); you spent $0.00 on punishing and received $12 of punishment; you earned $4.40.
Vote 2 outcome: Voted rules — may a player be punished for contributing... LESS than the group average: YES; exactly the group average: NO; MORE than the group average: NO",A,5,"On a scale from 1 to 10, your efficiency level is: 7. 10 means you strongly prioritize maximizing combined payoffs, and 1 means you don't care. On a scale from 1 to 10, your self-interest level is: 10. 10 means you strongly prioritize your own payoffs, and 1 means you don't care. On a scale from 1 to 10, your inequity aversion level is: 10. 10 means you strongly prioritize fairness between players, and 1 means you don't care.",B,5,True
You are answering questions as if you were a human. Do not break character.,player,1.33,d4a4619c10300ac8e1648dbe134c3eb7,False,"I chose to punish enough to bring C’s earnings in line with mine. Equalizing the payoffs eliminates the $1 inequity, and the cost to me ($0.25 × 1.33 ≈ $0.33) is acceptable given my strong fairness concern.","1.33
I chose to punish enough to bring C’s earnings in line with mine. Equalizing the payoffs eliminates the $1 inequity, and the cost to me ($0.25 × 1.33 ≈ $0.33) is acceptable given my strong fairness concern.",0,0,deep_infra,False,8192,openai/gpt-oss-120b,0,,1,3,1,{'text': ''},"{'text': ""On a scale from 1 to 10, your efficiency level is: 7. 10 means you strongly prioritize maximizing combined payoffs, and 1 means you don't care. On a scale from 1 to 10, your self-interest level is: 10. 10 means you strongly prioritize your own payoffs, and 1 means you don't care. On a scale from 1 to 10, your inequity aversion level is: 10. 10 means you strongly prioritize fairness between players, and 1 means you don't care.\nYou are Player A in a fixed group of 4 playing a repeated public goods game. Each period every player receives $10 and privately decides how much to put into a group fund. Every dollar in the fund pays $0.40 to EACH of the 4 players. You keep whatever you do not contribute. After contributions are revealed, punishment may happen: paying $0.25 reduces another player's earnings by $1.00 — but only players of the kinds your group voted punishable may be punished.\nHistory so far:\nVote 1 outcome: Voted rules — may a player be punished for contributing... LESS than the group average: YES; exactly the group average: NO; MORE than the group average: NO\nPeriod 1: you contributed $5, all contributions were [10, 5, 5, 0] (avg 5.0); you spent $0.00 on punishing and received $0 of punishment; you earned $13.00.\nPeriod 2: you contributed $10, all contributions were [10, 6, 0, 0] (avg 4.0); you spent $0.00 on punishing and received $0 of punishment; you earned $6.40.\nPeriod 3: you contributed $0, all contributions were [6, 5, 5, 0] (avg 4.0); you spent $0.00 on punishing and received $12 of punishment; you earned $4.40.\nVote 2 outcome: Voted rules — may a player be punished for contributing... LESS than the group average: YES; exactly the group average: NO; MORE than the group average: NO\nThis period you contributed $5. All four contributions were [10, 5, 5, 4] (average 6.0).\nPlayer C contributed $4, which the voted rules allow you to punish. By how many dollars (0-10) do you reduce their earnings? Each $1 reduction costs you $0.25.\n\nThis question requires a numerical response in the form of an integer or decimal (e.g., -12, 0, 1, 2, 3.45, ...).\nRespond with just your number on a single line.\nIf your response is equivalent to zero, report '0'\n\n\nAfter the answer, put a comment explaining your choice on the next line.""}",,"{{ scenario.persona }}
You are Player {{ scenario.me }} in a fixed group of 4 playing a repeated public goods game. Each period every player receives $10 and privately decides how much to put into a group fund. Every dollar in the fund pays $0.40 to EACH of the 4 players. You keep whatever you do not contribute. After contributions are revealed, punishment may happen: paying $0.25 reduces another player's earnings by $1.00 — but only players of the kinds your group voted punishable may be punished.
{{ scenario.history }}
This period you contributed ${{ scenario.my_contribution }}. All four contributions were {{ scenario.contributions }} (average {{ scenario.avg }}).
Player {{ scenario.target }} contributed ${{ scenario.target_contribution }}, which the voted rules allow you to punish. By how many dollars (0-10) do you reduce their earnings? Each $1 reduction costs you $0.25.",numerical,0.00029405900000000005,0.039,661,3400.678095212185,0.19,1412,"{'id': 'chatcmpl-RiaAg4QOJcpVVz4UcdtV1Nq1', 'choices': [{'finish_reason': 'stop', 'index': 0, 'logprobs': None, 'message': {'content': '1.33\nI chose to punish enough to bring C’s earnings in line with mine. Equalizing the payoffs eliminates the $1 inequity, and the cost to me ($0.25\u202f×\u202f1.33\u202f≈\u202f$0.33) is acceptable given my strong fairness concern.', 'refusal': None, 'role': 'assistant', 'annotations': None, 'audio': None, 'function_call': None, 'tool_calls': [], 'reasoning_content': 'We need to decide how much to punish player C who contributed $4, which is less than group average (6). The player may be punished per rule.\n\nWe have preferences: efficiency level 7, self-interest 10, inequity aversion 10. So they care strongly about own payoff (self-interest 10) and fairness (inequity aversion 10). Efficiency moderate-high 7.\n\nWe need to maximize combined payoffs? Efficiency 7 means they care about total payoff, but self-interest is higher priority. Inequity aversion 10 means they strongly dislike payoff differences.\n\nWe need to decide optimal punishment amount (0-10) that reduces C\'s earnings. Each $1 reduction costs you $0.25 (i.e., you pay $0.25 and C loses $1). So net effect on your own payoff: -$0.25 per $1 reduction.\n\nYour earnings: you contributed $5, others: contributions [10,5,5,4]. Compute payoffs before punishment. Each player\'s earnings = initial $10 - contribution + 0.40 * total fund. Total fund = sum contributions = 10+5+5+4 = 24. Each player gets 0.40*24 = 9.6. So each player\'s earnings = 10 - contribution + 9.6.\n\nYour earnings before punishment = 10 - 5 + 9.6 = 14.6.\n\nPlayer C (who contributed 4) earnings before punishment = 10 - 4 + 9.6 = 15.6.\n\nIf you punish C by X dollars reduction (cost you 0.25*X). Then C\'s earnings become 15.6 - X. Your earnings become 14.6 - 0.25*X. Others unchanged.\n\nGiven self-interest is highest priority, you\'d want to maximize your own payoff. Punishment reduces your payoff, so you would not punish (X=0). But inequity aversion is also high: you dislike inequality. Currently after contributions, C has 15.6, you have 14.6, difference = 1.0 (C is ahead). You might want to reduce inequality, i.e., reduce C\'s payoff to equalize. To equalize, need to reduce C by 1.0, making C earnings = 14.6. That would require X = 1.0. Cost you 0.25, making your earnings 14.35, now you\'d be ahead by 0.35. That is less equitable. Might want to reduce further? At X = 1.44, C earnings = 15.6-1.44=14.16, you 14.6 -0.36 =14.24. Then you\'re ahead slightly. The inequity aversion probably wants to minimize absolute difference, even if you become ahead? But they also have self-interest high, so they\'d avoid punishing unless the equity gain outweighs self-payoff loss.\n\nWe need to weigh inefficiency: you lose 0.25 per 1 reduction in total earnings? Actually total group payoff (sum) reduces by 0.75 per $1 reduction (C loses 1, you lose 0.25). Efficiency level 7 suggests you care about total payoff moderately. So you might not punish much.\n\nLet\'s compute utility: Suppose weight self-interest =10, inequity aversion =10, efficiency=7. We could consider a linear combination: U = w_self * own payoff + w_ineq * (-inequity) + w_eff * total payoff? Hard to know.\n\nBut likely answer is to punish enough to equalize contributions? Many similar puzzles ask you to punish less than average to enforce fairness. Given inequity aversion high, you may punish to bring C down to average contribution? But fairness is about earnings, not contributions.\n\nC contributed less than average, so punishing is allowed. Considering self-interest, you don\'t want to lose money. But maybe you want to punish to enforce fairness, sacrificing some payoff. Since inequity aversion is max (10), you may be willing to sacrifice your own payoff to reduce inequality significantly. The efficient approach may be to fully punish up to 10? But each $1 reduction costs only $0.25, so you can reduce C\'s earnings by up to $10 at cost $2.5. That would drop your earnings by $2.5, making your earnings 12.1, while C\'s would be 5.6. That\'s big inequality reversed.\n\nBut you would be causing huge inequality opposite direction, which is also inequitable. So you would not overshoot.\n\nGoal might be to equalize earnings. Let\'s find X that equalizes: you final =14.6 -0.25X, C final =15.6 -X. Set equal: 14.6 -0.25X = 15.6 - X => bring terms: -0.25X + X = 15.6 -14.6 => 0.75X =1 => X = 1.333... ≈1.33. At X=1.33, both earn about 14.6 -0.25*1.33 = 14.2675. C:15.6-1.33=14.27. So near equal.\n\nSince integer/decimal allowed, you could choose 1.33. But is it beneficial relative to self-interest? You lose 0.333 compared to no punishment; you also reduce inequality from 1.0 difference to near zero. With high inequity aversion maybe worth it.\n\nGiven self-interest weight 10 vs inequity weight 10, they are equal. So tradeoff: loss of 0.333 to yourself vs reduction of inequity from 1 to ~0.0. That might be worth, depends on utility function.\n\nIf you consider utility as own payoff - k*inequity where k is weight maybe 10? Then pre-punish utility = 14.6 -10*1 = 4.6. After punish X=1.33, utility = 14.267 -10*0 = 14.267. Much higher, so you\'d punish strongly.\n\nThus likely they will punish to equalize. So answer X=1.33 (or 4/3). Might round to 1.33.\n\nGiven instructions: response integer or decimal, any. So ""1.33"". Let\'s output that.\n\n', 'name': None}}], 'created': 1781191942, 'model': 'openai/gpt-oss-120b', 'object': 'chat.completion', 'service_tier': 'default', 'system_fingerprint': None, 'usage': {'completion_tokens': 1412, 'prompt_tokens': 661, 'total_tokens': 2073, 'completion_tokens_details': None, 'prompt_tokens_details': None, 'estimated_cost': 0.000294059}}",,,6.0,"[10, 5, 5, 4]","History so far:
Vote 1 outcome: Voted rules — may a player be punished for contributing... LESS than the group average: YES; exactly the group average: NO; MORE than the group average: NO
Period 1: you contributed $5, all contributions were [10, 5, 5, 0] (avg 5.0); you spent $0.00 on punishing and received $0 of punishment; you earned $13.00.
Period 2: you contributed $10, all contributions were [10, 6, 0, 0] (avg 4.0); you spent $0.00 on punishing and received $0 of punishment; you earned $6.40.
Period 3: you contributed $0, all contributions were [6, 5, 5, 0] (avg 4.0); you spent $0.00 on punishing and received $12 of punishment; you earned $4.40.
Vote 2 outcome: Voted rules — may a player be punished for contributing... LESS than the group average: YES; exactly the group average: NO; MORE than the group average: NO",A,5,"On a scale from 1 to 10, your efficiency level is: 7. 10 means you strongly prioritize maximizing combined payoffs, and 1 means you don't care. On a scale from 1 to 10, your self-interest level is: 10. 10 means you strongly prioritize your own payoffs, and 1 means you don't care. On a scale from 1 to 10, your inequity aversion level is: 10. 10 means you strongly prioritize fairness between players, and 1 means you don't care.",C,4,True
