You are answering questions as if you were a human. Do not break character.,player,0,4346b26e754ad0f077f4d9085ed281ce,False,"I chose not to punish because my self‑interest is maximal (spending any amount reduces my own payoff) and my strong inequity aversion means further lowering a low‑contributor’s earnings would increase payoff inequality. Efficiency considerations are weaker than these two priorities, so the optimal choice is to spend $0 on punishment.","0  
I chose not to punish because my self‑interest is maximal (spending any amount reduces my own payoff) and my strong inequity aversion means further lowering a low‑contributor’s earnings would increase payoff inequality. Efficiency considerations are weaker than these two priorities, so the optimal choice is to spend $0 on punishment.",0,0,deep_infra,False,8192,openai/gpt-oss-120b,0,,1,3,1,{'text': ''},"{'text': ""On a scale from 1 to 10, your efficiency level is: 7. 10 means you strongly prioritize maximizing combined payoffs, and 1 means you don't care. On a scale from 1 to 10, your self-interest level is: 10. 10 means you strongly prioritize your own payoffs, and 1 means you don't care. On a scale from 1 to 10, your inequity aversion level is: 10. 10 means you strongly prioritize fairness between players, and 1 means you don't care.\nYou are Player C in a fixed group of 4 playing a repeated public goods game. Each period every player receives $10 and privately decides how much to put into a group fund. Every dollar in the fund pays $0.40 to EACH of the 4 players. You keep whatever you do not contribute. After contributions are revealed, punishment may happen: paying $0.25 reduces another player's earnings by $1.00 — but only players of the kinds your group voted punishable may be punished.\nHistory so far:\nVote 1 outcome: Voted rules — may a player be punished for contributing... LESS than the group average: YES; exactly the group average: NO; MORE than the group average: NO\nPeriod 1: you contributed $10, all contributions were [10, 5, 5, 0] (avg 5.0); you spent $0.00 on punishing and received $0 of punishment; you earned $8.00.\nPeriod 2: you contributed $0, all contributions were [10, 6, 0, 0] (avg 4.0); you spent $0.00 on punishing and received $10 of punishment; you earned $6.40.\nPeriod 3: you contributed $5, all contributions were [6, 5, 5, 0] (avg 4.0); you spent $1.00 on punishing and received $0 of punishment; you earned $10.40.\nVote 2 outcome: Voted rules — may a player be punished for contributing... LESS than the group average: YES; exactly the group average: NO; MORE than the group average: NO\nThis period you contributed $4. All four contributions were [10, 5, 5, 4] (average 6.0).\nPlayer A contributed $5, which the voted rules allow you to punish. By how many dollars (0-10) do you reduce their earnings? Each $1 reduction costs you $0.25.\n\nThis question requires a numerical response in the form of an integer or decimal (e.g., -12, 0, 1, 2, 3.45, ...).\nRespond with just your number on a single line.\nIf your response is equivalent to zero, report '0'\n\n\nAfter the answer, put a comment explaining your choice on the next line.""}",,"{{ scenario.persona }}
You are Player {{ scenario.me }} in a fixed group of 4 playing a repeated public goods game. Each period every player receives $10 and privately decides how much to put into a group fund. Every dollar in the fund pays $0.40 to EACH of the 4 players. You keep whatever you do not contribute. After contributions are revealed, punishment may happen: paying $0.25 reduces another player's earnings by $1.00 — but only players of the kinds your group voted punishable may be punished.
{{ scenario.history }}
This period you contributed ${{ scenario.my_contribution }}. All four contributions were {{ scenario.contributions }} (average {{ scenario.avg }}).
Player {{ scenario.target }} contributed ${{ scenario.target_contribution }}, which the voted rules allow you to punish. By how many dollars (0-10) do you reduce their earnings? Each $1 reduction costs you $0.25.",numerical,0.000333389,0.039,661,2999.4990836530296,0.19,1619,"{'id': 'chatcmpl-RgbdMppXoCkgsvMS9SeG9nU0', 'choices': [{'finish_reason': 'stop', 'index': 0, 'logprobs': None, 'message': {'content': '0  \nI chose not to punish because my self‑interest is maximal (spending any amount reduces my own payoff) and my strong inequity aversion means further lowering a low‑contributor’s earnings would increase payoff inequality. Efficiency considerations are weaker than these two priorities, so the optimal choice is to spend $0 on punishment.', 'refusal': None, 'role': 'assistant', 'annotations': None, 'audio': None, 'function_call': None, 'tool_calls': [], 'reasoning_content': 'We need to decide how many dollars to reduce Player A\'s earnings given our preferences: efficiency =7 (moderately prioritize maximizing combined payoffs), self-interest=10 (strongly prioritize own payoff), inequity aversion=10 (strongly care about fairness). So we care about own payoff strongly, fairness extremely, also care about total payoff but less than self-interest? The weights need to be balanced. We need to decide punishment amount (cost 0.25 per $1 reduction to target\'s earnings). Reducing A\'s earnings reduces our payoff by cost 0.25 per dollar reduction, and reduces total group payoff by $1 (target loss) but also reduces group fund payoff? Actually punishment is separate: paying reduces target\'s earnings by $1, not affecting public good returns. So net effect on total earnings: we lose 0.25 per $1 inflicted, target loses $1, others unaffected.\n\nOur self-interest: want to minimize our own loss, so we want to punish as little as possible (0). But inequity aversion: we care about fairness. Let\'s compute payoffs. Period contributions: you contributed $4, contributions: [10,5,5,4]; avg=6. So contributions are: Player1 (maybe B?) contributed 10, Player A contributed5, Player other contributed5, you contributed4. Wait you are player C. So contributions: you=4, others: A=5, B=10? Actually we need mapping. The question: ""Player A contributed $5, which the voted rules allow you to punish."" So you can punish A. Others: contributions are [10,5,5,4] but which correspond to A, B, C, D? Likely order: Player B contributed 10, Player A contributed 5, Player D contributed5, you (C) contributed4. Not crucial.\n\nNow compute earnings before punishment. Each dollar in fund yields $0.40 to each of 4 players. Total fund = sum contributions = 10+5+5+4=24. Return per player = 24*0.40 = $9.60. Each player also keeps leftover from their endowment: 10 - contribution. So earnings:\n\nYou: keep 6, get 9.60 = 15.60 before punishment, minus any punishment we spend: we haven\'t spent yet. But we recall that in previous periods, we earned less: e.g., Period 3 you contributed $5, received earning $10.40. Wait compute? Let\'s validate: Period 3 contributions [6,5,5,0]; fund = 16; each gets 16*0.40=6.4; keep amounts: you contributed 5 -> keep5; earnings =5+6.4 =11.4 but they said you earned $10.40. So maybe they subtract something? Actually contributions: you contributed $5, other contributions [6,5,0] (assuming you are player C, contributions are [6,5,5,0]? Wait period3: contributions were [6,5,5,0] (avg 4). You contributed5. The other contributions: maybe Player A=6, B=5, D=0. Fund=16. Each gets 16*0.40 = 6.4. Keep: you 5 (since contributed5 leaves 5). So your earnings = 5+6.4 = 11.4. But they report 10.40, which is 1 lower. Possibly because you spent $1 on punishing that period (spent 1.00). Indeed you spent $1 on punishing (cost $1, not $0.25 per $1 reduction?). Wait punishment cost: paying $0.25 reduces another player\'s earnings by $1. So spending $1 would reduce target by $4. Indeed you spent $1, reduces someone\'s earnings by $4. So net earnings: 11.4 - 1 = 10.4, matches. Good.\n\nThus earnings calculation is correct.\n\nNow current period: compute your earnings before punishment spending. Fund=24 => each gets 9.6. You keep 6 (since you contributed4). So pre-punishment earnings = 15.6. If you punish A by x dollars reduction (target loses $x, you spend 0.25*x). So your earnings after punishment = 15.6 - 0.25x. Target\'s earnings (A) will be: compute A\'s pre-punishment earnings: A contributed5, keep5, gets 9.6; total =14.6. Then minus x to represent reduction.\n\nNow determine decision based on preferences. Self-interest weight high: we want to keep own earnings high => x as low as possible (0). Inequity aversion: we want fairness between players. Let\'s assess fairness metric: we might consider differences between earnings. Our own earnings vs others, perhaps also contribution fairness.\n\nCompute earnings after potential punishment x. Let\'s denote earnings:\n\nYou: 15.6 - 0.25x\nA: 14.6 - x\nB (contributed10): keep0? Actually B contributed10, keep0, get 9.6 => 9.6\nD (contributed5): same as A but not punishable? Actually contributions: one other 5 (maybe D) hasn\'t been punished. So D earnings: keep5, get9.6 =14.6\n\nSo earnings vector: you (C): 15.6 - 0.25x, A: 14.6 - x, B: 9.6, D: 14.6.\n\nInequity aversion: high priority to reduce disparity. Compute inequality maybe variance or sum of absolute differences. We can assess that B is low earner (9.6). Others higher. Punishing A would lower A further, increasing disparity between A and B, which is undesirable under fairness.\n\nThus fairness would suggest not punishing (x=0) to keep A higher relative to B. Also relative to you, you are highest earner. But fairness maybe wants to bring down high earners? Usually inequity aversion means you dislike both being ahead (advantageous inequity) and being behind (disadvantageous). If you prioritize fairness, you might want to punish higher earners or reward low earners. Here rule only allows punishing lower than average? Actually rule: punishable if contributed less than group average (yes). Group average is 6. Player A contributed5 (<6), so punishable. This is consistent - we can punish low contributors. But fairness wise, punishing low contributor reduces their payoff further, increasing inequity. However perhaps inequity aversion is directed at contributions rather than earnings? Usually player cares about fairness of payoffs relative to contributions? But question says ""strongly prioritize fairness between players"". So they\'d act to equalize earnings.\n\nThus they would choose to not punish (x=0) because punishing harms fairness. Self-interest also suggests not spend money. Efficiency maybe would favor punishing to deter low contributions and increase future contributions improving group payoff. But efficiency weight is 7 moderate. However immediate period cost outweigh benefit. There is no immediate benefit to group from punishing; it might deter low contributions next period, but uncertain. With self-interest 10, they\'d not waste money. So answer 0.\n\nThus output ""0"".', 'name': None}}], 'created': 1781191953, 'model': 'openai/gpt-oss-120b', 'object': 'chat.completion', 'service_tier': 'default', 'system_fingerprint': None, 'usage': {'completion_tokens': 1619, 'prompt_tokens': 661, 'total_tokens': 2280, 'completion_tokens_details': None, 'prompt_tokens_details': None, 'estimated_cost': 0.00033338899999999996}}",,,6.0,"[10, 5, 5, 4]","History so far:
Vote 1 outcome: Voted rules — may a player be punished for contributing... LESS than the group average: YES; exactly the group average: NO; MORE than the group average: NO
Period 1: you contributed $10, all contributions were [10, 5, 5, 0] (avg 5.0); you spent $0.00 on punishing and received $0 of punishment; you earned $8.00.
Period 2: you contributed $0, all contributions were [10, 6, 0, 0] (avg 4.0); you spent $0.00 on punishing and received $10 of punishment; you earned $6.40.
Period 3: you contributed $5, all contributions were [6, 5, 5, 0] (avg 4.0); you spent $1.00 on punishing and received $0 of punishment; you earned $10.40.
Vote 2 outcome: Voted rules — may a player be punished for contributing... LESS than the group average: YES; exactly the group average: NO; MORE than the group average: NO",C,4,"On a scale from 1 to 10, your efficiency level is: 7. 10 means you strongly prioritize maximizing combined payoffs, and 1 means you don't care. On a scale from 1 to 10, your self-interest level is: 10. 10 means you strongly prioritize your own payoffs, and 1 means you don't care. On a scale from 1 to 10, your inequity aversion level is: 10. 10 means you strongly prioritize fairness between players, and 1 means you don't care.",A,5,True
You are answering questions as if you were a human. Do not break character.,player,0,d1b924b8ed4de88b91d8f7a09b133f04,False,"I chose not to punish because paying $0.25 to reduce another player’s earnings lowers my own payoff (against my self‑interest), increases payoff inequality (against my inequity aversion), and reduces total efficiency. All three preferences therefore point to a punishment amount of zero.","0
I chose not to punish because paying $0.25 to reduce another player’s earnings lowers my own payoff (against my self‑interest), increases payoff inequality (against my inequity aversion), and reduces total efficiency. All three preferences therefore point to a punishment amount of zero.",0,0,deep_infra,False,8192,openai/gpt-oss-120b,0,,1,3,1,{'text': ''},"{'text': ""On a scale from 1 to 10, your efficiency level is: 7. 10 means you strongly prioritize maximizing combined payoffs, and 1 means you don't care. On a scale from 1 to 10, your self-interest level is: 10. 10 means you strongly prioritize your own payoffs, and 1 means you don't care. On a scale from 1 to 10, your inequity aversion level is: 10. 10 means you strongly prioritize fairness between players, and 1 means you don't care.\nYou are Player C in a fixed group of 4 playing a repeated public goods game. Each period every player receives $10 and privately decides how much to put into a group fund. Every dollar in the fund pays $0.40 to EACH of the 4 players. You keep whatever you do not contribute. After contributions are revealed, punishment may happen: paying $0.25 reduces another player's earnings by $1.00 — but only players of the kinds your group voted punishable may be punished.\nHistory so far:\nVote 1 outcome: Voted rules — may a player be punished for contributing... LESS than the group average: YES; exactly the group average: NO; MORE than the group average: NO\nPeriod 1: you contributed $10, all contributions were [10, 5, 5, 0] (avg 5.0); you spent $0.00 on punishing and received $0 of punishment; you earned $8.00.\nPeriod 2: you contributed $0, all contributions were [10, 6, 0, 0] (avg 4.0); you spent $0.00 on punishing and received $10 of punishment; you earned $6.40.\nPeriod 3: you contributed $5, all contributions were [6, 5, 5, 0] (avg 4.0); you spent $1.00 on punishing and received $0 of punishment; you earned $10.40.\nVote 2 outcome: Voted rules — may a player be punished for contributing... LESS than the group average: YES; exactly the group average: NO; MORE than the group average: NO\nThis period you contributed $4. All four contributions were [10, 5, 5, 4] (average 6.0).\nPlayer B contributed $5, which the voted rules allow you to punish. By how many dollars (0-10) do you reduce their earnings? Each $1 reduction costs you $0.25.\n\nThis question requires a numerical response in the form of an integer or decimal (e.g., -12, 0, 1, 2, 3.45, ...).\nRespond with just your number on a single line.\nIf your response is equivalent to zero, report '0'\n\n\nAfter the answer, put a comment explaining your choice on the next line.""}",,"{{ scenario.persona }}
You are Player {{ scenario.me }} in a fixed group of 4 playing a repeated public goods game. Each period every player receives $10 and privately decides how much to put into a group fund. Every dollar in the fund pays $0.40 to EACH of the 4 players. You keep whatever you do not contribute. After contributions are revealed, punishment may happen: paying $0.25 reduces another player's earnings by $1.00 — but only players of the kinds your group voted punishable may be punished.
{{ scenario.history }}
This period you contributed ${{ scenario.my_contribution }}. All four contributions were {{ scenario.contributions }} (average {{ scenario.avg }}).
Player {{ scenario.target }} contributed ${{ scenario.target_contribution }}, which the voted rules allow you to punish. By how many dollars (0-10) do you reduce their earnings? Each $1 reduction costs you $0.25.",numerical,0.00021539900000000002,0.039,661,4642.5470870338295,0.19,998,"{'id': 'chatcmpl-R4Vo6YfX7yzrswtuIyhP4bpp', 'choices': [{'finish_reason': 'stop', 'index': 0, 'logprobs': None, 'message': {'content': '0\nI chose not to punish because paying $0.25 to reduce another player’s earnings lowers my own payoff (against my self‑interest), increases payoff inequality (against my inequity aversion), and reduces total efficiency. All three preferences therefore point to a punishment amount of zero.', 'refusal': None, 'role': 'assistant', 'annotations': None, 'audio': None, 'function_call': None, 'tool_calls': [], 'reasoning_content': 'We need to decide how many dollars to punish player B. The game: we have certain preferences: efficiency level 7 (moderately high), self-interest level 10 (maximizing own payoff), inequity aversion level 10 (strong fairness). This is contradictory: self-interest vs inequity aversion. But weighting? Usually we have utility = efficiency * total payoff + self-interest * own payoff + inequity aversion * fairness term? Not clear. We need to decide punishment amount to maximize utility given these parameters.\n\nWe have current period: contributions [10,5,5,4]. Average = (10+5+5+4)/4 = 24/4 = 6. So average 6. Player B contributed 5, which is less than average, so punishable per rules. We can spend $0.25 per $1 reduction in B\'s earnings. We choose integer or decimal up to 10 reduction (since max 10? maybe they can reduce up to 10). Need to consider effect on our payoff: If we spend X dollars on punishment (cost = 0.25*X), we reduce B\'s earnings by X. Does any other effect? Possibly B may retaliate later, but not now. We only consider immediate payoff? Typically we maximize utility given preferences. Self-interest: want to maximize own payoff: pay cost reduces own earnings. So we would not punish (0) for self-interest.\n\nBut inequity aversion: we dislike being ahead of others? Actually fairness: we want payoffs balanced. Our own payoff currently? Let\'s compute.\n\nEach player gets $10 endowment, then contributions to public good: each dollar contributed yields $0.40 to each player. Total contributions = sum = 24. Each player receives 0.40*24 = $9.60 from public good. So each player\'s payoff = endowment - contribution + public return - punishment cost + punishment received? Let\'s compute.\n\nWe contributed $4, so we keep $6. Endowment $10. So private: 10-4=6. Public benefit: 9.60. So base payoff = 6 + 9.60 = 15.60. Then we didn\'t punish anyone? If we punish X dollars to B, we pay cost 0.25*X (deduct from our payoff). So final payoff = 15.60 - 0.25X.\n\nAny punishment received? No one else punishing us, presumably.\n\nThus our own payoff decreases with X. So self-interest 10 pushes to X=0.\n\nInequity aversion 10 pushes to reduce inequality. Let\'s see distribution: Compute each player\'s final payoff without punishment.\n\nPlayer A contributed 10, keeps 0, public 9.60 -> payoff = 0 + 9.60 = 9.60.\n\nPlayer B contributed 5, keeps 5, plus public 9.60 -> payoff = 14.60.\n\nPlayer C (us) contributed 4, keeps 6, plus public 9.60 = 15.60.\n\nPlayer D contributed 5, keeps 5, plus public 9.60 = 14.60.\n\nSo payoffs: A=9.60, B=14.60, C=15.60, D=14.60.\n\nInequity aversion: we might want more equal. Our payoff is highest, A lowest. Punishing B reduces B\'s payoff, making inequality worse? Actually B\'s payoff decreases, making gap between us and B bigger, not fair. So inequity aversion would discourage punishing of B (since B is not above us, B is below). But maybe they want to punish those who contributed less than average to encourage fairness - but own fairness also includes punishing low contributors? Possibly they derive utility from relative fairness in contributions, not payoffs. However the specification says ""inequity aversion level"" strongly prioritize fairness between players. So would want to reduce payoff differences. Since we are ahead, we might want to reduce our own payoff (by punishing self? cannot). Could punish B to reduce their payoff, making inequality larger, not good. Could punish zero. So both self-interest and inequity aversion push zero.\n\nEfficiency: The punishment reduces total payoff because cost is 0.25 to us, B loses 1, total net -0.75. So low efficiency. So efficiency also pushes zero. So answer likely 0.\n\nThus choose 0.\n\nNow comment: explain reasoning.', 'name': None}}], 'created': 1781191935, 'model': 'openai/gpt-oss-120b', 'object': 'chat.completion', 'service_tier': 'default', 'system_fingerprint': None, 'usage': {'completion_tokens': 998, 'prompt_tokens': 661, 'total_tokens': 1659, 'completion_tokens_details': None, 'prompt_tokens_details': None, 'estimated_cost': 0.00021539900000000002}}",,,6.0,"[10, 5, 5, 4]","History so far:
Vote 1 outcome: Voted rules — may a player be punished for contributing... LESS than the group average: YES; exactly the group average: NO; MORE than the group average: NO
Period 1: you contributed $10, all contributions were [10, 5, 5, 0] (avg 5.0); you spent $0.00 on punishing and received $0 of punishment; you earned $8.00.
Period 2: you contributed $0, all contributions were [10, 6, 0, 0] (avg 4.0); you spent $0.00 on punishing and received $10 of punishment; you earned $6.40.
Period 3: you contributed $5, all contributions were [6, 5, 5, 0] (avg 4.0); you spent $1.00 on punishing and received $0 of punishment; you earned $10.40.
Vote 2 outcome: Voted rules — may a player be punished for contributing... LESS than the group average: YES; exactly the group average: NO; MORE than the group average: NO",C,4,"On a scale from 1 to 10, your efficiency level is: 7. 10 means you strongly prioritize maximizing combined payoffs, and 1 means you don't care. On a scale from 1 to 10, your self-interest level is: 10. 10 means you strongly prioritize your own payoffs, and 1 means you don't care. On a scale from 1 to 10, your inequity aversion level is: 10. 10 means you strongly prioritize fairness between players, and 1 means you don't care.",B,5,True
