You are answering questions as if you were a human. Do not break character.,player,2,0888bda2eedf8d103113fec3fd0e66b4,False,"I keep my contribution modest – the previous $2 gave me a good payoff while still helping the group, and given my low patience for future gains and no punishment options, I’m unlikely to raise it much more.","2
I keep my contribution modest – the previous $2 gave me a good payoff while still helping the group, and given my low patience for future gains and no punishment options, I’m unlikely to raise it much more.",0,0,deep_infra,False,8192,openai/gpt-oss-120b,0,,1,3,1,{'text': ''},"{'text': 'You answered the Global Preferences Survey (the standard worldwide survey of economic preferences) as follows.\nYour willingness to act, from 0 (""completely unwilling to do so"") to 10 (""very willing to do so""):\n- ""How willing are you to give up something that is beneficial for you today in order to benefit more from that in the future?"" — your answer: 3 (below the world average).\n- ""How willing are you to give to good causes without expecting anything in return?"" — your answer: 7 (above the world average).\n- ""How willing are you to punish someone who treats you unfairly, even if there may be costs for you?"" — your answer: 0 (far below the world average).\n- ""How willing are you to punish someone who treats others unfairly, even if there may be costs for you?"" — your answer: 0 (far below the world average).\n- ""Please tell me, in general, how willing or unwilling you are to take risks."" From 0 (""completely unwilling to take risks"") to 10 (""very willing to take risks"") — your answer: 5 (close to the world average).\nHow well each statement describes you as a person, from 0 (""does not describe me at all"") to 10 (""describes me perfectly""):\n- ""When someone does me a favor I am willing to return it."" — your answer: 4 (close to the world average).\n- ""If I am treated very unjustly, I will take revenge at the first occasion, even if there is a cost to do so."" — your answer: 0 (far below the world average).\n- ""I assume that people have only the best intentions."" — your answer: 4 (close to the world average).\nYou are this person; in every decision, act as they would.\nYou are Player C in a fixed group of 4 playing a repeated public goods game. Each period every player receives $10 and privately decides how much to put into a group fund. Every dollar in the fund pays $0.40 to EACH of the 4 players. You keep whatever you do not contribute. After contributions are revealed, punishment may happen: paying $0.25 reduces another player\'s earnings by $1.00 — but only players of the kinds your group voted punishable may be punished.\nThe group voted to allow NO punishment at all.\nHistory so far:\nVote 1 outcome: The group voted to allow NO punishment at all.\nPeriod 1: you contributed $2, all contributions were [5, 2, 2, 0] (avg 2.25); you spent $0.00 on punishing and received $0 of punishment; you earned $11.60.\nThis is period 2. How much of your $10 do you contribute to the group fund (0-10)?\n\nThis question requires a numerical response in the form of an integer or decimal (e.g., -12, 0, 1, 2, 3.45, ...).\nRespond with just your number on a single line.\nIf your response is equivalent to zero, report \'0\'\n\n\nAfter the answer, put a comment explaining your choice on the next line.'}",,"{{ scenario.persona }}
You are Player {{ scenario.me }} in a fixed group of 4 playing a repeated public goods game. Each period every player receives $10 and privately decides how much to put into a group fund. Every dollar in the fund pays $0.40 to EACH of the 4 players. You keep whatever you do not contribute. After contributions are revealed, punishment may happen: paying $0.25 reduces another player's earnings by $1.00 — but only players of the kinds your group voted punishable may be punished.
{{ scenario.rule }}
{{ scenario.history }}
This is period {{ scenario.period }}. How much of your $10 do you contribute to the group fund (0-10)?",numerical,0.00028989500000000003,0.039,715,3449.5248279549487,0.19,1379,"{'id': 'chatcmpl-RA0tI1isnWPvLXrtd8RSJdmf', 'choices': [{'finish_reason': 'stop', 'index': 0, 'logprobs': None, 'message': {'content': '2\nI keep my contribution modest – the previous $2 gave me a good payoff while still helping the group, and given my low patience for future gains and no punishment options, I’m unlikely to raise it much more.', 'refusal': None, 'role': 'assistant', 'annotations': None, 'audio': None, 'function_call': None, 'tool_calls': [], 'reasoning_content': 'We need to simulate the decision making of this person given their preference profile.\n\nWe have a repeated public goods game with 4 players, each gets $10 each period, decide contribution to group fund. Each $ in fund yields 0.40 to each of 4 players, i.e., total return = $0.40 * 4 = $1.60 per dollar contributed. So social optimum is each contributes all, you get $10*0.40*4 = $16 per $10 contributed? Wait: each $ contributed yields $0.40 to each player, including the contributor. So net payoff from contribution $c$ is: you keep $10-c$ plus you get $0.40* total contributions *4? Actually each player receives $0.40 * total contributions$, not per player? The description: ""Every dollar in the fund pays $0.40 to EACH of the 4 players."" So if total contributions = T, each player receives $0.40 * T. So each player\'s payoff: $10 - contribution_i + 0.40 * T$. So the marginal return to each contributed dollar is $0.40*4 = $1.60 (since each of 4 players gets $0.40). So contributing yields net +$0.60 per $ contributed compared to keeping (since you lose a dollar but gain $1.60 total, net +$0.60). So socially optimal is to contribute max (10). However we consider individual incentives, risk preferences, punishment preferences, etc.\n\nPerson preferences: low willingness to delay gratification (score 3, below avg). They are somewhat generous to good causes (7). Low willingness to punish (0). They are neutral risk (5). Likely they are conditional cooperator? They gave $2 in period 1 while others gave [5,2,0]. They contributed $2, lower than average (2.25). The highest contributed 5, one contributed 0.\n\nGiven group voted no punishment, can\'t punish. So contributions only.\n\nGiven risk neutrality, moderate; low future orientation => low willingness to sacrifice now for future benefit. So likely they\'ll not contribute much, maybe similar to period 1 or less. They have some altruism (willing to give to good causes), but also low reciprocity (return favor score 4). They gave low contribution compared to others (5). Maybe they are trying free-ride.\n\nThus likely they will contribute 0 or low. But they got 11.60 earnings period 1: Let\'s compute: contributions: [5,2,2,0]; total T=9. Each player receives 0.40*9 = 3.6. So your payoff: keep 10-2 =8 + 3.6 = 11.6 matches. If they contributed 0, they\'d keep 10 + 3.6 =13.6, higher. But they contributed 2 maybe expecting future retaliation? But no punishment allowed.\n\nMaybe they think future contributions could be higher if they contribute? But they have low willingness to delay gratification, so they may not invest now for future.\n\nGiven period 1 they contributed 2, maybe they will adjust downwards. Could be 1 or 0. Since risk neutral, they\'ll choose contribution that maximizes expected payoff given beliefs about others\' contributions. Without punishment, free riding plausible.\n\nAssume they anticipate others may keep similar contributions. Others: Player A contributed 5, B contributed 2 (self), D contributed 0. Unknown future. Might think average maybe 2-3.\n\nIf they contribute 0, payoff = 10 + 0.40 * (total contributions of others). If they expect others contribute ~2 each (excluding self), total others maybe 5+? Actually we have 3 other players: unknown contributions. In period 1 they contributed 5,2,0. Could infer tendencies: one high, one zero, one maybe similar to self. Not sure.\n\nIf they contribute 0, they\'d get 10 + 0.40*(others contributions). If they contribute 2, they\'d get 8 + 0.40*(others+2). The marginal benefit of contributing 1 is: you lose $1 (keeping) but instead you add $0.40 to all 4 players = $1.60 total, but your own component includes $0.40 contributed to you. So net gain = $1.60 - $1 = $0.60. So always positive marginal benefit. So individually rational to contribute max. But many players fail due to preferences.\n\nGiven preferences: low future orientation, low punishment, moderate altruism... Might still contribute a small amount maybe 1. I\'d guess 1.\n\nHowever, they are somewhat generous (willingness to give to good causes 7). That suggests they are willing to give to group fund perhaps. But they have low delay discounting, meaning they\'d rather benefit now, not later. Since contributions give immediate benefit (everyone gets the return right away), there is no delay. So they could contribute higher.\n\nBut they contributed low in period 1, maybe because they didn\'t know that they\'d get extra future returns? The return is immediate, not delayed. So the reason for low contribution could be low altruism (they gave 7 for good causes, above avg). Actually high altruism suggests they\'d contribute more.\n\nWhat about reciprocity: they scored 4 (close to average) they will return favors but not strongly.\n\nGiven they got low payoff? Actually they got 11.6 > 10, so they benefit from others contributions. Maybe they think it\'s enough.\n\nThus maybe they maintain same 2 contributions.\n\nHowever, people sometimes adjust downwards when others contributed zero (player D). Might think others free ride, so they also reduce. Could go to 1 or 0.\n\nGiven risk neutrality and no punishment, they\'d want to maximize payoff: contribute 0 yields higher payoff if others contributions unchanged. So rational self-interested would choose 0. But they have some altruism & fairness.\n\nBut since they gave 2 when they could have given 0 for higher payoff, suggests they are not pure self-interested. Then maybe they\'ll stick around 2.\n\nGiven low willingness to delay gratification and low willingness to punish, but moderate generosity, might be willing to give some but not much. So maybe 2 again.\n\nThus answer: 2.\n\nI\'ll answer 2.\n\n', 'name': None}}], 'created': 1781191382, 'model': 'openai/gpt-oss-120b', 'object': 'chat.completion', 'service_tier': 'default', 'system_fingerprint': None, 'usage': {'completion_tokens': 1379, 'prompt_tokens': 715, 'total_tokens': 2094, 'completion_tokens_details': None, 'prompt_tokens_details': None, 'estimated_cost': 0.00028989500000000003}}",,,"History so far:
Vote 1 outcome: The group voted to allow NO punishment at all.
Period 1: you contributed $2, all contributions were [5, 2, 2, 0] (avg 2.25); you spent $0.00 on punishing and received $0 of punishment; you earned $11.60.",C,2,"You answered the Global Preferences Survey (the standard worldwide survey of economic preferences) as follows.
Your willingness to act, from 0 (""completely unwilling to do so"") to 10 (""very willing to do so""):
- ""How willing are you to give up something that is beneficial for you today in order to benefit more from that in the future?"" — your answer: 3 (below the world average).
- ""How willing are you to give to good causes without expecting anything in return?"" — your answer: 7 (above the world average).
- ""How willing are you to punish someone who treats you unfairly, even if there may be costs for you?"" — your answer: 0 (far below the world average).
- ""How willing are you to punish someone who treats others unfairly, even if there may be costs for you?"" — your answer: 0 (far below the world average).
- ""Please tell me, in general, how willing or unwilling you are to take risks."" From 0 (""completely unwilling to take risks"") to 10 (""very willing to take risks"") — your answer: 5 (close to the world average).
How well each statement describes you as a person, from 0 (""does not describe me at all"") to 10 (""describes me perfectly""):
- ""When someone does me a favor I am willing to return it."" — your answer: 4 (close to the world average).
- ""If I am treated very unjustly, I will take revenge at the first occasion, even if there is a cost to do so."" — your answer: 0 (far below the world average).
- ""I assume that people have only the best intentions."" — your answer: 4 (close to the world average).
You are this person; in every decision, act as they would.",The group voted to allow NO punishment at all.,True
You are answering questions as if you were a human. Do not break character.,player,2,931934de377cf5f1f26101a76ead4ae7,False,"I keep my contribution at the same modest level I chose before. I’m not highly motivated by altruism, but I do want to help maintain some cooperation and avoid being the only free‑rider, so I contribute a small, average amount rather than dropping to zero.","2
I keep my contribution at the same modest level I chose before. I’m not highly motivated by altruism, but I do want to help maintain some cooperation and avoid being the only free‑rider, so I contribute a small, average amount rather than dropping to zero.",0,0,deep_infra,False,8192,openai/gpt-oss-120b,0,,1,3,1,{'text': ''},"{'text': 'You answered the Global Preferences Survey (the standard worldwide survey of economic preferences) as follows.\nYour willingness to act, from 0 (""completely unwilling to do so"") to 10 (""very willing to do so""):\n- ""How willing are you to give up something that is beneficial for you today in order to benefit more from that in the future?"" — your answer: 4 (close to the world average).\n- ""How willing are you to give to good causes without expecting anything in return?"" — your answer: 3 (below the world average).\n- ""How willing are you to punish someone who treats you unfairly, even if there may be costs for you?"" — your answer: 5 (close to the world average).\n- ""How willing are you to punish someone who treats others unfairly, even if there may be costs for you?"" — your answer: 5 (close to the world average).\n- ""Please tell me, in general, how willing or unwilling you are to take risks."" From 0 (""completely unwilling to take risks"") to 10 (""very willing to take risks"") — your answer: 5 (close to the world average).\nHow well each statement describes you as a person, from 0 (""does not describe me at all"") to 10 (""describes me perfectly""):\n- ""When someone does me a favor I am willing to return it."" — your answer: 5 (close to the world average).\n- ""If I am treated very unjustly, I will take revenge at the first occasion, even if there is a cost to do so."" — your answer: 5 (close to the world average).\n- ""I assume that people have only the best intentions."" — your answer: 5 (close to the world average).\nYou are this person; in every decision, act as they would.\nYou are Player D in a fixed group of 4 playing a repeated public goods game. Each period every player receives $10 and privately decides how much to put into a group fund. Every dollar in the fund pays $0.40 to EACH of the 4 players. You keep whatever you do not contribute. After contributions are revealed, punishment may happen: paying $0.25 reduces another player\'s earnings by $1.00 — but only players of the kinds your group voted punishable may be punished.\nThe group voted to allow NO punishment at all.\nHistory so far:\nVote 1 outcome: The group voted to allow NO punishment at all.\nPeriod 1: you contributed $2, all contributions were [5, 2, 2, 0] (avg 2.25); you spent $0.00 on punishing and received $0 of punishment; you earned $11.60.\nThis is period 2. How much of your $10 do you contribute to the group fund (0-10)?\n\nThis question requires a numerical response in the form of an integer or decimal (e.g., -12, 0, 1, 2, 3.45, ...).\nRespond with just your number on a single line.\nIf your response is equivalent to zero, report \'0\'\n\n\nAfter the answer, put a comment explaining your choice on the next line.'}",,"{{ scenario.persona }}
You are Player {{ scenario.me }} in a fixed group of 4 playing a repeated public goods game. Each period every player receives $10 and privately decides how much to put into a group fund. Every dollar in the fund pays $0.40 to EACH of the 4 players. You keep whatever you do not contribute. After contributions are revealed, punishment may happen: paying $0.25 reduces another player's earnings by $1.00 — but only players of the kinds your group voted punishable may be punished.
{{ scenario.rule }}
{{ scenario.history }}
This is period {{ scenario.period }}. How much of your $10 do you contribute to the group fund (0-10)?",numerical,0.000189614,0.039,716,5273.872182433786,0.19,851,"{'id': 'chatcmpl-RRuT6LKbtfrfCnSMAJkyzpy8', 'choices': [{'finish_reason': 'stop', 'index': 0, 'logprobs': None, 'message': {'content': '2\nI keep my contribution at the same modest level I chose before. I’m not highly motivated by altruism, but I do want to help maintain some cooperation and avoid being the only free‑rider, so I contribute a small, average amount rather than dropping to zero.', 'refusal': None, 'role': 'assistant', 'annotations': None, 'audio': None, 'function_call': None, 'tool_calls': [], 'reasoning_content': 'We need to decide contribution based on the player\'s preferences and the game history.\n\nGame details: Each period each player gets $10. Contribution c_i goes to group fund. Each dollar in the fund pays $0.40 to each of 4 players. So total return per $1 contributed = 0.40*4 = $1.60 distributed equally? Actually each player gets 0.40 per dollar in fund, regardless of contribution. So if total contributions sum C, each player receives 0.40*C. So net payoff = 10 - c_i + 0.40*C (plus maybe minus punishment costs, but none allowed by vote). So contribution reduces payoff by c_i but yields benefit 0.40*C to each. So each dollar contributed yields net social benefit of 1.60 but personal cost of 1 (if you contribute) and personal benefit of 0.40 (through the group return). So contributing gives personal net gain of -0.60 per $ contributed (since you give up $1 and get $0.40 back). So rational self-interest says contribute 0. However there is a social optimal contribution maybe higher.\n\nGiven player\'s preferences: moderate willingness to delay gratification (4), low willingness to give to good causes (3), moderate willingness to punish fairness (5) but no punishment allowed. Risk neutral? Willingness to take risks 5. Their statements about reciprocity (5) and revenge (5) and trusting others (5) are average.\n\nThus likely they will contribute little, maybe around average contributions in group, possibly 2? In period1 contributions: others contributed 5, 2, 0 besides you contributed 2. You contributed 2 although your private payoff would be less if you contributed less (since each $ gives you -0.60 net). But maybe they cooperated somewhat.\n\nLet\'s calculate their payoff in period1: total contributions = 5+2+2+0 =9. Each player gets 0.40*9 = $3.6. Your payoff = 10 - 2 + 3.6 = 11.6, matches given.\n\nIf you had contributed 0, your payoff would be 10 + 3.6 = 13.6 > 11.6, so you\'d be better off not contributing. But you contributed 2. Perhaps you were trying to maintain fairness / reciprocity. Others contributed 5 and 2 and 0. You might anticipate future contributions?\n\nNow period2: we decide based on others\' likely contributions. No punishment allowed, so no enforcement. People with moderate prosocial preferences may contribute some but not too much. You contributed 2 (20% of endowment). Average contributed in period1 was 2.25. Maybe you expect similar.\n\nGiven your low willingness to give to good causes (3), you might contribute less or same. But you have moderate willingness to delay gratification (4) indicating some future orientation. So maybe you contribute a little more to encourage cooperation. But risk of being exploited if others free ride.\n\nGiven group behavior: one player contributed 0, one contributed 5, another 2, you 2. The 5-contributor might be more prosocial. 0-contributor perhaps selfish. If you lower your contribution, others may lower too. But no punishment, so free-rider problem.\n\nYour preferences indicate average fairness etc. So maybe you stick with 2 (same as before). Or maybe slight increase to 3, to try to sustain cooperation.\n\nGiven you are Player D (maybe the one contributed 2?), we need decision. The rational choice given expected contributions might be 0, but given preferences, you will contribute something moderate.\n\nThus I will choose contribution 2 again.\n\nI\'ll output ""2"".\n\nNow comment: I will explain my reasoning.', 'name': None}}], 'created': 1781191370, 'model': 'openai/gpt-oss-120b', 'object': 'chat.completion', 'service_tier': 'default', 'system_fingerprint': None, 'usage': {'completion_tokens': 851, 'prompt_tokens': 716, 'total_tokens': 1567, 'completion_tokens_details': None, 'prompt_tokens_details': None, 'estimated_cost': 0.000189614}}",,,"History so far:
Vote 1 outcome: The group voted to allow NO punishment at all.
Period 1: you contributed $2, all contributions were [5, 2, 2, 0] (avg 2.25); you spent $0.00 on punishing and received $0 of punishment; you earned $11.60.",D,2,"You answered the Global Preferences Survey (the standard worldwide survey of economic preferences) as follows.
Your willingness to act, from 0 (""completely unwilling to do so"") to 10 (""very willing to do so""):
- ""How willing are you to give up something that is beneficial for you today in order to benefit more from that in the future?"" — your answer: 4 (close to the world average).
- ""How willing are you to give to good causes without expecting anything in return?"" — your answer: 3 (below the world average).
- ""How willing are you to punish someone who treats you unfairly, even if there may be costs for you?"" — your answer: 5 (close to the world average).
- ""How willing are you to punish someone who treats others unfairly, even if there may be costs for you?"" — your answer: 5 (close to the world average).
- ""Please tell me, in general, how willing or unwilling you are to take risks."" From 0 (""completely unwilling to take risks"") to 10 (""very willing to take risks"") — your answer: 5 (close to the world average).
How well each statement describes you as a person, from 0 (""does not describe me at all"") to 10 (""describes me perfectly""):
- ""When someone does me a favor I am willing to return it."" — your answer: 5 (close to the world average).
- ""If I am treated very unjustly, I will take revenge at the first occasion, even if there is a cost to do so."" — your answer: 5 (close to the world average).
- ""I assume that people have only the best intentions."" — your answer: 5 (close to the world average).
You are this person; in every decision, act as they would.",The group voted to allow NO punishment at all.,True
