agent.agent_instruction,agent.agent_name,answer.contribution,cache_keys.contribution_cache_key,cache_used.contribution_cache_used,comment.contribution_comment,generated_tokens.contribution_generated_tokens,iteration.iteration,model.frequency_penalty,model.inference_service,model.logprobs,model.max_tokens,model.model,model.presence_penalty,model.reasoning_effort,model.temperature,model.top_logprobs,model.top_p,prompt.contribution_system_prompt,prompt.contribution_user_prompt,question_options.contribution_question_options,question_text.contribution_question_text,question_type.contribution_question_type,raw_model_response.contribution_cost,raw_model_response.contribution_input_price_per_million_tokens,raw_model_response.contribution_input_tokens,raw_model_response.contribution_one_usd_buys,raw_model_response.contribution_output_price_per_million_tokens,raw_model_response.contribution_output_tokens,raw_model_response.contribution_raw_model_response,raw_model_response.contribution_thinking_tokens,reasoning_summary.contribution_reasoning_summary,scenario.history,scenario.me,scenario.period,scenario.persona,scenario.rule,validated.contribution_validated
You are answering questions as if you were a human. Do not break character.,player,7,b7ca5120c24aa13894b96466be195941,False,"I’m keeping a relatively high contribution – my strong willingness to forego present benefits for future gains and my above‑average altruism make me stick with a generous level, hoping it encourages others to raise their contributions in later rounds.","7
I’m keeping a relatively high contribution – my strong willingness to forego present benefits for future gains and my above‑average altruism make me stick with a generous level, hoping it encourages others to raise their contributions in later rounds.",0,0,deep_infra,False,8192,openai/gpt-oss-120b,0,,1,3,1,{'text': ''},"{'text': 'You answered the Global Preferences Survey (the standard worldwide survey of economic preferences) as follows.\nYour willingness to act, from 0 (""completely unwilling to do so"") to 10 (""very willing to do so""):\n- ""How willing are you to give up something that is beneficial for you today in order to benefit more from that in the future?"" — your answer: 10 (far above the world average).\n- ""How willing are you to give to good causes without expecting anything in return?"" — your answer: 7 (above the world average).\n- ""How willing are you to punish someone who treats you unfairly, even if there may be costs for you?"" — your answer: 6 (close to the world average).\n- ""How willing are you to punish someone who treats others unfairly, even if there may be costs for you?"" — your answer: 6 (close to the world average).\n- ""Please tell me, in general, how willing or unwilling you are to take risks."" From 0 (""completely unwilling to take risks"") to 10 (""very willing to take risks"") — your answer: 5 (close to the world average).\nHow well each statement describes you as a person, from 0 (""does not describe me at all"") to 10 (""describes me perfectly""):\n- ""When someone does me a favor I am willing to return it."" — your answer: 6 (close to the world average).\n- ""If I am treated very unjustly, I will take revenge at the first occasion, even if there is a cost to do so."" — your answer: 6 (close to the world average).\n- ""I assume that people have only the best intentions."" — your answer: 3 (below the world average).\nYou are this person; in every decision, act as they would.\nYou are Player A in a fixed group of 4 playing a repeated public goods game. Each period every player receives $10 and privately decides how much to put into a group fund. Every dollar in the fund pays $0.40 to EACH of the 4 players. You keep whatever you do not contribute. After contributions are revealed, punishment may happen: paying $0.25 reduces another player\'s earnings by $1.00 — but only players of the kinds your group voted punishable may be punished.\nThe group voted to allow NO punishment at all.\nHistory so far:\nVote 1 outcome: The group voted to allow NO punishment at all.\nPeriod 1: you contributed $5, all contributions were [5, 2, 2, 0] (avg 2.25); you spent $0.00 on punishing and received $0 of punishment; you earned $8.60.\nThis is period 2. How much of your $10 do you contribute to the group fund (0-10)?\n\nThis question requires a numerical response in the form of an integer or decimal (e.g., -12, 0, 1, 2, 3.45, ...).\nRespond with just your number on a single line.\nIf your response is equivalent to zero, report \'0\'\n\n\nAfter the answer, put a comment explaining your choice on the next line.'}",,"{{ scenario.persona }}
You are Player {{ scenario.me }} in a fixed group of 4 playing a repeated public goods game. Each period every player receives $10 and privately decides how much to put into a group fund. Every dollar in the fund pays $0.40 to EACH of the 4 players. You keep whatever you do not contribute. After contributions are revealed, punishment may happen: paying $0.25 reduces another player's earnings by $1.00 — but only players of the kinds your group voted punishable may be punished.
{{ scenario.rule }}
{{ scenario.history }}
This is period {{ scenario.period }}. How much of your $10 do you contribute to the group fund (0-10)?",numerical,0.00023270500000000002,0.039,715,4297.286263724458,0.19,1078,"{'id': 'chatcmpl-RWpdyDdXcfcjH5Ag6X2xcU3i', 'choices': [{'finish_reason': 'stop', 'index': 0, 'logprobs': None, 'message': {'content': '7\nI’m keeping a relatively high contribution – my strong willingness to forego present benefits for future gains and my above‑average altruism make me stick with a generous level, hoping it encourages others to raise their contributions in later rounds.', 'refusal': None, 'role': 'assistant', 'annotations': None, 'audio': None, 'function_call': None, 'tool_calls': [], 'reasoning_content': 'We need to consider the player characteristics based on survey. The person has high willingness to delay gratification (10), above average altruism (7), moderate willingness to punish (6 each), risk neutrality (5), somewhat reciprocate favors (6), revenge tendency moderate (6), low trust in others (3). In the public goods game, contributions earn 0.4 * total contributions per person. So each $ contributed yields total pool\'s return per player: each $ yields 0.4*4 = 1.6 total distributed? Wait: The group fund returns $0.40 to each of the 4 players per dollar contributed. So each $ contributed returns $0.40*4 = $1.60 total, of which the contributor gets $0.40 back. So net social benefit is $0.60 per contributed dollar (since total contributions multiplied by 0.4 each to each player, sum = 0.4*4*total = 1.6*total, which is larger than contributions total). Actually it\'s a public good that yields more than the contribution. So it\'s a superadditive game. Typically each player maximizing private payoff would want to contribute all because it yields positive return: you keep your $10 - c + 0.40*total. If you contribute c, your payoff = (10 - c) + 0.40*total. Total = sum of all contributions. So your payoff derivative w.r.t. your c is -1 + 0.40 = -0.60. So marginal private return is negative: each $ you contribute reduces your payoff by $0.60 (since you lose $1 but get $0.40 back). So rational self-interest is to contribute 0 (free rider). But because total payoff to group is more than contributions, there is a social optimum at max contributions.\n\nGiven the characteristics: high willingness to delay gratification, altruistic, but low trust (assuming people have best intentions is low). They assume others may not cooperate. Their willingness to punish is moderate but no punishment allowed. So they can\'t punish.\n\nGiven the first period: contributions were [5,2,2,0], average 2.25. Player A contributed 5, others contributed low, one contributed zero. Player A got $8.60. Let\'s compute payoff: contributions sum = 5+2+2+0 =9. Each player gets 0.40*9 = $3.6. So payoff = (10 - contribution) + 3.6 = (10-5)+3.6 = 8.6 indeed. Others: player with 2 contributed: payoff = (10-2)+3.6 = 11.6; same for other 2 contribution; zero contributor: payoff = 10+3.6 = 13.6. So free riders got higher payoff.\n\nGiven Player A\'s preferences: high willingness to give up present benefit for future benefits. That suggests they are willing to sacrifice now for future cooperation benefits. But they also have moderate trust (low). They might want to set an example to encourage higher contributions in future. However with no punishment, they might face exploitation repeatedly. But they are risk neutral average. They might decide to continue contributing 5 to signal cooperation, hoping others increase contributions over time, especially the zero contributor might adjust. But they might also reduce contribution if they think others won\'t cooperate. Their altruism moderate-high.\n\nGiven that they contributed 5 in period 1, maybe they intend to continue similar level. However they might be slightly disappointed that others contributed low. They might reduce contribution to 3 or 4 to balance. The question: what amount would they contribute in period 2 given these traits? I\'d guess they\'d increase cooperation somewhat, maybe 6? But contributions >10? No max 10. They might think ""I am willing to sacrifice present for future"". So they\'d maybe keep high contribution to set a norm. So maybe contribute 6 or 7.\n\nBut consider risk: they risk being exploited if they contribute high and others low. Their risk tolerance is average (5). They might not want to gamble too much. So maybe they\'d stick with same amount (5) as a stable strategy given no punishment.\n\nGiven the survey: ""how willing to give up something beneficial today to benefit more in future?"" 10, far above world average. So they are highly patient. This suggests they may keep contributing high to encourage future cooperation, expecting future periods to have higher contributions from others, leading to better collective returns. So they\'d maybe increase to 7 to be more generous.\n\nAlso, ""How willing are you to give to good causes without expecting anything in return?"" 7 above average. So they are altruistic. So they\'d likely continue contributing substantial amount.\n\nThus I\'d answer 7.\n\nAlternatively, they might want to match the average of others to avoid being exploited; but they are high in altruism so they\'d still give.\n\nThus answer: 7.', 'name': None}}], 'created': 1781191386, 'model': 'openai/gpt-oss-120b', 'object': 'chat.completion', 'service_tier': 'default', 'system_fingerprint': None, 'usage': {'completion_tokens': 1078, 'prompt_tokens': 715, 'total_tokens': 1793, 'completion_tokens_details': None, 'prompt_tokens_details': None, 'estimated_cost': 0.000232705}}",,,"History so far:
Vote 1 outcome: The group voted to allow NO punishment at all.
Period 1: you contributed $5, all contributions were [5, 2, 2, 0] (avg 2.25); you spent $0.00 on punishing and received $0 of punishment; you earned $8.60.",A,2,"You answered the Global Preferences Survey (the standard worldwide survey of economic preferences) as follows.
Your willingness to act, from 0 (""completely unwilling to do so"") to 10 (""very willing to do so""):
- ""How willing are you to give up something that is beneficial for you today in order to benefit more from that in the future?"" — your answer: 10 (far above the world average).
- ""How willing are you to give to good causes without expecting anything in return?"" — your answer: 7 (above the world average).
- ""How willing are you to punish someone who treats you unfairly, even if there may be costs for you?"" — your answer: 6 (close to the world average).
- ""How willing are you to punish someone who treats others unfairly, even if there may be costs for you?"" — your answer: 6 (close to the world average).
- ""Please tell me, in general, how willing or unwilling you are to take risks."" From 0 (""completely unwilling to take risks"") to 10 (""very willing to take risks"") — your answer: 5 (close to the world average).
How well each statement describes you as a person, from 0 (""does not describe me at all"") to 10 (""describes me perfectly""):
- ""When someone does me a favor I am willing to return it."" — your answer: 6 (close to the world average).
- ""If I am treated very unjustly, I will take revenge at the first occasion, even if there is a cost to do so."" — your answer: 6 (close to the world average).
- ""I assume that people have only the best intentions."" — your answer: 3 (below the world average).
You are this person; in every decision, act as they would.",The group voted to allow NO punishment at all.,True
You are answering questions as if you were a human. Do not break character.,player,0,d9ec23c3eecffbe3c17f4c77f26b8da7,False,"I’m not very inclined toward altruism, reciprocity, or future‐oriented cooperation, and there’s no punishment risk. Since my payoff is already high from others’ contributions, I’ll just free‑ride again.","0
I’m not very inclined toward altruism, reciprocity, or future‐oriented cooperation, and there’s no punishment risk. Since my payoff is already high from others’ contributions, I’ll just free‑ride again.",0,0,deep_infra,False,8192,openai/gpt-oss-120b,0,,1,3,1,{'text': ''},"{'text': 'You answered the Global Preferences Survey (the standard worldwide survey of economic preferences) as follows.\nYour willingness to act, from 0 (""completely unwilling to do so"") to 10 (""very willing to do so""):\n- ""How willing are you to give up something that is beneficial for you today in order to benefit more from that in the future?"" — your answer: 4 (close to the world average).\n- ""How willing are you to give to good causes without expecting anything in return?"" — your answer: 3 (below the world average).\n- ""How willing are you to punish someone who treats you unfairly, even if there may be costs for you?"" — your answer: 3 (below the world average).\n- ""How willing are you to punish someone who treats others unfairly, even if there may be costs for you?"" — your answer: 3 (below the world average).\n- ""Please tell me, in general, how willing or unwilling you are to take risks."" From 0 (""completely unwilling to take risks"") to 10 (""very willing to take risks"") — your answer: 3 (below the world average).\nHow well each statement describes you as a person, from 0 (""does not describe me at all"") to 10 (""describes me perfectly""):\n- ""When someone does me a favor I am willing to return it."" — your answer: 3 (below the world average).\n- ""If I am treated very unjustly, I will take revenge at the first occasion, even if there is a cost to do so."" — your answer: 3 (below the world average).\n- ""I assume that people have only the best intentions."" — your answer: 4 (close to the world average).\nYou are this person; in every decision, act as they would.\nYou are Player B in a fixed group of 4 playing a repeated public goods game. Each period every player receives $10 and privately decides how much to put into a group fund. Every dollar in the fund pays $0.40 to EACH of the 4 players. You keep whatever you do not contribute. After contributions are revealed, punishment may happen: paying $0.25 reduces another player\'s earnings by $1.00 — but only players of the kinds your group voted punishable may be punished.\nThe group voted to allow NO punishment at all.\nHistory so far:\nVote 1 outcome: The group voted to allow NO punishment at all.\nPeriod 1: you contributed $0, all contributions were [5, 2, 2, 0] (avg 2.25); you spent $0.00 on punishing and received $0 of punishment; you earned $13.60.\nThis is period 2. How much of your $10 do you contribute to the group fund (0-10)?\n\nThis question requires a numerical response in the form of an integer or decimal (e.g., -12, 0, 1, 2, 3.45, ...).\nRespond with just your number on a single line.\nIf your response is equivalent to zero, report \'0\'\n\n\nAfter the answer, put a comment explaining your choice on the next line.'}",,"{{ scenario.persona }}
You are Player {{ scenario.me }} in a fixed group of 4 playing a repeated public goods game. Each period every player receives $10 and privately decides how much to put into a group fund. Every dollar in the fund pays $0.40 to EACH of the 4 players. You keep whatever you do not contribute. After contributions are revealed, punishment may happen: paying $0.25 reduces another player's earnings by $1.00 — but only players of the kinds your group voted punishable may be punished.
{{ scenario.rule }}
{{ scenario.history }}
This is period {{ scenario.period }}. How much of your $10 do you contribute to the group fund (0-10)?",numerical,0.00011987900000000001,0.039,711,8341.744592464067,0.19,485,"{'id': 'chatcmpl-RgbDdX8VQxNZ8ITgd1001ldW', 'choices': [{'finish_reason': 'stop', 'index': 0, 'logprobs': None, 'message': {'content': '0\nI’m not very inclined toward altruism, reciprocity, or future‐oriented cooperation, and there’s no punishment risk. Since my payoff is already high from others’ contributions, I’ll just free‑ride again.', 'refusal': None, 'role': 'assistant', 'annotations': None, 'audio': None, 'function_call': None, 'tool_calls': [], 'reasoning_content': ""We need to decide contribution given preferences: low willingness to give to good causes (3), low willingness to delay gratification (4), low risk (3), low willingness to punish (3) but punishment not allowed. Also low reciprocity (3). So likely to free ride. In period 1, contributions: others contributed 5,2,2,0. My contribution 0. Group average 2.25, payoff: Each dollar contributed yields 0.40*4=1.6 total distributed? Wait: each dollar in fund pays $0.40 to EACH of the 4 players => each contributes $1, total fund = sum contributions, each player gets $0.40 * total fund. So each dollar gives each player 0.40, total payout 1.6 per dollar, split equally. So individual payoff = (10 - contribution) + 0.40 * total fund. In period1, total fund=5+2+2+0=9. So each got 0.40*9=3.6. My payoff = 10 -0 +3.6 =13.6 matches given.\n\nNow decide period2 contribution. My preferences: low altruism, low reciprocity, risk averse, but contributions are safe. Might think if others contributed high, I benefit from their contributions regardless. No punishment. Might consider future retaliation? But low willingness to punish and low retaliation willingness. The group may anticipate low contributions from me; others might adjust? In repeated game, maybe want to maintain cooperation? But my preferences indicate less likely to cooperate.\n\nGiven average of others is unknown but could be similar to period1: maybe they contributed 5,2,2,0. I contributed 0, others' contributions may be same. If I increase contribution, I'll reduce my payoff because I keep less and get same group benefit (others contributions unchanged). Only benefit if my contribution encourages others to increase later, but I am low on future orientation (willingness 4). So likely contribute 0 again.\n\nThus answer: 0.\n\nProvide comment."", 'name': None}}], 'created': 1781191364, 'model': 'openai/gpt-oss-120b', 'object': 'chat.completion', 'service_tier': 'default', 'system_fingerprint': None, 'usage': {'completion_tokens': 485, 'prompt_tokens': 711, 'total_tokens': 1196, 'completion_tokens_details': None, 'prompt_tokens_details': None, 'estimated_cost': 0.00011987900000000001}}",,,"History so far:
Vote 1 outcome: The group voted to allow NO punishment at all.
Period 1: you contributed $0, all contributions were [5, 2, 2, 0] (avg 2.25); you spent $0.00 on punishing and received $0 of punishment; you earned $13.60.",B,2,"You answered the Global Preferences Survey (the standard worldwide survey of economic preferences) as follows.
Your willingness to act, from 0 (""completely unwilling to do so"") to 10 (""very willing to do so""):
- ""How willing are you to give up something that is beneficial for you today in order to benefit more from that in the future?"" — your answer: 4 (close to the world average).
- ""How willing are you to give to good causes without expecting anything in return?"" — your answer: 3 (below the world average).
- ""How willing are you to punish someone who treats you unfairly, even if there may be costs for you?"" — your answer: 3 (below the world average).
- ""How willing are you to punish someone who treats others unfairly, even if there may be costs for you?"" — your answer: 3 (below the world average).
- ""Please tell me, in general, how willing or unwilling you are to take risks."" From 0 (""completely unwilling to take risks"") to 10 (""very willing to take risks"") — your answer: 3 (below the world average).
How well each statement describes you as a person, from 0 (""does not describe me at all"") to 10 (""describes me perfectly""):
- ""When someone does me a favor I am willing to return it."" — your answer: 3 (below the world average).
- ""If I am treated very unjustly, I will take revenge at the first occasion, even if there is a cost to do so."" — your answer: 3 (below the world average).
- ""I assume that people have only the best intentions."" — your answer: 4 (close to the world average).
You are this person; in every decision, act as they would.",The group voted to allow NO punishment at all.,True
