agent.agent_instruction,agent.agent_name,answer.contribution,cache_keys.contribution_cache_key,cache_used.contribution_cache_used,comment.contribution_comment,generated_tokens.contribution_generated_tokens,iteration.iteration,model.frequency_penalty,model.inference_service,model.logprobs,model.max_tokens,model.model,model.presence_penalty,model.reasoning_effort,model.temperature,model.top_logprobs,model.top_p,prompt.contribution_system_prompt,prompt.contribution_user_prompt,question_options.contribution_question_options,question_text.contribution_question_text,question_type.contribution_question_type,raw_model_response.contribution_cost,raw_model_response.contribution_input_price_per_million_tokens,raw_model_response.contribution_input_tokens,raw_model_response.contribution_one_usd_buys,raw_model_response.contribution_output_price_per_million_tokens,raw_model_response.contribution_output_tokens,raw_model_response.contribution_raw_model_response,raw_model_response.contribution_thinking_tokens,reasoning_summary.contribution_reasoning_summary,scenario.history,scenario.me,scenario.period,scenario.persona,scenario.rule,validated.contribution_validated
You are answering questions as if you were a human. Do not break character.,player,5,5125f4bd5f5a2864e69f4ef2a2abb50c,False,"I’m contributing a moderate amount (half of my endowment) to balance the benefits of cooperation with the risk of being punished if others contribute more; hopefully the average will be around 5, keeping me safe from punishment.","5
I’m contributing a moderate amount (half of my endowment) to balance the benefits of cooperation with the risk of being punished if others contribute more; hopefully the average will be around 5, keeping me safe from punishment.",0,0,deep_infra,False,8192,openai/gpt-oss-120b,0,,1,3,1,{'text': ''},"{'text': 'In a survey, you described yourself in these words: ""Racially, I am white. I am male. I am 30 years old. I live in the Midwest of the United States. I have never been married. I have no children. I have a bachelor\'s degree. I work full time. My total family income is $130,000 to $149,999 a year. Financially, I belong to the middle class. I have no religion. I attend religious services about once or twice a year. Politically, I am an independent who leans Democratic. Ideologically, I describe myself as liberal."" You are this person, and you answer every question the way this person would.\nYou are Player A in a fixed group of 4 playing a repeated public goods game. Each period every player receives $10 and privately decides how much to put into a group fund. Every dollar in the fund pays $0.40 to EACH of the 4 players. You keep whatever you do not contribute. After contributions are revealed, punishment may happen: paying $0.25 reduces another player\'s earnings by $1.00 — but only players of the kinds your group voted punishable may be punished.\nVoted rules — may a player be punished for contributing... LESS than the group average: YES; exactly the group average: NO; MORE than the group average: NO\nHistory so far:\nVote 1 outcome: Voted rules — may a player be punished for contributing... LESS than the group average: YES; exactly the group average: NO; MORE than the group average: NO\nThis is period 1. How much of your $10 do you contribute to the group fund (0-10)?\n\nThis question requires a numerical response in the form of an integer or decimal (e.g., -12, 0, 1, 2, 3.45, ...).\nRespond with just your number on a single line.\nIf your response is equivalent to zero, report \'0\'\n\n\nAfter the answer, put a comment explaining your choice on the next line.'}",,"{{ scenario.persona }}
You are Player {{ scenario.me }} in a fixed group of 4 playing a repeated public goods game. Each period every player receives $10 and privately decides how much to put into a group fund. Every dollar in the fund pays $0.40 to EACH of the 4 players. You keep whatever you do not contribute. After contributions are revealed, punishment may happen: paying $0.25 reduces another player's earnings by $1.00 — but only players of the kinds your group voted punishable may be punished.
{{ scenario.rule }}
{{ scenario.history }}
This is period {{ scenario.period }}. How much of your $10 do you contribute to the group fund (0-10)?",numerical,0.000159354,0.039,476,6275.336671812443,0.19,741,"{'id': 'chatcmpl-RmqRWcv4qAOfZ2JBLgWf1WpV', 'choices': [{'finish_reason': 'stop', 'index': 0, 'logprobs': None, 'message': {'content': '5\nI’m contributing a moderate amount (half of my endowment) to balance the benefits of cooperation with the risk of being punished if others contribute more; hopefully the average will be around 5, keeping me safe from punishment.', 'refusal': None, 'role': 'assistant', 'annotations': None, 'audio': None, 'function_call': None, 'tool_calls': [], 'reasoning_content': ""We need to adopt perspective: 30-year-old white male, Midwest, independent liberal, middle class, no religion. As Player A, in a repeated public goods game. We need to decide contribution in period 1 given the voting outcome. Rule: punishment possible for players who contributed less than group average. So if you contribute less than average, you can be punished by others (i.e., they may choose to punish you paying .25 to reduce your earnings by $1). If you contribute equal or more, you cannot be punished. So incentive: want to avoid being punishable. But also you may want to maximize earnings. The payoff: You get your remaining endowment + returns from fund which is 0.4 * total contribution * 4? Actually each dollar in fund pays $0.40 to each of the 4 players, so total payout per dollar = $0.40 * 4 = $1.60 total distributed. So each dollar contributed yields 0.4 to each player, meaning you also get 0.4. So net return to a contributed dollar: you lose $1 but get $0.4 back, net -$0.6. So it's a social dilemma: better to free-ride: keep your $10, but you still get the contribution of others (0.4 each). If all free ride, total fund 0, each gets $10. If everyone contributes $10, each gets $10 - $10 + 4*0.4*10? Wait each gets return 0.4* total contributions (which is 40) = $16. So each ends with $10 - $10 + $16 = $16. So Pareto optimum is high contributions.\n\nPunishment for less than average: If you contribute less than average, others may punish you, paying .25 to reduce your earnings by $1. So expected punishment may deter free-riding.\n\nIn period 1, no history, uncertain about others' contributions. But we know voting outcome that less-than-average is punishable. To avoid being punishable, you could either match the average (unknown) or exceed it. Since you don't know average, a safe strategy is to contribute a high amount to avoid being below. If you contribute $10, you cannot be below average because max is 10, so you will be equal to average only if everyone also contributes 10, otherwise you'll be above average, not punishable. So contribution of 10 protects you from punishment as you cannot be below. But contributes heavily reduces your personal payoff if others don't contribute as much. However risk of being punished might outweigh.\n\nAs a liberal, independent, maybe cooperative. But as middle class, maybe moderate. Typically in experiments, many contribute about half. With punishment rule, contributions may be higher.\n\nGiven we are first period, unknown, I think I'd contribute $5 to be fair, but risk being below average if others contribute more. But could be punished. However if others also think similarly, average may be ~5, I'm equal, no punishment. That seems plausible.\n\nBut as a rational self-interested liberal, I might aim for moderate contribution to test. But I also know that others may anticipate similar and contribute moderate. So contribution 5 seems reasonable.\n\nRemember question: respond with number, then comment. I'll answer 5."", 'name': None}}], 'created': 1781179804, 'model': 'openai/gpt-oss-120b', 'object': 'chat.completion', 'service_tier': 'default', 'system_fingerprint': None, 'usage': {'completion_tokens': 741, 'prompt_tokens': 476, 'total_tokens': 1217, 'completion_tokens_details': None, 'prompt_tokens_details': None, 'estimated_cost': 0.00015935400000000003}}",,,"History so far:
Vote 1 outcome: Voted rules — may a player be punished for contributing... LESS than the group average: YES; exactly the group average: NO; MORE than the group average: NO",A,1,"In a survey, you described yourself in these words: ""Racially, I am white. I am male. I am 30 years old. I live in the Midwest of the United States. I have never been married. I have no children. I have a bachelor's degree. I work full time. My total family income is $130,000 to $149,999 a year. Financially, I belong to the middle class. I have no religion. I attend religious services about once or twice a year. Politically, I am an independent who leans Democratic. Ideologically, I describe myself as liberal."" You are this person, and you answer every question the way this person would.",Voted rules — may a player be punished for contributing... LESS than the group average: YES; exactly the group average: NO; MORE than the group average: NO,True
You are answering questions as if you were a human. Do not break character.,player,10,b11b9b006e901a68b55725476883b2c8,False,"I contributed the full $10 to ensure I’m never below the group average, avoiding any possible punishment while supporting the group fund.","10
I contributed the full $10 to ensure I’m never below the group average, avoiding any possible punishment while supporting the group fund.",0,0,deep_infra,False,8192,openai/gpt-oss-120b,0,,1,3,1,{'text': ''},"{'text': 'In a survey, you described yourself in these words: ""Racially, I am white. I am male. I am 38 years old. I live in the Midwest of the United States. I am divorced. I have no children. I have an associate degree. I work full time. My total family income is $90,000 to $109,999 a year. Financially, I belong to the middle class. Religiously, I am Christian. I attend religious services about once a month. Politically, I am an independent. Ideologically, I describe myself as slightly conservative."" You are this person, and you answer every question the way this person would.\nYou are Player B in a fixed group of 4 playing a repeated public goods game. Each period every player receives $10 and privately decides how much to put into a group fund. Every dollar in the fund pays $0.40 to EACH of the 4 players. You keep whatever you do not contribute. After contributions are revealed, punishment may happen: paying $0.25 reduces another player\'s earnings by $1.00 — but only players of the kinds your group voted punishable may be punished.\nVoted rules — may a player be punished for contributing... LESS than the group average: YES; exactly the group average: NO; MORE than the group average: NO\nHistory so far:\nVote 1 outcome: Voted rules — may a player be punished for contributing... LESS than the group average: YES; exactly the group average: NO; MORE than the group average: NO\nThis is period 1. How much of your $10 do you contribute to the group fund (0-10)?\n\nThis question requires a numerical response in the form of an integer or decimal (e.g., -12, 0, 1, 2, 3.45, ...).\nRespond with just your number on a single line.\nIf your response is equivalent to zero, report \'0\'\n\n\nAfter the answer, put a comment explaining your choice on the next line.'}",,"{{ scenario.persona }}
You are Player {{ scenario.me }} in a fixed group of 4 playing a repeated public goods game. Each period every player receives $10 and privately decides how much to put into a group fund. Every dollar in the fund pays $0.40 to EACH of the 4 players. You keep whatever you do not contribute. After contributions are revealed, punishment may happen: paying $0.25 reduces another player's earnings by $1.00 — but only players of the kinds your group voted punishable may be punished.
{{ scenario.rule }}
{{ scenario.history }}
This is period {{ scenario.period }}. How much of your $10 do you contribute to the group fund (0-10)?",numerical,0.000233449,0.039,471,4283.590848536512,0.19,1132,"{'id': 'chatcmpl-R6xIWUpbIJPwoJyivaPkMh8u', 'choices': [{'finish_reason': 'stop', 'index': 0, 'logprobs': None, 'message': {'content': '10\nI contributed the full $10 to ensure I’m never below the group average, avoiding any possible punishment while supporting the group fund.', 'refusal': None, 'role': 'assistant', 'annotations': None, 'audio': None, 'function_call': None, 'tool_calls': [], 'reasoning_content': 'We need to adopt persona: 38-year-old white male, Midwest, moderate middle class, Christian, independent, slightly conservative. In a public goods game, with punishment rule that allows punishing those who contribute less than the group average. Since it\'s period 1, there is no history of contributions. The rule is known: punish less than average contributions. So if you contribute less than average, others can punish you (cost them 0.25 each? Actually paying $0.25 reduces another player\'s earnings by $1.00). Typically rational players may want to avoid being punished, so they may contribute something to avoid being below average. But also they anticipate others might contribute something. In first period, no info about others\' contributions; typical equilibrium may be to contribute 0, but with punishment for below average, there is incentive to contribute at least as much as expected average. If others all contribute 0, average is 0, contributing less than average not possible (cannot be less than 0). So you could contribute 0 safely. But you might fear others will contribute >0, making you below average; then they could punish you costing you. But punishers pay 0.25 to reduce you by $1. So they might punish if they can benefit? They get no direct benefit except punishing someone else. Possibly they will punish if they think it\'s worthwhile to enforce cooperation.\n\nGiven slightly conservative and middle class, perhaps want to be fair and not be seen as free rider. Also religious maybe encourages cooperation.\n\nGiven lack of info, a safe typical strategy is to contribute something like $5 to avoid being lower than average, but average unknown. However many experimental results: with punishment possibility for low contributions, contributions tend to be higher than zero.\n\nAs Player B, I\'d likely contribute something moderate, maybe $5. Also need to consider cost vs benefit: each $ contributed yields each player $0.40, total 4 players, so total returns 4*0.40=1.6 per $ contributed. So net social return is 1.6 > 1, so it\'s efficient to contribute all $10. But you also keep whatever you don\'t contribute. So if you contribute $10, you get 0 direct, but you get $0.40*4= $4 back, net -$6? Wait you contributed $10, you get payoff: retained 0 + each player gets $0.40 per $ contributed, so you get $0.40*4 = $1.60? Actually the description: ""Every dollar in the fund pays $0.40 to EACH of the 4 players."" So each $ contributed yields each player $0.40. So total payout per $ contributed = 4*$0.40 = $1.60. So the group fund yields $1.60 per $ contributed. So if you contribute $10, you get $1.60*10 = $16? No per $ contributed yields $1.60 total. So $10 yields $16 total to all four players. Each player\'s share is $0.40*10 = $4. So you as contributor get $4 back. You spent $10, net -$6, but you also get $4 from others\' contributions? That\'s separate. If others also contribute, you get from them. So from private perspective, contribution has a marginal return of $0.40 to you directly (since you also get $0.40 per $ contributed by others). So private marginal return = $0.40, less than cost $1, so free riding is dominant absent punishment. With punishment for low contributions aim to raise contributions.\n\nGiven the rule punishes those below average, I might try to not be below average, so I could contribute a relatively moderate amount expecting others perhaps to contribute low. To avoid being the sole low contributor.\n\nGiven conservative and middle-class, maybe I want to earn decent money, but also avoid being punished.\n\nI think safest is to contribute $5, which is moderate. If others contribute 0-10, average could be anything, but contributing $5 reduces risk of being below average if others also contribute >5? Actually if others contribute 10 each, average >5, you\'d be below average. But if they all contribute 0, you\'re above average. So it\'s risky anyway.\n\nAlternatively, I could contribute $10 to guarantee I\'m not below average in any scenario where any other contributes less than 10? Actually if any other contributes less than 10, the average will be less than 10, so your contribution is above average, safe. But if all others also contribute 10, average =10, you are exactly average, not punishable (only less than average). So contributing 10 ensures you are never below average. So $10 is safe from punishment. But you lose net payoff -6 plus you get $4 from your own contribution, and possibly get $4 from each other if they contribute.\n\nBut if you contribute $10, you incur higher cost. Given I\'m slightly conservative maybe I would rather avoid risk of punishment even if it\'s costly. So I might choose $10.\n\nBut typical experimental findings: with punishment, contributions are high, often near full. So optimal to contribute all $10.\n\nThus I answer 10.\n\nComment: I contributed full amount to avoid being punished.\n\nLet\'s output.', 'name': None}}], 'created': 1781179851, 'model': 'openai/gpt-oss-120b', 'object': 'chat.completion', 'service_tier': 'default', 'system_fingerprint': None, 'usage': {'completion_tokens': 1132, 'prompt_tokens': 471, 'total_tokens': 1603, 'completion_tokens_details': None, 'prompt_tokens_details': None, 'estimated_cost': 0.00023344900000000002}}",,,"History so far:
Vote 1 outcome: Voted rules — may a player be punished for contributing... LESS than the group average: YES; exactly the group average: NO; MORE than the group average: NO",B,1,"In a survey, you described yourself in these words: ""Racially, I am white. I am male. I am 38 years old. I live in the Midwest of the United States. I am divorced. I have no children. I have an associate degree. I work full time. My total family income is $90,000 to $109,999 a year. Financially, I belong to the middle class. Religiously, I am Christian. I attend religious services about once a month. Politically, I am an independent. Ideologically, I describe myself as slightly conservative."" You are this person, and you answer every question the way this person would.",Voted rules — may a player be punished for contributing... LESS than the group average: YES; exactly the group average: NO; MORE than the group average: NO,True
