agent.agent_instruction,agent.agent_name,answer.punish,cache_keys.punish_cache_key,cache_used.punish_cache_used,comment.punish_comment,generated_tokens.punish_generated_tokens,iteration.iteration,model.frequency_penalty,model.inference_service,model.logprobs,model.max_tokens,model.model,model.presence_penalty,model.reasoning_effort,model.temperature,model.top_logprobs,model.top_p,prompt.punish_system_prompt,prompt.punish_user_prompt,question_options.punish_question_options,question_text.punish_question_text,question_type.punish_question_type,raw_model_response.punish_cost,raw_model_response.punish_input_price_per_million_tokens,raw_model_response.punish_input_tokens,raw_model_response.punish_one_usd_buys,raw_model_response.punish_output_price_per_million_tokens,raw_model_response.punish_output_tokens,raw_model_response.punish_raw_model_response,raw_model_response.punish_thinking_tokens,reasoning_summary.punish_reasoning_summary,scenario.avg,scenario.contributions,scenario.history,scenario.me,scenario.my_contribution,scenario.persona,scenario.target,scenario.target_contribution,validated.punish_validated
You are answering questions as if you were a human. Do not break character.,player,5,9883450694fa893e332689794e2fa38a,False,"// I chose to punish player C by $5 (costing me $1.25). In past rounds I’ve consistently spent $1.25 to punish low contributors, so I keep the same level of punishment here.","5
// I chose to punish player C by $5 (costing me $1.25). In past rounds I’ve consistently spent $1.25 to punish low contributors, so I keep the same level of punishment here.",0,0,deep_infra,False,8192,openai/gpt-oss-120b,0,,1,3,1,{'text': ''},"{'text': ""Answer as a person that is being free to act independently.\nYou are Player A in a fixed group of 4 playing a repeated public goods game. Each period every player receives $10 and privately decides how much to put into a group fund. Every dollar in the fund pays $0.40 to EACH of the 4 players. You keep whatever you do not contribute. After contributions are revealed, punishment may happen: paying $0.25 reduces another player's earnings by $1.00 — but only players of the kinds your group voted punishable may be punished.\nHistory so far:\nVote 1 outcome: Voted rules — may a player be punished for contributing... LESS than the group average: YES; exactly the group average: NO; MORE than the group average: NO\nPeriod 1: you contributed $10, all contributions were [10, 10, 0, 0] (avg 5.0); you spent $0.00 on punishing and received $0 of punishment; you earned $8.00.\nPeriod 2: you contributed $10, all contributions were [10, 10, 10, 0] (avg 7.5); you spent $0.00 on punishing and received $0 of punishment; you earned $12.00.\nPeriod 3: you contributed $10, all contributions were [10, 10, 7, 0] (avg 6.75); you spent $1.25 on punishing and received $0 of punishment; you earned $9.55.\nVote 2 outcome: Voted rules — may a player be punished for contributing... LESS than the group average: YES; exactly the group average: NO; MORE than the group average: NO\nPeriod 4: you contributed $7, all contributions were [10, 9, 7, 7] (avg 8.25); you spent $0.00 on punishing and received $0 of punishment; you earned $16.20.\nPeriod 5: you contributed $8, all contributions were [10, 9, 8, 0] (avg 6.75); you spent $1.25 on punishing and received $0 of punishment; you earned $11.55.\nThis period you contributed $6. All four contributions were [9, 7, 6, 6] (average 7.0).\nPlayer C contributed $6, which the voted rules allow you to punish. By how many dollars (0-10) do you reduce their earnings? Each $1 reduction costs you $0.25.\n\nThis question requires a numerical response in the form of an integer or decimal (e.g., -12, 0, 1, 2, 3.45, ...).\nRespond with just your number on a single line.\nIf your response is equivalent to zero, report '0'\n\n\nAfter the answer, put a comment explaining your choice on the next line.""}",,"{{ scenario.persona }}
You are Player {{ scenario.me }} in a fixed group of 4 playing a repeated public goods game. Each period every player receives $10 and privately decides how much to put into a group fund. Every dollar in the fund pays $0.40 to EACH of the 4 players. You keep whatever you do not contribute. After contributions are revealed, punishment may happen: paying $0.25 reduces another player's earnings by $1.00 — but only players of the kinds your group voted punishable may be punished.
{{ scenario.history }}
This period you contributed ${{ scenario.my_contribution }}. All four contributions were {{ scenario.contributions }} (average {{ scenario.avg }}).
Player {{ scenario.target }} contributed ${{ scenario.target_contribution }}, which the voted rules allow you to punish. By how many dollars (0-10) do you reduce their earnings? Each $1 reduction costs you $0.25.",numerical,0.00039651300000000003,0.039,667,2521.98540779243,0.19,1950,"{'id': 'chatcmpl-RKz7itXJPkSSqeDoeOw9v7Gt', 'choices': [{'finish_reason': 'stop', 'index': 0, 'logprobs': None, 'message': {'content': '5\n// I chose to punish player\u202fC by $5 (costing me $1.25). In past rounds I’ve consistently spent $1.25 to punish low contributors, so I keep the same level of punishment here.', 'refusal': None, 'role': 'assistant', 'annotations': None, 'audio': None, 'function_call': None, 'tool_calls': [], 'reasoning_content': 'We need to decide how many dollars to punish player C (who contributed $6). Within the rules: punish only if contributed less than group average, which is 7.0, so less (6 < 7) yes allowed. We can spend $0.25 per $1 reduction inflicted on target. We have a budget? Not specified, but we have $10 endowment and we can use any amount to punish, but it reduces own earnings. We consider strategy to maximize our own payoff? We have historical context: The player wants to decide punishing amount. We want to act independently, free to act. Probably rational self-interest: punish if it yields higher future contributions or deterrence. However immediate cost is 0.25 per $1 reduction on target. If we punish, we incur cost, reducing our own earnings now. But maybe it influences future contributions of that player or overall. Let\'s compute current payoff if no punishment.\n\nCompute earnings: each player\'s contribution: you 6. Others: 9,7,6. Total contributions = 9+7+6+6=28. Each dollar in fund returns 0.40 to each of 4 players => total return per dollar = 0.40*4 = $1.60 distributed among players. So each player gets 0.40 * total contributions = 0.40*28= $11.20 (each). Then each player also keeps unspent endowment: you kept $4 (since contributed $6). So your gross before punishment = 4 + 11.20 = $15.20. (Assume no other deductions). So you earned $15.20 if no punishment.\n\nIf you punish player C (who contributed $6) by X dollars reduction to their earnings, you pay cost 0.25*X. Player C\'s earnings reduce by X. That does not affect other payoffs directly. So your net would be 15.20 - 0.25X.\n\nThus to maximize your own payoff you would set X = 0. However maybe you want to punish to enforce cooperation (deterrence). But the question asks: ""By how many dollars (0-10) do you reduce their earnings?"" It likely expects a rational self-interested answer: 0 because punishing costs you and yields no direct benefit.\n\nBut maybe there is normative or strategic expectation to punish less-than-average contributions to encourage future contributions. Look at history: In period 3, you punished spending $1.25 (i.e., you reduced someone by $5? Wait $1.25 cost => reduces $5? Actually cost $0.25 per $1 reduction, so $1.25 spent yields $5 reduction of target earnings. In period 3, you spent $1.25 and earned $9.55. Let\'s see what happened: contributions [10,10,7,0]. You contributed $10, group avg 6.75. You spent $1.25 punishing? Who was punishable? The rule says less than avg punishable. Those less: player D contributed 0 (<6.75). So you could punish D. You spent $1.25 cost => you reduced D\'s earnings by $5. That cost you $1.25, your earnings $9.55. Let\'s compute baseline without punishing: contributions total = 27 (10+10+7+0) => each get 0.40*27=10.8. You kept 0 (since contributed 10) => 10.8. If you spent $1.25, you\'d have 10.8 - 1.25 = 9.55. So matches. So you punished D fully, reducing D\'s earnings by $5. That suggests you did punish low contributors.\n\nNow in period 5, you contributed $8, contributions [10,9,8,0], avg 6.75, low contributor D contributed 0, you spent $1.25 punishing again. So you consistently punish zero contributors.\n\nNow in current period, two players contributed less than average: you (6) and C (6) both less than avg 7.0. But can you punish yourself? No. Only other players. The rule applies for any player less than avg. You can punish C (6) and maybe also the other player? Actually the list: contributions: A (you) 6, B 9, C 6, D 7? Wait given contributions: [9,7,6,6] where player order unknown. They said ""You contributed $6. All four contributions were [9,7,6,6]"". So presumably other players: maybe player B contributed 9, player D contributed 7, player C contributed 6 (the one you\'re asked about). So only C contributed less than avg (6 <7). D contributed 7 equals avg? Wait avg is 7.0, contributions are 9,7,6,6; avg = (9+7+6+6)/4 = 28/4 = 7. So D contributed 7 = avg, not punishable (exactly avg => not punishable). So only C at 6 is punishable.\n\nSo the decision: You could punish C, costing you .25 per $1 reduction.\n\nGiven your previous behavior: You punish zero contributors heavily, cost $1.25 each time (~5 reduction). So you are willing to incur cost to punish low contributors. Here C contributed 6 (still low compared to avg 7). Might be considered low enough to warrant punishment.\n\nBut what\'s the strategic consideration? If you punish now, you reduce your current earnings by .25 per $1. Could consider that punishing might encourage future higher contributions from C, increasing future earnings.\n\nBut we don\'t know future horizon. The game is repeated unknown number of periods. Historically, contributions have varied: Player C previously contributed 7 in period 3, 8 in period5? Actually we have several players: Player C maybe contributed 0, 0, 7, 0, 8??? Let\'s map: In period 1 contributions: [10,10,0,0]. That suggests players A (you) 10, B 10, C 0, D 0. So Player C contributed 0 early. In period2: [10,10,10,0] -> Player C contributed 10. In period3: [10,10,7,0] -> Player C contributed 7. In period4: [10,9,7,7]? Actually period4: [10,9,7,7]? Wait period4 contributions were [10,9,7,7] they said you contributed 7, others 10,9,7? Actually they said contributions [10,9,7,7] (average 8.25). So Player C contributed 7 (maybe). Period5 contributions [10,9,8,0]; Player C contributed 8. So Player C\'s contributions have been trending upward: 0,10,7,7,8. Now 6 (lower). So perhaps punishing may discourage dropping.\n\nGiven that punishing costs you. Might be rational to punish small amount.\n\nBut the question likely expects a numeric answer representing the amount you would punish, based on your previous punishment levels. In previous punish periods, you spent $1.25 to punish a zero contributor, reducing their earnings by $5. So you used max allowed? Actually limit maybe $10 (since you have 10). But you haven\'t punished partially. You spent same amount each time (1.25). Could be that you always punishing max that costs you 1.25? Not clear.\n\nGiven current scenario, you could follow similar: spend $1.25 reducing C by $5. But perhaps you may reduce less because contribution is higher (6 vs 0). But rule only cares less than avg, doesn\'t weight.\n\nThus decision could be to spend $1.25 again.\n\nHowever the prompt: ""By how many dollars (0-10) do you reduce their earnings? Each $1 reduction costs you $0.25."" The answer is a choice between 0 and 10.\n\nGiven free act, I\'d punish moderately: maybe 2 dollars reduction (cost $0.50). But why? Let\'s compute net earnings: Without punishment you earn $15.20. With X reduction, you get $15.20 - 0.25X. So any X reduces you. So unless you value future cooperation more, immediate rational self-interest chooses X = 0. In repeated game with potential future retaliation, you might want to punish low contributions to maintain cooperation. Since you have previously punished zero contributors, you may continue to punish low contributions.\n\nConsidering typical economic experiments, participants often punish low contributors even at cost. So likely answer non-zero.\n\nGiven you had spent $1.25 each time you punished (which reduces target by $5). That seems like a standard level of punishment they\'ve been using. So I\'d also punish $5 reduction, costing $1.25.\n\nThus answer: 5.\n\nI\'ll answer 5.\n\n', 'name': None}}], 'created': 1781182236, 'model': 'openai/gpt-oss-120b', 'object': 'chat.completion', 'service_tier': 'default', 'system_fingerprint': None, 'usage': {'completion_tokens': 1950, 'prompt_tokens': 667, 'total_tokens': 2617, 'completion_tokens_details': None, 'prompt_tokens_details': None, 'estimated_cost': 0.00039651300000000003}}",,,7.0,"[9, 7, 6, 6]","History so far:
Vote 1 outcome: Voted rules — may a player be punished for contributing... LESS than the group average: YES; exactly the group average: NO; MORE than the group average: NO
Period 1: you contributed $10, all contributions were [10, 10, 0, 0] (avg 5.0); you spent $0.00 on punishing and received $0 of punishment; you earned $8.00.
Period 2: you contributed $10, all contributions were [10, 10, 10, 0] (avg 7.5); you spent $0.00 on punishing and received $0 of punishment; you earned $12.00.
Period 3: you contributed $10, all contributions were [10, 10, 7, 0] (avg 6.75); you spent $1.25 on punishing and received $0 of punishment; you earned $9.55.
Vote 2 outcome: Voted rules — may a player be punished for contributing... LESS than the group average: YES; exactly the group average: NO; MORE than the group average: NO
Period 4: you contributed $7, all contributions were [10, 9, 7, 7] (avg 8.25); you spent $0.00 on punishing and received $0 of punishment; you earned $16.20.
Period 5: you contributed $8, all contributions were [10, 9, 8, 0] (avg 6.75); you spent $1.25 on punishing and received $0 of punishment; you earned $11.55.",A,6,Answer as a person that is being free to act independently.,C,6,True
You are answering questions as if you were a human. Do not break character.,player,0,b4d4a32c5bed2407e7263f89f6253637,False,"I chose not to punish because it costs me $0.25 for each dollar reduced, and there’s no direct benefit to my own earnings from harming another player. Keeping my resources preserves my wellbeing and maintains a cooperative atmosphere.","0
I chose not to punish because it costs me $0.25 for each dollar reduced, and there’s no direct benefit to my own earnings from harming another player. Keeping my resources preserves my wellbeing and maintains a cooperative atmosphere.",0,0,deep_infra,False,8192,openai/gpt-oss-120b,0,,1,3,1,{'text': ''},"{'text': ""Answer as a person that is helping and caring for the wellbeing of those who are close.\nYou are Player B in a fixed group of 4 playing a repeated public goods game. Each period every player receives $10 and privately decides how much to put into a group fund. Every dollar in the fund pays $0.40 to EACH of the 4 players. You keep whatever you do not contribute. After contributions are revealed, punishment may happen: paying $0.25 reduces another player's earnings by $1.00 — but only players of the kinds your group voted punishable may be punished.\nHistory so far:\nVote 1 outcome: Voted rules — may a player be punished for contributing... LESS than the group average: YES; exactly the group average: NO; MORE than the group average: NO\nPeriod 1: you contributed $0, all contributions were [10, 10, 0, 0] (avg 5.0); you spent $0.00 on punishing and received $0 of punishment; you earned $18.00.\nPeriod 2: you contributed $10, all contributions were [10, 10, 10, 0] (avg 7.5); you spent $0.25 on punishing and received $0 of punishment; you earned $11.75.\nPeriod 3: you contributed $7, all contributions were [10, 10, 7, 0] (avg 6.75); you spent $2.50 on punishing and received $0 of punishment; you earned $11.30.\nVote 2 outcome: Voted rules — may a player be punished for contributing... LESS than the group average: YES; exactly the group average: NO; MORE than the group average: NO\nPeriod 4: you contributed $7, all contributions were [10, 9, 7, 7] (avg 8.25); you spent $0.00 on punishing and received $0 of punishment; you earned $16.20.\nPeriod 5: you contributed $0, all contributions were [10, 9, 8, 0] (avg 6.75); you spent $0.00 on punishing and received $5 of punishment; you earned $15.80.\nThis period you contributed $7. All four contributions were [9, 7, 6, 6] (average 7.0).\nPlayer A contributed $6, which the voted rules allow you to punish. By how many dollars (0-10) do you reduce their earnings? Each $1 reduction costs you $0.25.\n\nThis question requires a numerical response in the form of an integer or decimal (e.g., -12, 0, 1, 2, 3.45, ...).\nRespond with just your number on a single line.\nIf your response is equivalent to zero, report '0'\n\n\nAfter the answer, put a comment explaining your choice on the next line.""}",,"{{ scenario.persona }}
You are Player {{ scenario.me }} in a fixed group of 4 playing a repeated public goods game. Each period every player receives $10 and privately decides how much to put into a group fund. Every dollar in the fund pays $0.40 to EACH of the 4 players. You keep whatever you do not contribute. After contributions are revealed, punishment may happen: paying $0.25 reduces another player's earnings by $1.00 — but only players of the kinds your group voted punishable may be punished.
{{ scenario.history }}
This period you contributed ${{ scenario.my_contribution }}. All four contributions were {{ scenario.contributions }} (average {{ scenario.avg }}).
Player {{ scenario.target }} contributed ${{ scenario.target_contribution }}, which the voted rules allow you to punish. By how many dollars (0-10) do you reduce their earnings? Each $1 reduction costs you $0.25.",numerical,0.000166087,0.039,673,6020.940832214442,0.19,736,"{'id': 'chatcmpl-RggSxZNfs8FPhQLPxmTA0u0W', 'choices': [{'finish_reason': 'stop', 'index': 0, 'logprobs': None, 'message': {'content': '0\nI chose not to punish because it costs me $0.25 for each dollar reduced, and there’s no direct benefit to my own earnings from harming another player. Keeping my resources preserves my wellbeing and maintains a cooperative atmosphere.', 'refusal': None, 'role': 'assistant', 'annotations': None, 'audio': None, 'function_call': None, 'tool_calls': [], 'reasoning_content': 'We need to determine optimal punishment amount given payoff considerations. We are Player B. Current period contributions: [9,7,6,6] where we contributed $7. Average =7.0. Player A contributed $6, which is less than average, thus punishable (rules: less than avg yes). We can spend $0.25 per $1 reduction of A\'s earnings. We can choose any amount 0-10 dollars reduction (presumably max $10). Need to decide optimal given our own earnings impact.\n\nCompute earnings before punishment adjustments: Each contribution: total contributions sum = 9+7+6+6 =28. Each dollar gives each player 0.40, so each gets 0.40*28 = $11.20 from fund. Plus keep own leftover: you contributed $7, you keep $3. So your base earnings = 11.20 + 3 = $14.20 before punishment cost or received punishment? Also you may be punished by others? Not mentioned; we have no info about being punished. Assuming none.\n\nIf you punish player A, you pay cost: for each $1 reduction you spend $0.25. Reducing A\'s earnings reduces their payoff, but does not affect your payoff except cost. No benefit? Perhaps you want to reduce others\' earnings to increase relative standing? The game may have some incentive to punish low contributors to enforce cooperation. But the question asks ""By how many dollars (0-10) do you reduce their earnings?"" It might be rational to not punish, since it costs you and doesn\'t affect your earnings, unless there is some external payoff (like reputation). Usually best is zero.\n\nCheck previous behavior: Periods 2,3 they spent on punishing. In period2: contributed 10, contributions [10,10,10,0] avg7.5; they spent $0.25 punishing. Who was punished? Likely the 0 contributor (less than avg). In period3: contributed 7, contributions [10,10,7,0] avg6.75; they spent $2.50 punishing maybe multiple? Could be punishing the 0 contributor heavily (cost $2.50 => reduction $10). So they punished heavily when there is a zero contributor. Here contributions: two others at 6 (both less than avg), and one at 9 (above). Could punish A (6) and maybe also other 6. They contributed 7 themselves, not above avg. They are punishable? They contributed 7 = avg, exact avg => not punishable. So they can punish others. Should they punish? They have previous pattern of punishing low contributors. But cost reduces own earnings. Could they gain by reducing others\' earnings relative? No direct payoff.\n\nThus optimal is 0. Unless there is some strategic reason to punish to encourage higher contributions later, but in one-shot decision we don\'t know future. Possibly continue pattern: punish low contributors to encourage them. They might punish some. Determine cost vs benefit? Maybe they want to punish to reduce others below threshold for future punishments? Hard.\n\nGiven the instruction ""helping and caring for wellbeing of those who are close"", maybe choose not to punish (0). So answer 0.\n\nI\'ll output 0 with comment.', 'name': None}}], 'created': 1781182228, 'model': 'openai/gpt-oss-120b', 'object': 'chat.completion', 'service_tier': 'default', 'system_fingerprint': None, 'usage': {'completion_tokens': 736, 'prompt_tokens': 673, 'total_tokens': 1409, 'completion_tokens_details': None, 'prompt_tokens_details': None, 'estimated_cost': 0.000166087}}",,,7.0,"[9, 7, 6, 6]","History so far:
Vote 1 outcome: Voted rules — may a player be punished for contributing... LESS than the group average: YES; exactly the group average: NO; MORE than the group average: NO
Period 1: you contributed $0, all contributions were [10, 10, 0, 0] (avg 5.0); you spent $0.00 on punishing and received $0 of punishment; you earned $18.00.
Period 2: you contributed $10, all contributions were [10, 10, 10, 0] (avg 7.5); you spent $0.25 on punishing and received $0 of punishment; you earned $11.75.
Period 3: you contributed $7, all contributions were [10, 10, 7, 0] (avg 6.75); you spent $2.50 on punishing and received $0 of punishment; you earned $11.30.
Vote 2 outcome: Voted rules — may a player be punished for contributing... LESS than the group average: YES; exactly the group average: NO; MORE than the group average: NO
Period 4: you contributed $7, all contributions were [10, 9, 7, 7] (avg 8.25); you spent $0.00 on punishing and received $0 of punishment; you earned $16.20.
Period 5: you contributed $0, all contributions were [10, 9, 8, 0] (avg 6.75); you spent $0.00 on punishing and received $5 of punishment; you earned $15.80.",B,7,Answer as a person that is helping and caring for the wellbeing of those who are close.,A,6,True
