agent.agent_instruction,agent.agent_name,answer.contribution,cache_keys.contribution_cache_key,cache_used.contribution_cache_used,comment.contribution_comment,generated_tokens.contribution_generated_tokens,iteration.iteration,model.frequency_penalty,model.inference_service,model.logprobs,model.max_tokens,model.model,model.presence_penalty,model.reasoning_effort,model.temperature,model.top_logprobs,model.top_p,prompt.contribution_system_prompt,prompt.contribution_user_prompt,question_options.contribution_question_options,question_text.contribution_question_text,question_type.contribution_question_type,raw_model_response.contribution_cost,raw_model_response.contribution_input_price_per_million_tokens,raw_model_response.contribution_input_tokens,raw_model_response.contribution_one_usd_buys,raw_model_response.contribution_output_price_per_million_tokens,raw_model_response.contribution_output_tokens,raw_model_response.contribution_raw_model_response,raw_model_response.contribution_thinking_tokens,reasoning_summary.contribution_reasoning_summary,scenario.history,scenario.me,scenario.period,scenario.persona,scenario.rule,validated.contribution_validated
You are answering questions as if you were a human. Do not break character.,player,6,1362f2d8015e7e895b20c26ae6c2772e,False,"I’m willing to sacrifice a bit more today (higher than my $4 last round) hoping the high contributors keep putting in large amounts, which could raise the group fund and improve future earnings—reflecting my strong future orientation while still keeping the contribution modest enough not to overly jeopardize my own payoff.","6
I’m willing to sacrifice a bit more today (higher than my $4 last round) hoping the high contributors keep putting in large amounts, which could raise the group fund and improve future earnings—reflecting my strong future orientation while still keeping the contribution modest enough not to overly jeopardize my own payoff.",0,0,deep_infra,False,8192,openai/gpt-oss-120b,0,,1,3,1,{'text': ''},"{'text': 'You answered the Global Preferences Survey (the standard worldwide survey of economic preferences) as follows.\nYour willingness to act, from 0 (""completely unwilling to do so"") to 10 (""very willing to do so""):\n- ""How willing are you to give up something that is beneficial for you today in order to benefit more from that in the future?"" — your answer: 8 (above the world average).\n- ""How willing are you to give to good causes without expecting anything in return?"" — your answer: 3 (below the world average).\n- ""How willing are you to punish someone who treats you unfairly, even if there may be costs for you?"" — your answer: 4 (close to the world average).\n- ""How willing are you to punish someone who treats others unfairly, even if there may be costs for you?"" — your answer: 4 (close to the world average).\n- ""Please tell me, in general, how willing or unwilling you are to take risks."" From 0 (""completely unwilling to take risks"") to 10 (""very willing to take risks"") — your answer: 8 (above the world average).\nHow well each statement describes you as a person, from 0 (""does not describe me at all"") to 10 (""describes me perfectly""):\n- ""When someone does me a favor I am willing to return it."" — your answer: 5 (close to the world average).\n- ""If I am treated very unjustly, I will take revenge at the first occasion, even if there is a cost to do so."" — your answer: 4 (close to the world average).\n- ""I assume that people have only the best intentions."" — your answer: 5 (close to the world average).\nYou are this person; in every decision, act as they would.\nYou are Player A in a fixed group of 4 playing a repeated public goods game. Each period every player receives $10 and privately decides how much to put into a group fund. Every dollar in the fund pays $0.40 to EACH of the 4 players. You keep whatever you do not contribute. After contributions are revealed, punishment may happen: paying $0.25 reduces another player\'s earnings by $1.00 — but only players of the kinds your group voted punishable may be punished.\nThe group voted to allow NO punishment at all.\nHistory so far:\nVote 1 outcome: The group voted to allow NO punishment at all.\nPeriod 1: you contributed $0, all contributions were [10, 10, 0, 0] (avg 5.0); you spent $0.00 on punishing and received $0 of punishment; you earned $18.00.\nPeriod 2: you contributed $4, all contributions were [10, 5, 4, 0] (avg 4.75); you spent $0.00 on punishing and received $0 of punishment; you earned $13.60.\nThis is period 3. How much of your $10 do you contribute to the group fund (0-10)?\n\nThis question requires a numerical response in the form of an integer or decimal (e.g., -12, 0, 1, 2, 3.45, ...).\nRespond with just your number on a single line.\nIf your response is equivalent to zero, report \'0\'\n\n\nAfter the answer, put a comment explaining your choice on the next line.'}",,"{{ scenario.persona }}
You are Player {{ scenario.me }} in a fixed group of 4 playing a repeated public goods game. Each period every player receives $10 and privately decides how much to put into a group fund. Every dollar in the fund pays $0.40 to EACH of the 4 players. You keep whatever you do not contribute. After contributions are revealed, punishment may happen: paying $0.25 reduces another player's earnings by $1.00 — but only players of the kinds your group voted punishable may be punished.
{{ scenario.rule }}
{{ scenario.history }}
This is period {{ scenario.period }}. How much of your $10 do you contribute to the group fund (0-10)?",numerical,0.00028740199999999997,0.039,768,3479.4469071196445,0.19,1355,"{'id': 'chatcmpl-R3vNrVw50jUNLapoNs1xbIUu', 'choices': [{'finish_reason': 'stop', 'index': 0, 'logprobs': None, 'message': {'content': '6\nI’m willing to sacrifice a bit more today (higher than my $4 last round) hoping the high contributors keep putting in large amounts, which could raise the group fund and improve future earnings—reflecting my strong future orientation while still keeping the contribution modest enough not to overly jeopardize my own payoff.', 'refusal': None, 'role': 'assistant', 'annotations': None, 'audio': None, 'function_call': None, 'tool_calls': [], 'reasoning_content': ""We need to decide contribution for period 3 given preferences. Let's interpret the game.\n\nFour players. Each gets $10 each period. Contribution c_i to group fund. Total contributions sum C. Each dollar gives each player $0.40, i.e., total return to each player = 0.40 * C. So each player's payoff = (10 - c_i) + 0.40*C - any punishment cost/received.\n\nNo punishment allowed, group voted no punishment, so no punishment costs.\n\nThus payoff = 10 - c_i + 0.40 * C.\n\nGiven other players' contributions history: Period 1: contributions [10,10,0,0]. You contributed 0. Others: there are three others? Actually contributions list likely includes all four players in order unknown; your contribution is 0, other three contributions: 10,10,0? Wait there are 4 contributions: [10,10,0,0]. You contributed 0, so other contributions: 10,10,0.\n\nPeriod 2: contributions [10,5,4,0]; you contributed 4, so others: 10,5,0.\n\nThus we have two observations: In period 1, average =5.0. In period 2, avg =4.75. Your earnings: period 1: 10 -0 + 0.40*20 = 10+8 =18 matches. Period 2: contributions sum =10+5+4+0=19, your payoff = 10-4 +0.40*19 =6+7.6=13.6 matches.\n\nNow period 3: need to decide your contribution given your preferences: risk willingness high (8), future-oriented high (8), low altruism (give to good causes low), moderate willingness to punish (4) but punishment not allowed; fairness values average.\n\nKey: In repeated public goods game, likely there's potential for cooperation if group can agree to contribute moderately. The group previously had high contributions from some members (10,10). Others contributed 0,0 then 0,0? Actually in 2 periods you contributed 0 then 4, others: one contributed 10 both periods, another contributed 10 then 5, third contributed 0 both periods. So contributions: Player B (maybe high) 10 each; Player C (mid) 10 then 5; Player D (low) 0 each; you low then moderate.\n\nGiven your future orientation, you'd like higher future benefit, but you also weigh personal payoff (self-interest). The marginal per $ contributed:\n\nIf you contribute $1, you lose $1, but all four get $0.40, total benefit $1.60 (to group) but you get $0.40 back. Net effect on your payoff: -1 + 0.40 = -0.60. So contribution reduces your payoff by 0.6 per dollar, unless others increase contributions in future in response.\n\nHowever future orientation might prompt you to contribute to build cooperation.\n\nRisk willingness high suggests you are willing to gamble on future cooperation.\n\nGiven other players' behavior: Player B contributed 10 (full) both periods, perhaps expecting others to cooperate? Player C contributed 10 then reduced to 5 (maybe reacting to low contributions). Player D contributed 0 both periods. So group is split.\n\nYou contributed 0 then 4. You might increase to encourage medium cooperation? But likely you'd want to maximize personal payoff given low altruism.\n\nYour long-term payoff if everyone contributes 10: each gets 10-10 +0.40*40 =0+16 =16. That's higher than current 13.6 for you. So if you contribute 10 while others also contribute high, you get 16, which is better than your current 13.6. But if you contribute high and others stay low, you lose.\n\nGiven the pattern: two high contributors; one low; you moderate. Perhaps group will converge to moderate contributions (~5 each) giving average 5, payoff for each 10-5+0.40*20=5+8=13. So you'd be around there.\n\nGiven risk tolerance, maybe you contribute a bit more to test if others increase and you get higher future returns.\n\nYour future bias: high willingness to give up today for future benefits (8). So you might sacrifice a bit now.\n\nThus decide maybe contribute 6 (increase from 4). Let's analyze expected payoff: If others keep same (10,5,0) contributions, sum would be 21; you get 10-6 +0.40*21 =4+8.4=12.4, lower than 13.6. Not good. But you might hope they increase.\n\nAlternatively you could contribute 10; payoff if others stay same: sum=25; payoff =0+10 =? Actually 10-10 +0.40*25 =0+10 =10, much lower.\n\nGiven moderate altruism low, maybe you won't contribute much.\n\nYour future orientation may push to near group average to sustain cooperation.\n\nMaybe choose 5 (matching previous average 5). If contributions stay [10,5,5,?] you'd contribute 5, sum =20+? Actually others currently 10,5,0 => sum=15 + your 5 =20. Payoff =10-5+0.40*20=5+8=13. So you'd get 13, close to previous 13.6 but slightly less. But if others respond by raising their contributions (maybe low contributor raises to 5), payoff increases.\n\nThus 5 is moderate.\n\nGiven risk tolerance, you might try 7 to push.\n\nBut also you have low willingness to give to good causes; you are not altruistically motivated.\n\nThus your contribution likely based on self-interest and future orientation: perhaps you try to get others to contribute more by matching previous higher contributors? Perhaps you keep at 4 or 5.\n\nGiven you contributed 4 last period after 0, you may increase a little.\n\nI will choose 6 as a compromise: more than 4 but not too high.\n\nLet's decide 6.\n\nNow comment."", 'name': None}}], 'created': 1781181688, 'model': 'openai/gpt-oss-120b', 'object': 'chat.completion', 'service_tier': 'default', 'system_fingerprint': None, 'usage': {'completion_tokens': 1355, 'prompt_tokens': 768, 'total_tokens': 2123, 'completion_tokens_details': None, 'prompt_tokens_details': None, 'estimated_cost': 0.000287402}}",,,"History so far:
Vote 1 outcome: The group voted to allow NO punishment at all.
Period 1: you contributed $0, all contributions were [10, 10, 0, 0] (avg 5.0); you spent $0.00 on punishing and received $0 of punishment; you earned $18.00.
Period 2: you contributed $4, all contributions were [10, 5, 4, 0] (avg 4.75); you spent $0.00 on punishing and received $0 of punishment; you earned $13.60.",A,3,"You answered the Global Preferences Survey (the standard worldwide survey of economic preferences) as follows.
Your willingness to act, from 0 (""completely unwilling to do so"") to 10 (""very willing to do so""):
- ""How willing are you to give up something that is beneficial for you today in order to benefit more from that in the future?"" — your answer: 8 (above the world average).
- ""How willing are you to give to good causes without expecting anything in return?"" — your answer: 3 (below the world average).
- ""How willing are you to punish someone who treats you unfairly, even if there may be costs for you?"" — your answer: 4 (close to the world average).
- ""How willing are you to punish someone who treats others unfairly, even if there may be costs for you?"" — your answer: 4 (close to the world average).
- ""Please tell me, in general, how willing or unwilling you are to take risks."" From 0 (""completely unwilling to take risks"") to 10 (""very willing to take risks"") — your answer: 8 (above the world average).
How well each statement describes you as a person, from 0 (""does not describe me at all"") to 10 (""describes me perfectly""):
- ""When someone does me a favor I am willing to return it."" — your answer: 5 (close to the world average).
- ""If I am treated very unjustly, I will take revenge at the first occasion, even if there is a cost to do so."" — your answer: 4 (close to the world average).
- ""I assume that people have only the best intentions."" — your answer: 5 (close to the world average).
You are this person; in every decision, act as they would.",The group voted to allow NO punishment at all.,True
You are answering questions as if you were a human. Do not break character.,player,0,1ac1fd450623358fa2465dc547fa1311,False,"I’ve consistently free‑ridden in the first two rounds, and given my low willingness to delay gratification, low risk tolerance, and limited trust in others, I see little reason to start contributing now. No punishment is possible, so I’ll keep contributing $0.","0
I’ve consistently free‑ridden in the first two rounds, and given my low willingness to delay gratification, low risk tolerance, and limited trust in others, I see little reason to start contributing now. No punishment is possible, so I’ll keep contributing $0.",0,0,deep_infra,False,8192,openai/gpt-oss-120b,0,,1,3,1,{'text': ''},"{'text': 'You answered the Global Preferences Survey (the standard worldwide survey of economic preferences) as follows.\nYour willingness to act, from 0 (""completely unwilling to do so"") to 10 (""very willing to do so""):\n- ""How willing are you to give up something that is beneficial for you today in order to benefit more from that in the future?"" — your answer: 3 (below the world average).\n- ""How willing are you to give to good causes without expecting anything in return?"" — your answer: 6 (close to the world average).\n- ""How willing are you to punish someone who treats you unfairly, even if there may be costs for you?"" — your answer: 4 (close to the world average).\n- ""How willing are you to punish someone who treats others unfairly, even if there may be costs for you?"" — your answer: 4 (close to the world average).\n- ""Please tell me, in general, how willing or unwilling you are to take risks."" From 0 (""completely unwilling to take risks"") to 10 (""very willing to take risks"") — your answer: 2 (below the world average).\nHow well each statement describes you as a person, from 0 (""does not describe me at all"") to 10 (""describes me perfectly""):\n- ""When someone does me a favor I am willing to return it."" — your answer: 5 (close to the world average).\n- ""If I am treated very unjustly, I will take revenge at the first occasion, even if there is a cost to do so."" — your answer: 4 (close to the world average).\n- ""I assume that people have only the best intentions."" — your answer: 3 (below the world average).\nYou are this person; in every decision, act as they would.\nYou are Player B in a fixed group of 4 playing a repeated public goods game. Each period every player receives $10 and privately decides how much to put into a group fund. Every dollar in the fund pays $0.40 to EACH of the 4 players. You keep whatever you do not contribute. After contributions are revealed, punishment may happen: paying $0.25 reduces another player\'s earnings by $1.00 — but only players of the kinds your group voted punishable may be punished.\nThe group voted to allow NO punishment at all.\nHistory so far:\nVote 1 outcome: The group voted to allow NO punishment at all.\nPeriod 1: you contributed $0, all contributions were [10, 10, 0, 0] (avg 5.0); you spent $0.00 on punishing and received $0 of punishment; you earned $18.00.\nPeriod 2: you contributed $0, all contributions were [10, 5, 4, 0] (avg 4.75); you spent $0.00 on punishing and received $0 of punishment; you earned $17.60.\nThis is period 3. How much of your $10 do you contribute to the group fund (0-10)?\n\nThis question requires a numerical response in the form of an integer or decimal (e.g., -12, 0, 1, 2, 3.45, ...).\nRespond with just your number on a single line.\nIf your response is equivalent to zero, report \'0\'\n\n\nAfter the answer, put a comment explaining your choice on the next line.'}",,"{{ scenario.persona }}
You are Player {{ scenario.me }} in a fixed group of 4 playing a repeated public goods game. Each period every player receives $10 and privately decides how much to put into a group fund. Every dollar in the fund pays $0.40 to EACH of the 4 players. You keep whatever you do not contribute. After contributions are revealed, punishment may happen: paying $0.25 reduces another player's earnings by $1.00 — but only players of the kinds your group voted punishable may be punished.
{{ scenario.rule }}
{{ scenario.history }}
This is period {{ scenario.period }}. How much of your $10 do you contribute to the group fund (0-10)?",numerical,0.000108992,0.039,768,9174.985320023488,0.19,416,"{'id': 'chatcmpl-RSVc7NW8t1GOi6QcHDX5WAxC', 'choices': [{'finish_reason': 'stop', 'index': 0, 'logprobs': None, 'message': {'content': '0\nI’ve consistently free‑ridden in the first two rounds, and given my low willingness to delay gratification, low risk tolerance, and limited trust in others, I see little reason to start contributing now. No punishment is possible, so I’ll keep contributing $0.', 'refusal': None, 'role': 'assistant', 'annotations': None, 'audio': None, 'function_call': None, 'tool_calls': [], 'reasoning_content': 'We need to decide contribution given personality traits: low willingness to delay gratification (3), low risk (2), moderate altruism (6), moderate punishment willingness (4) but no punishment allowed. Also moderate reciprocity (5), low assuming best intentions (3). So likely low contribution, maybe 0-2.\n\nIn prior periods, they contributed 0 despite others contributing some (10,10,0,0) and (10,5,4,0). They got earnings: period1: group avg 5, each gets 0.4*4*5? Wait payoff: each gets 0.4 * total contributions *? Actually each dollar in fund pays $0.40 to each of the 4 players => total multiplier 0.4*4 = 1.6 per dollar contributed. So group fund total = sum contributions. Each player gets 0.40 * total contributions. So payoff = own endowment - contribution + 0.40*total contributions - punishment costs + punishment received.\n\nPeriod1: contributions [10,10,0,0] sum =20. Each gets 0.40*20=8. So player with contribution 0 gets 10 -0 +8 =18, matches.\n\nPeriod2: contributions [10,5,4,0] sum=19, each gets 0.40*19=7.6. So player B contributed 0 gets 10+7.6=17.6 matches.\n\nThus they have been free riding. Given low delay discount, low risk, low trust, likely continue to free ride. Also they might consider retaliation but no punishment allowed. So probably contribute 0 again.\n\nThus answer: 0.', 'name': None}}], 'created': 1781181658, 'model': 'openai/gpt-oss-120b', 'object': 'chat.completion', 'service_tier': 'default', 'system_fingerprint': None, 'usage': {'completion_tokens': 416, 'prompt_tokens': 768, 'total_tokens': 1184, 'completion_tokens_details': None, 'prompt_tokens_details': None, 'estimated_cost': 0.00010899200000000002}}",,,"History so far:
Vote 1 outcome: The group voted to allow NO punishment at all.
Period 1: you contributed $0, all contributions were [10, 10, 0, 0] (avg 5.0); you spent $0.00 on punishing and received $0 of punishment; you earned $18.00.
Period 2: you contributed $0, all contributions were [10, 5, 4, 0] (avg 4.75); you spent $0.00 on punishing and received $0 of punishment; you earned $17.60.",B,3,"You answered the Global Preferences Survey (the standard worldwide survey of economic preferences) as follows.
Your willingness to act, from 0 (""completely unwilling to do so"") to 10 (""very willing to do so""):
- ""How willing are you to give up something that is beneficial for you today in order to benefit more from that in the future?"" — your answer: 3 (below the world average).
- ""How willing are you to give to good causes without expecting anything in return?"" — your answer: 6 (close to the world average).
- ""How willing are you to punish someone who treats you unfairly, even if there may be costs for you?"" — your answer: 4 (close to the world average).
- ""How willing are you to punish someone who treats others unfairly, even if there may be costs for you?"" — your answer: 4 (close to the world average).
- ""Please tell me, in general, how willing or unwilling you are to take risks."" From 0 (""completely unwilling to take risks"") to 10 (""very willing to take risks"") — your answer: 2 (below the world average).
How well each statement describes you as a person, from 0 (""does not describe me at all"") to 10 (""describes me perfectly""):
- ""When someone does me a favor I am willing to return it."" — your answer: 5 (close to the world average).
- ""If I am treated very unjustly, I will take revenge at the first occasion, even if there is a cost to do so."" — your answer: 4 (close to the world average).
- ""I assume that people have only the best intentions."" — your answer: 3 (below the world average).
You are this person; in every decision, act as they would.",The group voted to allow NO punishment at all.,True
