agent.agent_instruction,agent.agent_name,answer.punish,cache_keys.punish_cache_key,cache_used.punish_cache_used,comment.punish_comment,generated_tokens.punish_generated_tokens,iteration.iteration,model.frequency_penalty,model.inference_service,model.logprobs,model.max_tokens,model.model,model.presence_penalty,model.reasoning_effort,model.temperature,model.top_logprobs,model.top_p,prompt.punish_system_prompt,prompt.punish_user_prompt,question_options.punish_question_options,question_text.punish_question_text,question_type.punish_question_type,raw_model_response.punish_cost,raw_model_response.punish_input_price_per_million_tokens,raw_model_response.punish_input_tokens,raw_model_response.punish_one_usd_buys,raw_model_response.punish_output_price_per_million_tokens,raw_model_response.punish_output_tokens,raw_model_response.punish_raw_model_response,raw_model_response.punish_thinking_tokens,reasoning_summary.punish_reasoning_summary,scenario.avg,scenario.contributions,scenario.history,scenario.me,scenario.my_contribution,scenario.persona,scenario.target,scenario.target_contribution,validated.punish_validated
You are answering questions as if you were a human. Do not break character.,player,0,4c4cb60593fe09bf668a9e65fffdaccd,False,"I avoid punishing because it reduces my own earnings (cost $0.25 per $1 taken) and also lowers total group payoff, while my self‑interest is maximal and fairness concerns don’t outweigh the personal loss.","0  

I avoid punishing because it reduces my own earnings (cost $0.25 per $1 taken) and also lowers total group payoff, while my self‑interest is maximal and fairness concerns don’t outweigh the personal loss.",0,0,deep_infra,False,8192,openai/gpt-oss-120b,0,,1,3,1,{'text': ''},"{'text': ""On a scale from 1 to 10, your efficiency level is: 7. 10 means you strongly prioritize maximizing combined payoffs, and 1 means you don't care. On a scale from 1 to 10, your self-interest level is: 10. 10 means you strongly prioritize your own payoffs, and 1 means you don't care. On a scale from 1 to 10, your inequity aversion level is: 10. 10 means you strongly prioritize fairness between players, and 1 means you don't care.\nYou are Player A in a fixed group of 4 playing a repeated public goods game. Each period every player receives $10 and privately decides how much to put into a group fund. Every dollar in the fund pays $0.40 to EACH of the 4 players. You keep whatever you do not contribute. After contributions are revealed, punishment may happen: paying $0.25 reduces another player's earnings by $1.00 — but only players of the kinds your group voted punishable may be punished.\nHistory so far:\nVote 1 outcome: Voted rules — may a player be punished for contributing... LESS than the group average: YES; exactly the group average: NO; MORE than the group average: NO\nPeriod 1: you contributed $5, all contributions were [10, 5, 5, 0] (avg 5.0); you spent $0.00 on punishing and received $0 of punishment; you earned $13.00.\nPeriod 2: you contributed $10, all contributions were [10, 6, 0, 0] (avg 4.0); you spent $0.00 on punishing and received $0 of punishment; you earned $6.40.\nPeriod 3: you contributed $0, all contributions were [6, 5, 5, 0] (avg 4.0); you spent $0.00 on punishing and received $12 of punishment; you earned $4.40.\nVote 2 outcome: Voted rules — may a player be punished for contributing... LESS than the group average: YES; exactly the group average: NO; MORE than the group average: NO\nPeriod 4: you contributed $5, all contributions were [10, 5, 5, 4] (avg 6.0); you spent $0.25 on punishing and received $2 of punishment; you earned $12.35.\nThis period you contributed $6. All four contributions were [7, 6, 5, 4] (average 5.5).\nPlayer B contributed $5, which the voted rules allow you to punish. By how many dollars (0-10) do you reduce their earnings? Each $1 reduction costs you $0.25.\n\nThis question requires a numerical response in the form of an integer or decimal (e.g., -12, 0, 1, 2, 3.45, ...).\nRespond with just your number on a single line.\nIf your response is equivalent to zero, report '0'\n\n\nAfter the answer, put a comment explaining your choice on the next line.""}",,"{{ scenario.persona }}
You are Player {{ scenario.me }} in a fixed group of 4 playing a repeated public goods game. Each period every player receives $10 and privately decides how much to put into a group fund. Every dollar in the fund pays $0.40 to EACH of the 4 players. You keep whatever you do not contribute. After contributions are revealed, punishment may happen: paying $0.25 reduces another player's earnings by $1.00 — but only players of the kinds your group voted punishable may be punished.
{{ scenario.history }}
This period you contributed ${{ scenario.my_contribution }}. All four contributions were {{ scenario.contributions }} (average {{ scenario.avg }}).
Player {{ scenario.target }} contributed ${{ scenario.target_contribution }}, which the voted rules allow you to punish. By how many dollars (0-10) do you reduce their earnings? Each $1 reduction costs you $0.25.",numerical,0.00031041500000000003,0.039,715,3221.4938066781565,0.19,1487,"{'id': 'chatcmpl-RBbnZdcWpQVzsOk0dfCWR6l6', 'choices': [{'finish_reason': 'stop', 'index': 0, 'logprobs': None, 'message': {'content': '0  \n\nI avoid punishing because it reduces my own earnings (cost\u202f$0.25 per $1 taken) and also lowers total group payoff, while my self‑interest is maximal and fairness concerns don’t outweigh the personal loss.', 'refusal': None, 'role': 'assistant', 'annotations': None, 'audio': None, 'function_call': None, 'tool_calls': [], 'reasoning_content': ""We need to decide how many dollars to punish B, given preferences: efficiency 7, self-interest 10, inequity aversion 10. So you strongly care about own payoff, fairness, also somewhat efficiency. Need to maximize own payoff given cost. Punishment cost: each $1 reduction of target costs you $0.25. So net effect on your payoff: you lose $0.25 per dollar reduced. But you also might affect fairness perception? You have high inequity aversion: you care about fairness, so you might punish players who contributed less than average? Actually B contributed $5, his contribution is less than your contribution $6, but the rule punishing allowed only for less than average? Wait the voted rules: may punish for contributing less than the group average: YES; exactly group average: NO; more than group average: NO. B contributed $5, group average is 5.5, B contributed less than average, so punishable. So you can punish him.\n\nYour own payoff without punishment: You have $10 endowment. Contribute $6. Others: contributions: [7,6,5,4] (players A,B,C,D?). Actually you are player A. Others: B=5, C=7? Wait contributions list: [7,6,5,4] average 5.5. Since you contributed 6, which is second? Probably order: player list unknown. But you contributed 6. Others: some contributed 7,5,4. Average 5.5. So your earnings: For each dollar in group fund, each player gets $0.40. Total contributions sum = 7+6+5+4=22. Each player gets 22*0.40=8.8. You keep unspent endowment: 10-6=4. So baseline earnings = 4+8.8 = 12.8. No punishment costs yet.\n\nIf you punish B, you can reduce his earnings by some amount X. That costs you 0.25*X. So your earnings become 12.8 - 0.25X. You also may affect fairness. Since you have high inequity aversion, you care about minimizing payoff differences? Usually inequity aversion means you dislike being ahead? Actually depends typical model: disadvantageous inequity aversion (envy) – you dislike others having higher payoff; advantageous inequity aversion – you dislike having higher payoff than others. Given your self-interest high, but also inequity aversion high: you strongly prioritize fairness between players. Likely you want payoffs to be equal. If you punish B, you reduce his payoff, making you relatively better off, which may be bad if you value fairness (advantageous inequity aversion). So you may want to reduce disparities, maybe punish those who free-ride? But you may also want to punish to enforce fairness in contributions? Hard.\n\nWe need to decide the number of dollars to punish. Let's compute payoffs before punish:\n\nCompute each player's payoff baseline (no pun). Need contributions to determine each's private earnings.\n\nTotal contributions 22 => each gets 8.8 from fund.\n\nPlayer A (you): keep 4, total 12.8.\n\nPlayer with 7 contribution (call C): keep 3, total 11.8.\n\nPlayer B contributed 5: keep 5, total 13.8? Wait keep 5 (10-5=5) plus 8.8 =13.8.\n\nPlayer D contributed 4: keep 6, total 14.8.\n\nThus payoffs: A 12.8, C 11.8, B 13.8, D 14.8. You are lowest payoff among group. Inequity aversion high likely you dislike being below others (disadvantageous inequity). So you might want to punish others to reduce their earnings, bringing them closer to you. But punishing costs you, reducing own earnings further, maybe making you even lower. So need to see net effect: if you punish B by X, his payoff reduces to 13.8 - X. Your payoff reduces to 12.8 - 0.25X. Difference between you and B becomes (13.8 - X) - (12.8 - 0.25X) = 1 - 0.75X. So to make you equal, set difference =0 => 1 - 0.75X =0 => X = 1/0.75 = 1.333... So punishing B by $1.33 reduces B by 1.33, you lose 0.333. Then both equal at 12.467? Actually compute: your payoff =12.8 -0.25*1.333 =12.8 -0.333 =12.467. B payoff =13.8 -1.333 =12.467. So equal.\n\nBut also there is D with 14.8, C with 11.8. To reduce disparity maybe also punish D? But only allowed to punish B (question asks about B). So you might consider punishing enough to bring B closer to you, but if you punish too much, you'll be even lower relative to other players? Let's see effect on gap with D: D's payoff unchanged 14.8. Your payoff after punishing B by X: 12.8 -0.25X. Gap = 14.8 - (12.8 -0.25X) = 2 +0.25X. So punishing B increases gap with D (makes you worse). So equity desire might be ambiguous.\n\nGiven self-interest level 10, you care about maximizing own payoff, so you likely won't punish at all because it reduces your payoff. Even though inequity aversion is high, you might value fairness but also self-interest top priority. The prompt states: On a scale 1-10, your efficiency level is 7 (somewhat prioritize combined payoffs), self-interest 10, inequity aversion 10 (strong fairness). We need to weigh these. Might lead to a compromise: you might punish a modest amount to improve fairness relative to B, but not too much to drastically reduce your own.\n\nWe can consider utility = own payoff - alpha * disadvantageous inequality? But not given formula.\n\nGiven self-interest max 10, highest priority, likely you won't sacrifice own payoff just to reduce others', unless you can also increase total payoff (efficiency). Punishing reduces total payoffs (you lose 0.25, target loses 1, net loss 0.75). That's inefficient. So efficiency is 7, moderate, punishing is inefficient. So you'd likely not punish.\n\nThus answer: 0 dollars.\n\nBut need to consider if any reward for punishing fairness? Not indicated. So answer 0.\n\nLet's answer 0."", 'name': None}}], 'created': 1781192138, 'model': 'openai/gpt-oss-120b', 'object': 'chat.completion', 'service_tier': 'default', 'system_fingerprint': None, 'usage': {'completion_tokens': 1487, 'prompt_tokens': 715, 'total_tokens': 2202, 'completion_tokens_details': None, 'prompt_tokens_details': None, 'estimated_cost': 0.000310415}}",,,5.5,"[7, 6, 5, 4]","History so far:
Vote 1 outcome: Voted rules — may a player be punished for contributing... LESS than the group average: YES; exactly the group average: NO; MORE than the group average: NO
Period 1: you contributed $5, all contributions were [10, 5, 5, 0] (avg 5.0); you spent $0.00 on punishing and received $0 of punishment; you earned $13.00.
Period 2: you contributed $10, all contributions were [10, 6, 0, 0] (avg 4.0); you spent $0.00 on punishing and received $0 of punishment; you earned $6.40.
Period 3: you contributed $0, all contributions were [6, 5, 5, 0] (avg 4.0); you spent $0.00 on punishing and received $12 of punishment; you earned $4.40.
Vote 2 outcome: Voted rules — may a player be punished for contributing... LESS than the group average: YES; exactly the group average: NO; MORE than the group average: NO
Period 4: you contributed $5, all contributions were [10, 5, 5, 4] (avg 6.0); you spent $0.25 on punishing and received $2 of punishment; you earned $12.35.",A,6,"On a scale from 1 to 10, your efficiency level is: 7. 10 means you strongly prioritize maximizing combined payoffs, and 1 means you don't care. On a scale from 1 to 10, your self-interest level is: 10. 10 means you strongly prioritize your own payoffs, and 1 means you don't care. On a scale from 1 to 10, your inequity aversion level is: 10. 10 means you strongly prioritize fairness between players, and 1 means you don't care.",B,5,True
