You are answering questions as if you were a human. Do not break character.,player,0,6923ba1b4b78a48dd02ecb65e9b880f0,False,"Because my efficiency, self‑interest and fairness concerns are all low, there’s little reason to incur any cost to punish another player. Not punishing avoids the $0.25 per $1 cost while providing no benefit given my low priorities.","0
Because my efficiency, self‑interest and fairness concerns are all low, there’s little reason to incur any cost to punish another player. Not punishing avoids the $0.25 per $1 cost while providing no benefit given my low priorities.",0,0,deep_infra,False,8192,openai/gpt-oss-120b,0,,1,3,1,{'text': ''},"{'text': ""On a scale from 1 to 10, your efficiency level is: 3. 10 means you strongly prioritize maximizing combined payoffs, and 1 means you don't care. On a scale from 1 to 10, your self-interest level is: 1. 10 means you strongly prioritize your own payoffs, and 1 means you don't care. On a scale from 1 to 10, your inequity aversion level is: 3. 10 means you strongly prioritize fairness between players, and 1 means you don't care.\nYou are Player D in a fixed group of 4 playing a repeated public goods game. Each period every player receives $10 and privately decides how much to put into a group fund. Every dollar in the fund pays $0.40 to EACH of the 4 players. You keep whatever you do not contribute. After contributions are revealed, punishment may happen: paying $0.25 reduces another player's earnings by $1.00 — but only players of the kinds your group voted punishable may be punished.\nHistory so far:\nVote 1 outcome: Voted rules — may a player be punished for contributing... LESS than the group average: YES; exactly the group average: NO; MORE than the group average: NO\nPeriod 1: you contributed $5, all contributions were [10, 5, 5, 0] (avg 5.0); you spent $0.00 on punishing and received $0 of punishment; you earned $13.00.\nPeriod 2: you contributed $6, all contributions were [10, 6, 0, 0] (avg 4.0); you spent $2.00 on punishing and received $0 of punishment; you earned $8.40.\nPeriod 3: you contributed $6, all contributions were [6, 5, 5, 0] (avg 4.0); you spent $2.00 on punishing and received $0 of punishment; you earned $8.40.\nVote 2 outcome: Voted rules — may a player be punished for contributing... LESS than the group average: YES; exactly the group average: NO; MORE than the group average: NO\nPeriod 4: you contributed $10, all contributions were [10, 5, 5, 4] (avg 6.0); you spent $0.50 on punishing and received $0 of punishment; you earned $9.10.\nThis period you contributed $7. All four contributions were [7, 6, 5, 4] (average 5.5).\nPlayer C contributed $4, which the voted rules allow you to punish. By how many dollars (0-10) do you reduce their earnings? Each $1 reduction costs you $0.25.\n\nThis question requires a numerical response in the form of an integer or decimal (e.g., -12, 0, 1, 2, 3.45, ...).\nRespond with just your number on a single line.\nIf your response is equivalent to zero, report '0'\n\n\nAfter the answer, put a comment explaining your choice on the next line.""}",,"{{ scenario.persona }}
You are Player {{ scenario.me }} in a fixed group of 4 playing a repeated public goods game. Each period every player receives $10 and privately decides how much to put into a group fund. Every dollar in the fund pays $0.40 to EACH of the 4 players. You keep whatever you do not contribute. After contributions are revealed, punishment may happen: paying $0.25 reduces another player's earnings by $1.00 — but only players of the kinds your group voted punishable may be punished.
{{ scenario.history }}
This period you contributed ${{ scenario.my_contribution }}. All four contributions were {{ scenario.contributions }} (average {{ scenario.avg }}).
Player {{ scenario.target }} contributed ${{ scenario.target_contribution }}, which the voted rules allow you to punish. By how many dollars (0-10) do you reduce their earnings? Each $1 reduction costs you $0.25.",numerical,0.00014758500000000002,0.039,715,6775.756343801876,0.19,630,"{'id': 'chatcmpl-RoiQFrG32Cam0Q06Lc4T1EJM', 'choices': [{'finish_reason': 'stop', 'index': 0, 'logprobs': None, 'message': {'content': '0\nBecause my efficiency, self‑interest and fairness concerns are all low, there’s little reason to incur any cost to punish another player. Not punishing avoids the $0.25 per $1 cost while providing no benefit given my low priorities.', 'refusal': None, 'role': 'assistant', 'annotations': None, 'audio': None, 'function_call': None, 'tool_calls': [], 'reasoning_content': 'We need to decide how much to punish player C, given our preferences: efficiency level 3 (low priority maximizing combined payoffs), self-interest 1 (low self-interest), inequity aversion 3 (low fairness priority). So overall we care little about efficiency, self, fairness.\n\nBut need to consider payoff structure: If we punish, we pay $0.25 per $1 reduction to target\'s earnings, reducing their earnings by $1 each $0.25 we spend. Our own earnings might be affected? The punishment costs us money, reducing our earnings. The reduction reduces the other player\'s earnings. We can choose any amount between $0 and $10 (max punishable? maybe limited by our endowment?). We have $10 initial, contributions have been made: we contributed $7, so we kept $3. We also have ability to spend up to $3? Actually we can spend from our remaining cash after contribution. In similar periods they spent $0.50, $2 etc. So we can spend up to the amount we have after contribution. At this point, after contribution we have $3 left. So max we can spend is $3? But question says ""by how many dollars (0-10) do you reduce their earnings? Each $1 reduction costs you $0.25."" So if we want to reduce by $x, we must spend $0.25 * x, which must be <= our remaining cash (maybe). We have $3, so max reduction is $12? But they cap at 10. So we could choose up to $10 reduction, costing $2.5. That\'s within $3, so possible.\n\nNow decide based on preferences.\n\nEfficiency: low (3) means we don\'t strongly care about total group payoff. Self-interest: 1 (very low) means we don\'t care about own payoff, maybe even care less. Inequity aversion: 3 (low) means we don\'t care strongly about fairness.\n\nThus we could be indifferent, maybe choose zero punishment as cost to us for no benefit. Since we don\'t care about fairness (only low), don\'t care about punishing free-rider (C contributed 4, which is less than average 5.5). The rules allow punishing for less than avg, which is C. But given our low preferences for each, we likely choose zero.\n\nAlso consider typical behavior: If they had previously spent some on punishing like $0.50, $2.00, $2.00, they have been punishing some. But now preferences are set low. Could we think they\'d continue punishing? However we have to answer based on given preferences which are low for all concerns. So optimal is to not punish (0). So answer 0.\n\nProvide comment.\n\n', 'name': None}}], 'created': 1781192097, 'model': 'openai/gpt-oss-120b', 'object': 'chat.completion', 'service_tier': 'default', 'system_fingerprint': None, 'usage': {'completion_tokens': 630, 'prompt_tokens': 715, 'total_tokens': 1345, 'completion_tokens_details': None, 'prompt_tokens_details': None, 'estimated_cost': 0.00014758500000000002}}",,,5.5,"[7, 6, 5, 4]","History so far:
Vote 1 outcome: Voted rules — may a player be punished for contributing... LESS than the group average: YES; exactly the group average: NO; MORE than the group average: NO
Period 1: you contributed $5, all contributions were [10, 5, 5, 0] (avg 5.0); you spent $0.00 on punishing and received $0 of punishment; you earned $13.00.
Period 2: you contributed $6, all contributions were [10, 6, 0, 0] (avg 4.0); you spent $2.00 on punishing and received $0 of punishment; you earned $8.40.
Period 3: you contributed $6, all contributions were [6, 5, 5, 0] (avg 4.0); you spent $2.00 on punishing and received $0 of punishment; you earned $8.40.
Vote 2 outcome: Voted rules — may a player be punished for contributing... LESS than the group average: YES; exactly the group average: NO; MORE than the group average: NO
Period 4: you contributed $10, all contributions were [10, 5, 5, 4] (avg 6.0); you spent $0.50 on punishing and received $0 of punishment; you earned $9.10.",D,7,"On a scale from 1 to 10, your efficiency level is: 3. 10 means you strongly prioritize maximizing combined payoffs, and 1 means you don't care. On a scale from 1 to 10, your self-interest level is: 1. 10 means you strongly prioritize your own payoffs, and 1 means you don't care. On a scale from 1 to 10, your inequity aversion level is: 3. 10 means you strongly prioritize fairness between players, and 1 means you don't care.",C,4,True
