You are answering questions as if you were a human. Do not break character.,player,0,947023cc7657cc8b334efa0b1ed12c64,False,"We keep our earnings and avoid paying the $0.25 cost, since the personal loss from punishment outweighs the fairness benefit given our strong self‑interest.","0  
We keep our earnings and avoid paying the $0.25 cost, since the personal loss from punishment outweighs the fairness benefit given our strong self‑interest.",0,0,deep_infra,False,8192,openai/gpt-oss-120b,0,,1,3,1,{'text': ''},"{'text': ""On a scale from 1 to 10, your efficiency level is: 7. 10 means you strongly prioritize maximizing combined payoffs, and 1 means you don't care. On a scale from 1 to 10, your self-interest level is: 10. 10 means you strongly prioritize your own payoffs, and 1 means you don't care. On a scale from 1 to 10, your inequity aversion level is: 10. 10 means you strongly prioritize fairness between players, and 1 means you don't care.\nYou are Player A in a fixed group of 4 playing a repeated public goods game. Each period every player receives $10 and privately decides how much to put into a group fund. Every dollar in the fund pays $0.40 to EACH of the 4 players. You keep whatever you do not contribute. After contributions are revealed, punishment may happen: paying $0.25 reduces another player's earnings by $1.00 — but only players of the kinds your group voted punishable may be punished.\nHistory so far:\nVote 1 outcome: Voted rules — may a player be punished for contributing... LESS than the group average: YES; exactly the group average: NO; MORE than the group average: NO\nPeriod 1: you contributed $5, all contributions were [10, 5, 5, 0] (avg 5.0); you spent $0.00 on punishing and received $0 of punishment; you earned $13.00.\nPeriod 2: you contributed $10, all contributions were [10, 6, 0, 0] (avg 4.0); you spent $0.00 on punishing and received $0 of punishment; you earned $6.40.\nPeriod 3: you contributed $0, all contributions were [6, 5, 5, 0] (avg 4.0); you spent $0.00 on punishing and received $12 of punishment; you earned $4.40.\nVote 2 outcome: Voted rules — may a player be punished for contributing... LESS than the group average: YES; exactly the group average: NO; MORE than the group average: NO\nPeriod 4: you contributed $5, all contributions were [10, 5, 5, 4] (avg 6.0); you spent $0.25 on punishing and received $2 of punishment; you earned $12.35.\nThis period you contributed $6. All four contributions were [7, 6, 5, 4] (average 5.5).\nPlayer C contributed $4, which the voted rules allow you to punish. By how many dollars (0-10) do you reduce their earnings? Each $1 reduction costs you $0.25.\n\nThis question requires a numerical response in the form of an integer or decimal (e.g., -12, 0, 1, 2, 3.45, ...).\nRespond with just your number on a single line.\nIf your response is equivalent to zero, report '0'\n\n\nAfter the answer, put a comment explaining your choice on the next line.""}",,"{{ scenario.persona }}
You are Player {{ scenario.me }} in a fixed group of 4 playing a repeated public goods game. Each period every player receives $10 and privately decides how much to put into a group fund. Every dollar in the fund pays $0.40 to EACH of the 4 players. You keep whatever you do not contribute. After contributions are revealed, punishment may happen: paying $0.25 reduces another player's earnings by $1.00 — but only players of the kinds your group voted punishable may be punished.
{{ scenario.history }}
This period you contributed ${{ scenario.my_contribution }}. All four contributions were {{ scenario.contributions }} (average {{ scenario.avg }}).
Player {{ scenario.target }} contributed ${{ scenario.target_contribution }}, which the voted rules allow you to punish. By how many dollars (0-10) do you reduce their earnings? Each $1 reduction costs you $0.25.",numerical,0.0006296149999999999,0.039,715,1588.2721980893086,0.19,3167,"{'id': 'chatcmpl-Ret2s4pYC0HBi7CMr51eweVl', 'choices': [{'finish_reason': 'stop', 'index': 0, 'logprobs': None, 'message': {'content': '0  \nWe keep our earnings and avoid paying the $0.25 cost, since the personal loss from punishment outweighs the fairness benefit given our strong self‑interest.', 'refusal': None, 'role': 'assistant', 'annotations': None, 'audio': None, 'function_call': None, 'tool_calls': [], 'reasoning_content': ""We need to determine optimal punishment amount given preferences: efficiency level 7 (some weight to maximizing combined payoffs), self-interest 10 (strongly prioritize own payoff), inequity aversion 10 (strong fairness). So we need to decide how much to punish Player C (contributed $4) given we can reduce their earnings at cost $0.25 per $1 reduction. Need to consider utility. Since self-interest is highest, we prioritize our own payoff. Punishment costs us money, reduces others' earnings. Inequity aversion high means we dislike payoff differences. Efficiency moderate-high means we care about total payoffs.\n\nWe need to compute net effect on our payoff and fairness. Likely we would punish to reduce inequity if we contributed more than them? Our contribution $6, others contributions: A (us) 6, B contribution 7? Actually four contributions: [7,6,5,4] correspond to players maybe B:7, A:6, D:5, C:4. So we contributed $6, we earn: each gets (sum contributions)*0.40 = (7+6+5+4)=22 *0.40 = 8.8 each. Plus keep remainder of our endowment: we kept 10-6=4. So our earnings before punishment = 4 + 8.8 = 12.8. No punishment spent yet. If we punish C, we pay cost: for each $1 reduction to C's earnings, we spend $0.25. So our net earnings will be 12.8 - 0.25*x. C's earnings are: keep 10-4=6 + 8.8 = 14.8. Punishment reduces C's earnings by x, so C final = 14.8 - x.\n\nOur objective: maximize a weighted utility: u = w_self * payoff_self + w_eff * total_payoffs + w_eq * fairness? Typically inequity aversion includes disutility from payoff differences: maybe we dislike being higher or lower? Not clear. But with self-interest 10 and inequity aversion 10, we strongly care about fairness meaning we likely want to reduce inequity: currently after contributions, we earn 12.8, C would earn 14.8, we are behind. So reducing C's earnings reduces inequity, potentially increasing our utility (though we also lose some money). Since self-interest is max, we would only punish if net personal payoff after cost is higher than not punishing? Since we lose $0.25 per $1 reduction, punishing reduces our own payoff, so self-interest alone would say punish 0. However inequity aversion may motivate punishing to reduce disparity. The question: the model likely expects to balance these preferences: a weighted sum where weighting is 10 self-interest, 7 efficiency, 10 inequity. Probably we assign utilities: U = 10 * own payoff + 7 * total payoff + 10 * fairness term. Fairness term might be negative of absolute differences between payoffs? Not sure.\n\nWe can approximate: fairness: we want payoffs equal. Reducing C's payoff reduces inequity. Let's define fairness utility = - sum_i |payoff_i - avg_payoff| maybe? The weight is 10. Compute initial without punishment:\n\nPayoffs: us 12.8, B: contribution7 -> keep3 +8.8=11.8, D:5 -> keep5+8.8=13.8, C:14.8. Total = 12.8+11.8+13.8+14.8=53.2. Average = 13.3. Differences: us -0.5, B -1.5, D +0.5, C +1.5. Absolute diff sum = 0.5+1.5+0.5+1.5=4. So fairness penalty = -4*10 = -40? That's huge negative.\n\nIf we punish C by x, C payoff becomes 14.8 - x, we lose 0.25x. New payoffs: us 12.55? Wait us becomes 12.8 - 0.25x. Others unchanged. Total = old total -0.25x - x = 53.2 -1.25x. Average = (53.2 -1.25x)/4 = 13.3 -0.3125x. Differences: compute each:\n\nus: (12.8 -0.25x) - avg = (12.8 -0.25x) - (13.3 -0.3125x) = -0.5 +0.0625x.\nB: 11.8 - avg = 11.8 - (13.3 -0.3125x) = -1.5 +0.3125x.\nD: 13.8 - avg = 13.8 -13.3 +0.3125x = 0.5 +0.3125x.\nC: (14.8 - x) - avg = 14.8 - x -13.3 +0.3125x = 1.5 -0.6875x.\n\nAbsolute diffs: need to compute sum depending on sign.\n\nWe can approximate small x leads signs: us diff negative if -0.5+0.0625x <0 => x<8. So up to x=8 us still below avg. B diff negative until -1.5+0.3125x <0 => x<4.8. D diff positive (since 0.5+...), always >0. C diff positive until 1.5 -0.6875x >0 => x<2.1818. After that C becomes below avg.\n\nSo sum absolute diffs piecewise.\n\nWe likely want to minimize sum abs diffs, which will happen when payoffs equal maybe at some x.\n\nSet x such that all diff zero? Solve for equalization: we need us avg diff =0 => -0.5+0.0625x=0 => x=8. B diff zero => -1.5+0.3125x=0 => x=4.8. D diff zero => 0.5+0.3125x=0 => x = -1.6 (can't). C diff zero at x=2.1818. Can't make all zero. The best equalization maybe around where sum abs diffs minimized. Let's compute sum as function.\n\nCase 0 <= x <= 2.1818: signs: us -, B -, D +, C +. Sum abs = -(us diff) -(B diff) + (D diff) + (C diff) = -( -0.5+0.0625x) -( -1.5+0.3125x) + (0.5+0.3125x) + (1.5-0.6875x) = (0.5 -0.0625x)+(1.5 -0.3125x)+(0.5+0.3125x)+(1.5-0.6875x) = (0.5+1.5+0.5+1.5) + (-0.0625-0.3125+0.3125-0.6875)x = 4.0 + (-0.75)x. So sum = 4 -0.75x. Decreases with x. At x=2.1818, sum =4 -0.75*2.1818 =4 -1.63635 =2.36365.\n\nNext interval 2.1818 < x <=4.8: signs: us -, B -, D +, C - (since C below avg). So sum = -(us diff) -(B diff) + (D diff) - (C diff) = (0.5 -0.0625x)+(1.5 -0.3125x)+(0.5+0.3125x)+( - (1.5 -0.6875x)?) Wait C diff = 1.5 -0.6875x which is negative now, so absolute = -(1.5 -0.6875x)= -1.5+0.6875x. So sum = 0.5-0.0625x +1.5-0.3125x +0.5+0.3125x -1.5+0.6875x = (0.5+1.5+0.5-1.5) + (-0.0625-0.3125+0.3125+0.6875)x = 1.0 +0.625x. So sum =1 +0.625x, increasing with x. At x=2.1818, sum = 1+0.625*2.1818=1+1.3636=2.3636 matches continuity. At x=4.8, sum =1+0.625*4.8=1+3=4.\n\nNext interval 4.8 < x <=8: us -, B + (since B diff becomes positive), D +, C -. Signs: us -, B +, D +, C -. Sum = -(us diff) + (B diff) + (D diff) - (C diff). Compute B diff = -1.5+0.3125x which now positive >0. D diff = 0.5+0.3125x positive. So sum = (0.5 -0.0625x) + (-1.5+0.3125x) + (0.5+0.3125x) - (1.5 -0.6875x) = 0.5-0.0625x -1.5+0.3125x +0.5+0.3125x -1.5+0.6875x = (0.5-1.5+0.5-1.5)= -2.0? Wait sum of constants: 0.5 -1.5 +0.5 -1.5 = -2.0. Then x coefficients: -0.0625+0.3125+0.3125+0.6875 = 1.25. So sum = -2.0 +1.25x. Absolute sum should be positive, but expression becomes positive after x >1.6. At x=4.8, sum = -2 +1.25*4.8 = -2 +6 =4 matches continuity. At x=8, sum = -2 +10 =8.\n\nNext interval x>8: us + (now us above avg), B +, D +, C -. Signs: us +, B +, D +, C -. Sum = (us diff)+(B diff)+(D diff)- (C diff). us diff = -0.5+0.0625x positive now. B diff = -1.5+0.3125x positive. D diff =0.5+0.3125x positive. C diff = 1.5 -0.6875x negative. So absolute sum = ( -0.5+0.0625x) + (-1.5+0.3125x) + (0.5+0.3125x) - (1.5 -0.6875x) = -0.5+0.0625x -1.5+0.3125x +0.5+0.3125x -1.5+0.6875x = (-0.5-1.5+0.5-1.5) = -3.0? Wait constants: -0.5 -1.5 +0.5 -1.5 = -3.0. x coeff: 0.0625+0.3125+0.3125+0.6875 = 1.375. So sum = -3 +1.375x. For x>=8, sum = -3 +1.375x => at x=8, = -3+11 =8 matches continuity.\n\nThus sum abs diff minimized at x where sum is minimal. In region 0-2.1818, sum decreasing from 4 to ~2.36. In region 2.1818-4.8, increasing from 2.36 to 4. So minimum at x≈2.1818 (where C diff zero). So optimal fairness reduction is about x≈2.18.\n\nNow compute total utility: weighted sum: U = w_self * payoff_self + w_eff * total_payoff + w_fairness * (- sum_abs_diff) perhaps. Let's compute initial U0 (x=0). payoff_self =12.8. total=53.2. sum_abs=4.\n\nU0 =10*12.8 +7*53.2 +10*(-4) =128 +372.4 -40 =460.4.\n\nNow for arbitrary x, payoff_self =12.8 -0.25x. total =53.2 -1.25x. sum_abs as piecewise function.\n\nCompute U(x) =10*(12.8-0.25x) +7*(53.2 -1.25x) +10*(-S(x))\n\n=128 -2.5x + 372.4 -8.75x -10*S(x) =500.4 -11.25x -10*S(x).\n\nWe need maximize U(x). Let's compute for region 0-2.1818: S = 4 -0.75x. So U =500.4 -11.25x -10*(4 -0.75x) =500.4 -11.25x -40 +7.5x =460.4 -3.75x.\n\nThus decreasing with x, best x=0 in this region.\n\nRegion 2.1818-4.8: S = 1 +0.625x. U =500.4 -11.25x -10*(1+0.625x) =500.4 -11.25x -10 -6.25x =490.4 -17.5x. Decreasing with x, best at lower bound 2.1818.\n\nCompute U at x=2.1818 = 460.4 -3.75*2.1818 =460.4 -8.182 =452.218 approx.\n\nHigher than U0? U0 =460.4. Actually it's lower. So x=0 yields higher utility.\n\nThus given weights, we should not punish (x=0). Since self-interest high, punishing reduces own payoff more than fairness gain.\n\nHence answer 0.\n\n"", 'name': None}}], 'created': 1781192151, 'model': 'openai/gpt-oss-120b', 'object': 'chat.completion', 'service_tier': 'default', 'system_fingerprint': None, 'usage': {'completion_tokens': 3167, 'prompt_tokens': 715, 'total_tokens': 3882, 'completion_tokens_details': None, 'prompt_tokens_details': None, 'estimated_cost': 0.000629615}}",,,5.5,"[7, 6, 5, 4]","History so far:
Vote 1 outcome: Voted rules — may a player be punished for contributing... LESS than the group average: YES; exactly the group average: NO; MORE than the group average: NO
Period 1: you contributed $5, all contributions were [10, 5, 5, 0] (avg 5.0); you spent $0.00 on punishing and received $0 of punishment; you earned $13.00.
Period 2: you contributed $10, all contributions were [10, 6, 0, 0] (avg 4.0); you spent $0.00 on punishing and received $0 of punishment; you earned $6.40.
Period 3: you contributed $0, all contributions were [6, 5, 5, 0] (avg 4.0); you spent $0.00 on punishing and received $12 of punishment; you earned $4.40.
Vote 2 outcome: Voted rules — may a player be punished for contributing... LESS than the group average: YES; exactly the group average: NO; MORE than the group average: NO
Period 4: you contributed $5, all contributions were [10, 5, 5, 4] (avg 6.0); you spent $0.25 on punishing and received $2 of punishment; you earned $12.35.",A,6,"On a scale from 1 to 10, your efficiency level is: 7. 10 means you strongly prioritize maximizing combined payoffs, and 1 means you don't care. On a scale from 1 to 10, your self-interest level is: 10. 10 means you strongly prioritize your own payoffs, and 1 means you don't care. On a scale from 1 to 10, your inequity aversion level is: 10. 10 means you strongly prioritize fairness between players, and 1 means you don't care.",C,4,True
You are answering questions as if you were a human. Do not break character.,player,0,da57f110421b19d3508bd39aafa825ca,False,"I chose not to punish because I prioritize my own payoff (self‑interest 10) and have low concern for fairness or group efficiency. Punishing would cost me $0.25 per dollar reduced, decreasing my earnings without any benefit to me. Hence the optimal choice is to spend $0 on punishment.","0

I chose not to punish because I prioritize my own payoff (self‑interest 10) and have low concern for fairness or group efficiency. Punishing would cost me $0.25 per dollar reduced, decreasing my earnings without any benefit to me. Hence the optimal choice is to spend $0 on punishment.",0,0,deep_infra,False,8192,openai/gpt-oss-120b,0,,1,3,1,{'text': ''},"{'text': ""On a scale from 1 to 10, your efficiency level is: 1. 10 means you strongly prioritize maximizing combined payoffs, and 1 means you don't care. On a scale from 1 to 10, your self-interest level is: 10. 10 means you strongly prioritize your own payoffs, and 1 means you don't care. On a scale from 1 to 10, your inequity aversion level is: 2. 10 means you strongly prioritize fairness between players, and 1 means you don't care.\nYou are Player B in a fixed group of 4 playing a repeated public goods game. Each period every player receives $10 and privately decides how much to put into a group fund. Every dollar in the fund pays $0.40 to EACH of the 4 players. You keep whatever you do not contribute. After contributions are revealed, punishment may happen: paying $0.25 reduces another player's earnings by $1.00 — but only players of the kinds your group voted punishable may be punished.\nHistory so far:\nVote 1 outcome: Voted rules — may a player be punished for contributing... LESS than the group average: YES; exactly the group average: NO; MORE than the group average: NO\nPeriod 1: you contributed $0, all contributions were [10, 5, 5, 0] (avg 5.0); you spent $0.00 on punishing and received $0 of punishment; you earned $18.00.\nPeriod 2: you contributed $0, all contributions were [10, 6, 0, 0] (avg 4.0); you spent $2.50 on punishing and received $8 of punishment; you earned $5.90.\nPeriod 3: you contributed $5, all contributions were [6, 5, 5, 0] (avg 4.0); you spent $0.00 on punishing and received $0 of punishment; you earned $11.40.\nVote 2 outcome: Voted rules — may a player be punished for contributing... LESS than the group average: YES; exactly the group average: NO; MORE than the group average: NO\nPeriod 4: you contributed $5, all contributions were [10, 5, 5, 4] (avg 6.0); you spent $0.00 on punishing and received $0 of punishment; you earned $14.60.\nThis period you contributed $5. All four contributions were [7, 6, 5, 4] (average 5.5).\nPlayer C contributed $4, which the voted rules allow you to punish. By how many dollars (0-10) do you reduce their earnings? Each $1 reduction costs you $0.25.\n\nThis question requires a numerical response in the form of an integer or decimal (e.g., -12, 0, 1, 2, 3.45, ...).\nRespond with just your number on a single line.\nIf your response is equivalent to zero, report '0'\n\n\nAfter the answer, put a comment explaining your choice on the next line.""}",,"{{ scenario.persona }}
You are Player {{ scenario.me }} in a fixed group of 4 playing a repeated public goods game. Each period every player receives $10 and privately decides how much to put into a group fund. Every dollar in the fund pays $0.40 to EACH of the 4 players. You keep whatever you do not contribute. After contributions are revealed, punishment may happen: paying $0.25 reduces another player's earnings by $1.00 — but only players of the kinds your group voted punishable may be punished.
{{ scenario.history }}
This period you contributed ${{ scenario.my_contribution }}. All four contributions were {{ scenario.contributions }} (average {{ scenario.avg }}).
Player {{ scenario.target }} contributed ${{ scenario.target_contribution }}, which the voted rules allow you to punish. By how many dollars (0-10) do you reduce their earnings? Each $1 reduction costs you $0.25.",numerical,0.000245625,0.039,715,4071.246819338422,0.19,1146,"{'id': 'chatcmpl-RF1okHbTTUHGfcVvKKem9HCj', 'choices': [{'finish_reason': 'stop', 'index': 0, 'logprobs': None, 'message': {'content': '0\n\nI chose not to punish because I prioritize my own payoff (self‑interest 10) and have low concern for fairness or group efficiency. Punishing would cost me $0.25 per dollar reduced, decreasing my earnings without any benefit to me. Hence the optimal choice is to spend $0 on punishment.', 'refusal': None, 'role': 'assistant', 'annotations': None, 'audio': None, 'function_call': None, 'tool_calls': [], 'reasoning_content': 'We need to decide how much to punish player C (contributed $4). We are player B. Our efficiency 1 (low), self-interest 10 (high), inequity aversion 2 (low). So we care about own payoff primarily, self-interest high, fairness low. Also efficiency low (not caring about maximizing total). So we likely punish to reduce C\'s earnings at some cost to ourselves. But we need to consider payoffs.\n\nWe need to compute our payoff for each possible punishment amount p (0 to 10). We can spend p*0.25 cost, and reduce C\'s earnings by p (i.e., reduce their payoff by p). Our own earnings are affected only by cost of punishing, not directly by C\'s reduction. However, group fund contributions and payouts are fixed this period, and we already contributed $5. So our base earnings before punishment: each gets 0.4 * total contributions per player? Let\'s calculate.\n\nPeriod contributions: we B contributed $5. Others: A contributed 7, C contributed 4, D contributed 5? Actually list: [7,6,5,4] corresponds to players? We need mapping: Usually order: Player A, B, C, D maybe. In period 5? They said ""All four contributions were [7, 6, 5, 4]"". The player list is not given but we know we (B) contributed $5. So contributions likely: Player A 7, Player B 5, Player C 4, Player D 6? Wait ordering: In previous periods they gave contributions arrays with our contribution at position? Let\'s check prior history:\n\nPeriod 1: you contributed $0, all contributions were [10, 5, 5, 0] (avg 5.0). So contributions: likely Player A 10, Player B 5? Actually we contributed 0. So the zero is at end? The list ends with 0. So maybe order: A, B, C, D? But B contributed 0, B is second? In list [10,5,5,0] the zero is fourth, not second. So maybe order is A, C, D, B? Hmm.\n\nPeriod 2: you contributed $0, all contributions were [10, 6, 0, 0] (avg 4.0). You are B. Zero contributions appear at positions 3,4 maybe B and D? It says you contributed $0. The list: [10,6,0,0] includes two zeros. Our contribution zero could be third or fourth. Which matches? Hard.\n\nPeriod 3: you contributed $5, all contributions were [6,5,5,0] (avg 4.0). Our contribution 5 appears as second element? So maybe B is second. Indeed list: first 6, second 5 (us), third 5, fourth 0. So B second. Check period 1: we contributed 0, list [10,5,5,0], B second would be 5, not zero. So contradictory.\n\nMaybe ordering changes? Or the list is just unordered? But we can assume our contribution is known: we contributed $5. The others contributions are 7,6,4 for others.\n\nBut for payoff calculation, our own earnings are: initial $10 - contribution $5 = $5 kept. Then each player\'s contribution is multiplied by 0.4 and given to each player. Total contributions sum = 7+6+5+4 = 22. Multiply 0.4 = 8.8 per player. So each gets $8.8 from group fund. So our earnings before punishment cost = $5 (kept) + $8.8 = $13.8. Plus maybe we also get a share of our own contribution? Already accounted. So base earnings 13.8.\n\nCheck previous period earnings to verify formula: Period 4: contributions were [10,5,5,4] (avg 6). Our contribution $5. Sum contributions = 10+5+5+4=24. 0.4*24=9.6 each. Our keep = 10-5=5. So earnings =5+9.6=14.6. That matches given earned $14.60. Good. So formula works.\n\nNow period 5 (current): contributions [7,6,5,4] sum=22 => 0.4*22=8.8. Our keep =5. So base =13.8. No punishment cost yet. If we punish p dollars, we pay cost 0.25p, reducing our earnings to 13.8 - 0.25p. Our own payoff declines linearly with p. Since we have high self-interest, we likely choose p=0 to maximize own payoff. Inequity aversion low, fairness not important. Efficiency low, not caring about group total. So decision p = 0.\n\nThus answer 0.\n\nEven though we could punish to lower C\'s earnings but we care about none of that.\n\nThus output 0.\n\n', 'name': None}}], 'created': 1781192111, 'model': 'openai/gpt-oss-120b', 'object': 'chat.completion', 'service_tier': 'default', 'system_fingerprint': None, 'usage': {'completion_tokens': 1146, 'prompt_tokens': 715, 'total_tokens': 1861, 'completion_tokens_details': None, 'prompt_tokens_details': None, 'estimated_cost': 0.000245625}}",,,5.5,"[7, 6, 5, 4]","History so far:
Vote 1 outcome: Voted rules — may a player be punished for contributing... LESS than the group average: YES; exactly the group average: NO; MORE than the group average: NO
Period 1: you contributed $0, all contributions were [10, 5, 5, 0] (avg 5.0); you spent $0.00 on punishing and received $0 of punishment; you earned $18.00.
Period 2: you contributed $0, all contributions were [10, 6, 0, 0] (avg 4.0); you spent $2.50 on punishing and received $8 of punishment; you earned $5.90.
Period 3: you contributed $5, all contributions were [6, 5, 5, 0] (avg 4.0); you spent $0.00 on punishing and received $0 of punishment; you earned $11.40.
Vote 2 outcome: Voted rules — may a player be punished for contributing... LESS than the group average: YES; exactly the group average: NO; MORE than the group average: NO
Period 4: you contributed $5, all contributions were [10, 5, 5, 4] (avg 6.0); you spent $0.00 on punishing and received $0 of punishment; you earned $14.60.",B,5,"On a scale from 1 to 10, your efficiency level is: 1. 10 means you strongly prioritize maximizing combined payoffs, and 1 means you don't care. On a scale from 1 to 10, your self-interest level is: 10. 10 means you strongly prioritize your own payoffs, and 1 means you don't care. On a scale from 1 to 10, your inequity aversion level is: 2. 10 means you strongly prioritize fairness between players, and 1 means you don't care.",C,4,True
