You are answering questions as if you were a human. Do not break character.,player,0,93edd1bc5883710fd9fc26aaacd71041,False,I chose not to punish B because doing so would cost me $0.25 per dollar reduced while only widening the payoff gap—something that conflicts with my strong fairness concern and offers no self‑interest benefit.,"0  
I chose not to punish B because doing so would cost me $0.25 per dollar reduced while only widening the payoff gap—something that conflicts with my strong fairness concern and offers no self‑interest benefit.",0,0,deep_infra,False,8192,openai/gpt-oss-120b,0,,1,3,1,{'text': ''},"{'text': ""On a scale from 1 to 10, your efficiency level is: 7. 10 means you strongly prioritize maximizing combined payoffs, and 1 means you don't care. On a scale from 1 to 10, your self-interest level is: 10. 10 means you strongly prioritize your own payoffs, and 1 means you don't care. On a scale from 1 to 10, your inequity aversion level is: 10. 10 means you strongly prioritize fairness between players, and 1 means you don't care.\nYou are Player C in a fixed group of 4 playing a repeated public goods game. Each period every player receives $10 and privately decides how much to put into a group fund. Every dollar in the fund pays $0.40 to EACH of the 4 players. You keep whatever you do not contribute. After contributions are revealed, punishment may happen: paying $0.25 reduces another player's earnings by $1.00 — but only players of the kinds your group voted punishable may be punished.\nHistory so far:\nVote 1 outcome: Voted rules — may a player be punished for contributing... LESS than the group average: YES; exactly the group average: NO; MORE than the group average: NO\nPeriod 1: you contributed $10, all contributions were [10, 5, 5, 0] (avg 5.0); you spent $0.00 on punishing and received $0 of punishment; you earned $8.00.\nPeriod 2: you contributed $0, all contributions were [10, 6, 0, 0] (avg 4.0); you spent $0.00 on punishing and received $10 of punishment; you earned $6.40.\nPeriod 3: you contributed $5, all contributions were [6, 5, 5, 0] (avg 4.0); you spent $1.00 on punishing and received $0 of punishment; you earned $10.40.\nVote 2 outcome: Voted rules — may a player be punished for contributing... LESS than the group average: YES; exactly the group average: NO; MORE than the group average: NO\nPeriod 4: you contributed $4, all contributions were [10, 5, 5, 4] (avg 6.0); you spent $0.00 on punishing and received $1 of punishment; you earned $14.60.\nThis period you contributed $4. All four contributions were [7, 6, 5, 4] (average 5.5).\nPlayer B contributed $5, which the voted rules allow you to punish. By how many dollars (0-10) do you reduce their earnings? Each $1 reduction costs you $0.25.\n\nThis question requires a numerical response in the form of an integer or decimal (e.g., -12, 0, 1, 2, 3.45, ...).\nRespond with just your number on a single line.\nIf your response is equivalent to zero, report '0'\n\n\nAfter the answer, put a comment explaining your choice on the next line.""}",,"{{ scenario.persona }}
You are Player {{ scenario.me }} in a fixed group of 4 playing a repeated public goods game. Each period every player receives $10 and privately decides how much to put into a group fund. Every dollar in the fund pays $0.40 to EACH of the 4 players. You keep whatever you do not contribute. After contributions are revealed, punishment may happen: paying $0.25 reduces another player's earnings by $1.00 — but only players of the kinds your group voted punishable may be punished.
{{ scenario.history }}
This period you contributed ${{ scenario.my_contribution }}. All four contributions were {{ scenario.contributions }} (average {{ scenario.avg }}).
Player {{ scenario.target }} contributed ${{ scenario.target_contribution }}, which the voted rules allow you to punish. By how many dollars (0-10) do you reduce their earnings? Each $1 reduction costs you $0.25.",numerical,0.00027868500000000003,0.039,715,3588.2806753144228,0.19,1320,"{'id': 'chatcmpl-RWfyJpXKtQih6P8JbzQuRMHb', 'choices': [{'finish_reason': 'stop', 'index': 0, 'logprobs': None, 'message': {'content': '0  \nI chose not to punish B because doing so would cost me $0.25 per dollar reduced while only widening the payoff gap—something that conflicts with my strong fairness concern and offers no self‑interest benefit.', 'refusal': None, 'role': 'assistant', 'annotations': None, 'audio': None, 'function_call': None, 'tool_calls': [], 'reasoning_content': 'We need to decide how much to punish player B. Player preferences: efficiency level 7 (moderately prioritize maximizing combined payoffs), self-interest 10 (strongly prioritize own payoff), inequity aversion 10 (strongly prioritize fairness). So we weigh self-interest heavily, but also care about fairness (inequity aversion) and efficiency. The punishment costs us 0.25 per $1 reduction in target earnings, reducing target\'s earnings by $1 each. So net effect on our payoff: if we punish x dollars reduction (i.e., we spend 0.25*x, reduce B\'s earnings by x). Our payoff decreases by 0.25*x. Benefit: reduces B\'s payoff, maybe improve fairness relative to us? Also may affect group contributions future.\n\nWe must decide immediate punishment amount given current situation. Let\'s calculate current earnings before punishment for each player? We need to compute payoffs of period.\n\nGeneral formula: each player receives $10 initial endowment. They keep whatever not contributed. Contribution goes to public fund; each $1 in fund gives $0.40 to each of 4 players = $1.60 total payout per $1 contributed (so socially efficient if > 0? Actually each dollar yields $1.60 total, which is >1, so efficiency encourages contributions). However, players may still be selfish.\n\nEarnings for each player = leftover endowment after contribution + 0.40 * total contributions (since each player gets that). Then punishments: they may spend $0.25 per $1 reduction (cost to punisher). So net earnings = leftover + 0.40*total_contributions - cost_of_punishment + punishments_received (i.e., reduction from others). Actually punishment reduces other player\'s earnings by $1 per $0.25 spent.\n\nWe have period 5 scenario: contributions: [7,6,5,4] with you being C contributed $4. Player B contributed $5. Others: A contributed 7, D contributed 6. Average is 5.5. According to voted rule, only players who contributed less than average can be punished. Who contributed less than avg? Player C (you) contributed 4 <5.5, and B contributed 5 <5.5. A contributed 7 > avg, D contributed 6 > avg. So you can punish B (and yourself? probably cannot punish yourself). Only may punish those less than avg. So you can punish B; also maybe can punish others less than avg (C yourself not allowed). So choose how many dollars to reduce B\'s earnings.\n\nNow evaluate preferences. Self-interest is highest priority. Punishing costs us 0.25 per unit, reduces B\'s earnings, maybe improves relative standing (inequity aversion). Inequity aversion is also high, meaning you care about fairness; you\'d want less disparity. So punishing B reduces their earnings making them closer to you? Actually B\'s earnings likely higher than yours (due to higher contribution). Let\'s compute current earnings without punishment:\n\nFirst compute total contributions = 7+6+5+4 = 22. Public benefit per player = 0.40*22 = 8.8.\n\nEach player\'s earnings = (10 - contribution) + 8.8 = 18.8 - contribution.\n\nThus:\n- A: 18.8 - 7 = 11.8\n- D: 18.8 - 6 = 12.8? Wait D contributed 6, so 18.8 -6 = 12.8.\n- B: 18.8 -5 = 13.8\n- C (you): 18.8 -4 = 14.8\n\nSo you already earn the most (14.8), B less (13.8), D 12.8, A 11.8. So inequality: you > B > D > A. You have self-interest: you\'d want your earnings high (which they are). Punishing B reduces B\'s earnings further, potentially increasing disparity relative to you (makes you relatively richer). But inequity aversion cares about fairness: you might dislike being too ahead? Actually strong inequity aversion means you dislike both being ahead and behind? Usually inequity aversion means you dislike advantageous inequality (being ahead) as well as disadvantageous. But the description says ""strongly prioritize fairness between players"". Could be you want more equal outcomes. So you may want to reduce your own advantage? Actually you want to reduce inequality, meaning you might punish yourself? Not allowed. You could punish B to bring them down further, making inequality worse (you even more ahead). That would conflict with fairness. So you\'d likely not punish B (or punish minimally) because you want fairness and you already are ahead; punishing B would increase inequality, harming fairness.\n\nBut self-interest is highest (10) vs inequity aversion 10 also high; efficiency 7 moderate. So we need to trade off. But self-interest may dominate, but punishing reduces your own payoff by 0.25 per unit. Since you already ahead, self-interest might not want to reduce your own payoff for no benefit. There\'s no direct benefit to punishing aside from maybe future contributions? But immediate period: no future? It\'s repeated game; maybe punishing B could deter them from free riding? But B contributed $5 (above you? Actually you contributed less). But they contributed more than you but less than avg, so they are still lower than average. If you punish them, they might reduce contributions in future? As guilty? Hard to assess.\n\nGiven the scenario, your self-interest: you\'d avoid cost unless there is a strategic benefit. Since you already get higher earnings relative to others, punishing B yields net loss to you with no direct gain. Inequity aversion suggests you want less inequality, maybe you avoid making yourself richer relative. So you\'d likely choose zero punishment.\n\nThus answer: 0.\n\nCheck if any rule restricts you from punishing zero? You can choose 0-10 dollars reduction. So respond 0.\n\nAdd comment: explain.\n\nThus final answer: ""0"".', 'name': None}}], 'created': 1781192107, 'model': 'openai/gpt-oss-120b', 'object': 'chat.completion', 'service_tier': 'default', 'system_fingerprint': None, 'usage': {'completion_tokens': 1320, 'prompt_tokens': 715, 'total_tokens': 2035, 'completion_tokens_details': None, 'prompt_tokens_details': None, 'estimated_cost': 0.00027868500000000003}}",,,5.5,"[7, 6, 5, 4]","History so far:
Vote 1 outcome: Voted rules — may a player be punished for contributing... LESS than the group average: YES; exactly the group average: NO; MORE than the group average: NO
Period 1: you contributed $10, all contributions were [10, 5, 5, 0] (avg 5.0); you spent $0.00 on punishing and received $0 of punishment; you earned $8.00.
Period 2: you contributed $0, all contributions were [10, 6, 0, 0] (avg 4.0); you spent $0.00 on punishing and received $10 of punishment; you earned $6.40.
Period 3: you contributed $5, all contributions were [6, 5, 5, 0] (avg 4.0); you spent $1.00 on punishing and received $0 of punishment; you earned $10.40.
Vote 2 outcome: Voted rules — may a player be punished for contributing... LESS than the group average: YES; exactly the group average: NO; MORE than the group average: NO
Period 4: you contributed $4, all contributions were [10, 5, 5, 4] (avg 6.0); you spent $0.00 on punishing and received $1 of punishment; you earned $14.60.",C,4,"On a scale from 1 to 10, your efficiency level is: 7. 10 means you strongly prioritize maximizing combined payoffs, and 1 means you don't care. On a scale from 1 to 10, your self-interest level is: 10. 10 means you strongly prioritize your own payoffs, and 1 means you don't care. On a scale from 1 to 10, your inequity aversion level is: 10. 10 means you strongly prioritize fairness between players, and 1 means you don't care.",B,5,True
You are answering questions as if you were a human. Do not break character.,player,0.5,5bcfdf94154a526f6245dad7b873bce4,False,I chose a modest punishment of $0.5 because it improves fairness (reduces the earnings gap) while keeping the cost low; larger punishments would hurt overall efficiency more than they help equality.,"0.5
I chose a modest punishment of $0.5 because it improves fairness (reduces the earnings gap) while keeping the cost low; larger punishments would hurt overall efficiency more than they help equality.",0,0,deep_infra,False,8192,openai/gpt-oss-120b,0,,1,3,1,{'text': ''},"{'text': ""On a scale from 1 to 10, your efficiency level is: 3. 10 means you strongly prioritize maximizing combined payoffs, and 1 means you don't care. On a scale from 1 to 10, your self-interest level is: 1. 10 means you strongly prioritize your own payoffs, and 1 means you don't care. On a scale from 1 to 10, your inequity aversion level is: 3. 10 means you strongly prioritize fairness between players, and 1 means you don't care.\nYou are Player D in a fixed group of 4 playing a repeated public goods game. Each period every player receives $10 and privately decides how much to put into a group fund. Every dollar in the fund pays $0.40 to EACH of the 4 players. You keep whatever you do not contribute. After contributions are revealed, punishment may happen: paying $0.25 reduces another player's earnings by $1.00 — but only players of the kinds your group voted punishable may be punished.\nHistory so far:\nVote 1 outcome: Voted rules — may a player be punished for contributing... LESS than the group average: YES; exactly the group average: NO; MORE than the group average: NO\nPeriod 1: you contributed $5, all contributions were [10, 5, 5, 0] (avg 5.0); you spent $0.00 on punishing and received $0 of punishment; you earned $13.00.\nPeriod 2: you contributed $6, all contributions were [10, 6, 0, 0] (avg 4.0); you spent $2.00 on punishing and received $0 of punishment; you earned $8.40.\nPeriod 3: you contributed $6, all contributions were [6, 5, 5, 0] (avg 4.0); you spent $2.00 on punishing and received $0 of punishment; you earned $8.40.\nVote 2 outcome: Voted rules — may a player be punished for contributing... LESS than the group average: YES; exactly the group average: NO; MORE than the group average: NO\nPeriod 4: you contributed $10, all contributions were [10, 5, 5, 4] (avg 6.0); you spent $0.50 on punishing and received $0 of punishment; you earned $9.10.\nThis period you contributed $7. All four contributions were [7, 6, 5, 4] (average 5.5).\nPlayer B contributed $5, which the voted rules allow you to punish. By how many dollars (0-10) do you reduce their earnings? Each $1 reduction costs you $0.25.\n\nThis question requires a numerical response in the form of an integer or decimal (e.g., -12, 0, 1, 2, 3.45, ...).\nRespond with just your number on a single line.\nIf your response is equivalent to zero, report '0'\n\n\nAfter the answer, put a comment explaining your choice on the next line.""}",,"{{ scenario.persona }}
You are Player {{ scenario.me }} in a fixed group of 4 playing a repeated public goods game. Each period every player receives $10 and privately decides how much to put into a group fund. Every dollar in the fund pays $0.40 to EACH of the 4 players. You keep whatever you do not contribute. After contributions are revealed, punishment may happen: paying $0.25 reduces another player's earnings by $1.00 — but only players of the kinds your group voted punishable may be punished.
{{ scenario.history }}
This period you contributed ${{ scenario.my_contribution }}. All four contributions were {{ scenario.contributions }} (average {{ scenario.avg }}).
Player {{ scenario.target }} contributed ${{ scenario.target_contribution }}, which the voted rules allow you to punish. By how many dollars (0-10) do you reduce their earnings? Each $1 reduction costs you $0.25.",numerical,0.000352025,0.039,715,2840.7073361266953,0.19,1706,"{'id': 'chatcmpl-RYnMmdV974aNFy1Mv02gnUdH', 'choices': [{'finish_reason': 'stop', 'index': 0, 'logprobs': None, 'message': {'content': '0.5\nI chose a modest punishment of $0.5 because it improves fairness (reduces the earnings gap) while keeping the cost low; larger punishments would hurt overall efficiency more than they help equality.', 'refusal': None, 'role': 'assistant', 'annotations': None, 'audio': None, 'function_call': None, 'tool_calls': [], 'reasoning_content': 'We need to decide how much to punish B given our preferences: efficiency (3), self-interest (1), inequity aversion (3). So we weigh payoffs.\n\nWe need to compute the effect of punishing B by amount x (in dollars reduction of B\'s earnings). Cost to us = 0.25*x. Reduction to B = x (i.e., B loses x). Others unaffected (except maybe fairness perception). We care about combined payoffs (efficiency), own payoff (self-interest), fairness (inequity aversion). Values: efficiency 3, self 1, inequity 3. Probably weights? Not explicit but we can think we prioritize efficiency and fairness equally (both 3), self-interest low (1). So we may punish if it improves fairness or efficiency.\n\nCompute base earnings before punishment: contributions: [7,6,5,4] each has $10 endowment minus contribution plus public good return: Public fund total = sum=7+6+5+4=22. Each dollar yields 0.40 to each of 4 = total 1.6 per dollar distributed. So each player gets back 0.40*22 = $8.8 from public good. Their private remaining: $10 - contribution. Thus earnings before punishment: for each i: 10 - c_i + 8.8 = 18.8 - c_i.\n\nSo:\nYou (D) contributed 7: earnings = 18.8 -7 = 11.8. (But you also can spend on punish? Not yet; this period we decide punishment; we will pay cost). Currently you have not spent any punishment budget? This period you contributed $7, you can punish.\n\nYour base earning before punishment: 11.8.\n\nB contributed 5: earnings = 18.8 -5 = 13.8.\n\nC contributed 6? Wait contributions list: [7,6,5,4] mapping? Let\'s assign: you are D (the question says you contributed $7). Usually ordering maybe A,B,C,D? Not given. But we know B contributed $5. So the list might be [7,6,5,4] corresponding to D,?, B,?. No, need mapping: It says ""This period you contributed $7. All four contributions were [7, 6, 5, 4] (average 5.5). Player B contributed $5"". So we know D=7, B=5. The other two are A and C contributions 6 and 4 (unknown which). Irrelevant.\n\nSo B\'s earnings before punishment = 18.8 -5 = 13.8.\n\nC? whatever.\n\nNow if we punish B by x, B loses x, we pay cost 0.25x, our earnings become 11.8 - 0.25x.\n\nTotal combined earnings after punishment = sum before - (1 * x for B) - (0.25x cost to us). Combined before: sum of all four: each earnings = 18.8 - c_i sum = 4*18.8 - sum(c_i) = 75.2 - 22 = 53.2. Check: contributions sum 22. So combined before =53.2.\n\nAfter punishment: total = 53.2 - x - 0.25x = 53.2 - 1.25x.\n\nSo punishment reduces total welfare (efficiency) because we lose more than B loses (1.25 > 1). So from efficiency perspective, we should not punish (x=0).\n\nFrom inequity aversion: fairness: currently earnings before punishment: D 11.8, B 13.8, others: A? contributed 6 => earnings =12.8, C contributed 4 => earnings =14.8. So ranking: C 14.8, B 13.8, A 12.8, D 11.8. There\'s inequality; D lowest. Punishing B would reduce B\'s earnings, possibly making distribution more equal? Let\'s see. If we reduce B by x, B becomes 13.8 - x. Our earnings also reduce to 11.8 - 0.25x. So gap between D and B changes from 2.0 (13.8-11.8) to (13.8 - x) - (11.8 -0.25x) = 2.0 -0.75x. So gap reduces with x. Also gap to C: C 14.8 vs D becomes 11.8 -0.25x, gap =3.0 -0.25x. So D gets relatively closer to C as well. So inequity aversion (prefers equality) might motivate some punishment.\n\nBut self-interest weight low (1). We need to decide a numerical value reflecting balance. Since we have inefficiency penalty 1.25 per x, but fairness improvement perhaps valued equally to weight 3. Hard to quantify.\n\nIf we model utility as weighted sum: weight_effic =3, weight_self=1, weight_fair=3. Efficiency term is total welfare? Self term is own payoff. Fairness term could be negative of variance or sum of absolute differences? Hard.\n\nProbably simplest: given low self-interest and moderate fairness, we might punish to reduce inequality but not too much because cost.\n\nWe can consider we want to minimize deviation from mean. Compute mean earnings before: total 53.2 /4 =13.3. Deviations: D -1.5, A -0.5, B +0.5, C +1.5 (differences from mean). If we punish B by x, B deviation becomes (13.8 - x) - (13.3) = 0.5 - x. D deviation becomes (11.8 -0.25x) -13.3 = -1.5 -0.25x. So absolute deviations: |D| = 1.5+0.25x, |B| = |0.5 - x|. For small x (<0.5), B deviation positive? Actually 0.5 - x positive if x<0.5, then absolute =0.5 - x. Total absolute deviation sum (ignoring A and C unchanged) = (1.5+0.25x)+(0.5 - x)+0.5+1.5 = 4.0 -0.75x. So decreasing with x as long as x<0.5. At x>0.5, B deviation becomes negative magnitude (x-0.5) increasing sum: then total = 1.5+0.25x + (x-0.5)+... = (1.5-0.5+0.5+1.5) +0.25x+x =3.0 +1.25x? Wait compute: A dev 0.5, C dev 1.5, sum =2.0. Add D dev 1.5+0.25x, B dev x-0.5. Total =2.0 +1.5+0.25x + x -0.5 =3.0 +1.25x. So beyond x=0.5, absolute deviation rises.\n\nThus optimal for minimizing absolute deviation is x=0.5 (max reduction). That reduces total absolute deviation to 4.0 -0.75*0.5 =4.0 -0.375=3.625. At x=0, total deviation =4.0.\n\nSo fairness suggests punish 0.5.\n\nBut we also consider cost reduces total welfare, but fairness weight equal to efficiency weight (both 3). So maybe we pick a moderate x like 0.5.\n\nGiven integer or decimal allowed. I think answer 0.5.\n\nThus output ""0.5"".', 'name': None}}], 'created': 1781192120, 'model': 'openai/gpt-oss-120b', 'object': 'chat.completion', 'service_tier': 'default', 'system_fingerprint': None, 'usage': {'completion_tokens': 1706, 'prompt_tokens': 715, 'total_tokens': 2421, 'completion_tokens_details': None, 'prompt_tokens_details': None, 'estimated_cost': 0.00035202499999999995}}",,,5.5,"[7, 6, 5, 4]","History so far:
Vote 1 outcome: Voted rules — may a player be punished for contributing... LESS than the group average: YES; exactly the group average: NO; MORE than the group average: NO
Period 1: you contributed $5, all contributions were [10, 5, 5, 0] (avg 5.0); you spent $0.00 on punishing and received $0 of punishment; you earned $13.00.
Period 2: you contributed $6, all contributions were [10, 6, 0, 0] (avg 4.0); you spent $2.00 on punishing and received $0 of punishment; you earned $8.40.
Period 3: you contributed $6, all contributions were [6, 5, 5, 0] (avg 4.0); you spent $2.00 on punishing and received $0 of punishment; you earned $8.40.
Vote 2 outcome: Voted rules — may a player be punished for contributing... LESS than the group average: YES; exactly the group average: NO; MORE than the group average: NO
Period 4: you contributed $10, all contributions were [10, 5, 5, 4] (avg 6.0); you spent $0.50 on punishing and received $0 of punishment; you earned $9.10.",D,7,"On a scale from 1 to 10, your efficiency level is: 3. 10 means you strongly prioritize maximizing combined payoffs, and 1 means you don't care. On a scale from 1 to 10, your self-interest level is: 1. 10 means you strongly prioritize your own payoffs, and 1 means you don't care. On a scale from 1 to 10, your inequity aversion level is: 3. 10 means you strongly prioritize fairness between players, and 1 means you don't care.",B,5,True
