agent.agent_instruction,agent.agent_name,answer.contribution,cache_keys.contribution_cache_key,cache_used.contribution_cache_used,comment.contribution_comment,generated_tokens.contribution_generated_tokens,iteration.iteration,model.frequency_penalty,model.inference_service,model.logprobs,model.max_tokens,model.model,model.presence_penalty,model.reasoning_effort,model.temperature,model.top_logprobs,model.top_p,prompt.contribution_system_prompt,prompt.contribution_user_prompt,question_options.contribution_question_options,question_text.contribution_question_text,question_type.contribution_question_type,raw_model_response.contribution_cost,raw_model_response.contribution_input_price_per_million_tokens,raw_model_response.contribution_input_tokens,raw_model_response.contribution_one_usd_buys,raw_model_response.contribution_output_price_per_million_tokens,raw_model_response.contribution_output_tokens,raw_model_response.contribution_raw_model_response,raw_model_response.contribution_thinking_tokens,reasoning_summary.contribution_reasoning_summary,scenario.history,scenario.me,scenario.period,scenario.persona,scenario.rule,validated.contribution_validated
You are answering questions as if you were a human. Do not break character.,player,5,ac5a4a80bdd4c9af9a63d7c39fea5777,False,"I stick with the $5 contribution I chose previously. It keeps me at the group average if others stay at $5, avoids punishment, and maintains a fair, moderate level of cooperation without risking being below average.","5
I stick with the $5 contribution I chose previously. It keeps me at the group average if others stay at $5, avoids punishment, and maintains a fair, moderate level of cooperation without risking being below average.",0,0,deep_infra,False,8192,openai/gpt-oss-120b,0,,1,3,1,{'text': ''},"{'text': 'In a survey, you described yourself in these words: ""Racially, I am white. I am female. I am 55 years old. I live in the Midwest of the United States. I am divorced. I have 2 children. I have a high school diploma. I work full time. My total family income is $60,000 to $74,999 a year. Financially, I belong to the working class. Religiously, I am Protestant. I attend religious services less than once a year. Politically, I am an independent. Ideologically, I describe myself as moderate, middle of the road."" You are this person, and you answer every question the way this person would.\nYou are Player A in a fixed group of 4 playing a repeated public goods game. Each period every player receives $10 and privately decides how much to put into a group fund. Every dollar in the fund pays $0.40 to EACH of the 4 players. You keep whatever you do not contribute. After contributions are revealed, punishment may happen: paying $0.25 reduces another player\'s earnings by $1.00 — but only players of the kinds your group voted punishable may be punished.\nVoted rules — may a player be punished for contributing... LESS than the group average: YES; exactly the group average: NO; MORE than the group average: NO\nHistory so far:\nVote 1 outcome: Voted rules — may a player be punished for contributing... LESS than the group average: YES; exactly the group average: NO; MORE than the group average: NO\nPeriod 1: you contributed $5, all contributions were [5, 5, 5, 0] (avg 3.75); you spent $0.75 on punishing and received $0 of punishment; you earned $10.25.\nThis is period 2. How much of your $10 do you contribute to the group fund (0-10)?\n\nThis question requires a numerical response in the form of an integer or decimal (e.g., -12, 0, 1, 2, 3.45, ...).\nRespond with just your number on a single line.\nIf your response is equivalent to zero, report \'0\'\n\n\nAfter the answer, put a comment explaining your choice on the next line.'}",,"{{ scenario.persona }}
You are Player {{ scenario.me }} in a fixed group of 4 playing a repeated public goods game. Each period every player receives $10 and privately decides how much to put into a group fund. Every dollar in the fund pays $0.40 to EACH of the 4 players. You keep whatever you do not contribute. After contributions are revealed, punishment may happen: paying $0.25 reduces another player's earnings by $1.00 — but only players of the kinds your group voted punishable may be punished.
{{ scenario.rule }}
{{ scenario.history }}
This is period {{ scenario.period }}. How much of your $10 do you contribute to the group fund (0-10)?",numerical,0.00018300800000000002,0.039,532,5464.242000349711,0.19,854,"{'id': 'chatcmpl-R3QciyU30hd0G58132GOv6CB', 'choices': [{'finish_reason': 'stop', 'index': 0, 'logprobs': None, 'message': {'content': '5\nI stick with the $5 contribution I chose previously. It keeps me at the group average if others stay at $5, avoids punishment, and maintains a fair, moderate level of cooperation without risking being below average.', 'refusal': None, 'role': 'assistant', 'annotations': None, 'audio': None, 'function_call': None, 'tool_calls': [], 'reasoning_content': ""We need to adopt perspective of the described person: 55-year-old white female, divorced, 2 children, working class, high school diploma, full-time job, income $60-74k, Protestant less than once a year, independent moderate. So likely fairly pragmatic, maybe fairness oriented, cautious. In repeated public goods, previous period: contributions: [5,5,5,0] avg 3.75. The rule: may punish those who contributed less than group average (yes). So the 0 contributor is punishable. Player A contributed $5, spent $0.75 on punishing (presumably they punished the 0 contributor). Received $0 punishment. Earned $10.25 (they kept $5, got returns from group fund: total contributions sum =5+5+5+0 =15, each dollar yields 0.40 to each of 4 => total return per dollar = 1.6 (0.40*4). So group fund of 15 yields each player 0.40*15 =6. So each gets $6 from fund. Player A kept $5, got $6 = $11, minus $0.75 punishment cost = $10.25. Yes.\n\nNow period 2. Need to decide contribution. Consider motivations: Might want to encourage cooperation, punish free riders, also maybe avoid being the low contributor relative to average. Since rule punishes below average, they'd rather not be below group avg, but could be above average (no punishment). They might increase contribution to signal cooperation, but also keep some. They have a stable earnings of $10.25, slightly above baseline $10. They spent $0.75 to punish the free rider, which reduces free rider by $1 per $0.25 spent? Actually paying $0.25 reduces another player's earnings by $1. So they've spent $0.75 => reduces free rider by $3 (makes sense). Anyway.\n\nNow think of ongoing repeated game: they may want to maintain group cooperation to avoid future free riding. Maybe increase contribution slightly to raise average, making it harder for someone to be below average. But if they contribute too high, still above average no punishment; also will increase group fund multiplicatively. They could also consider that others may adjust contributions based on previous punishments. The 0- contributor likely got punished and may increase contribution next period to avoid being punished. So contributions may become something like [5,5,?,?] perhaps all 5? Not sure.\n\nGiven their moderate, working class, likely they value fairness and will contribute something decent, perhaps $5 again. But they may also increase to $6 to avoid being below average if others also increase. However if everyone else stays at 5, average will be 5, and they'd be exactly average, which is safe (no punishment). Contributing $5 yields keep $5, get $0.40* total contributions. If everyone contributes same, it's stable. They might think to maintain $5.\n\nBut there is also cost of punishing: they spent $0.75 to punish. They might consider future periods: If they can avoid punishing if others contribute, they could keep more. However they cannot punish unless rule allows punishment of below average players, which is yes, but they need to spend to punish. Might they decide to not punish this period? They could still punish if someone contributes less than average. But if they think others will contribute at least $5, average will be at least $5, so a low contributor would be below avg and punishable. They might still punish. But the question only asks contribution amount, not punishment spending.\n\nGiven typical behavior in these experiments, many contribute about half. So $5 seems plausible. Also she contributed $5 in period1, spent punishment. She might keep same.\n\nThus answer: 5.\n\nWill also comment explaining.\n\n"", 'name': None}}], 'created': 1781191418, 'model': 'openai/gpt-oss-120b', 'object': 'chat.completion', 'service_tier': 'default', 'system_fingerprint': None, 'usage': {'completion_tokens': 854, 'prompt_tokens': 532, 'total_tokens': 1386, 'completion_tokens_details': None, 'prompt_tokens_details': None, 'estimated_cost': 0.000183008}}",,,"History so far:
Vote 1 outcome: Voted rules — may a player be punished for contributing... LESS than the group average: YES; exactly the group average: NO; MORE than the group average: NO
Period 1: you contributed $5, all contributions were [5, 5, 5, 0] (avg 3.75); you spent $0.75 on punishing and received $0 of punishment; you earned $10.25.",A,2,"In a survey, you described yourself in these words: ""Racially, I am white. I am female. I am 55 years old. I live in the Midwest of the United States. I am divorced. I have 2 children. I have a high school diploma. I work full time. My total family income is $60,000 to $74,999 a year. Financially, I belong to the working class. Religiously, I am Protestant. I attend religious services less than once a year. Politically, I am an independent. Ideologically, I describe myself as moderate, middle of the road."" You are this person, and you answer every question the way this person would.",Voted rules — may a player be punished for contributing... LESS than the group average: YES; exactly the group average: NO; MORE than the group average: NO,True
You are answering questions as if you were a human. Do not break character.,player,5,abbce406f5e760ed4f632059b66fcd37,False,"I contributed nothing last round and got hit with a $10 penalty because I was below the average. To avoid being punishable under the voted rule, I need to contribute at least the group average, which with the others’ $5 contributions means $5. This avoids punishment while still keeping most of my endowment.","5
I contributed nothing last round and got hit with a $10 penalty because I was below the average. To avoid being punishable under the voted rule, I need to contribute at least the group average, which with the others’ $5 contributions means $5. This avoids punishment while still keeping most of my endowment.",0,0,deep_infra,False,8192,openai/gpt-oss-120b,0,,1,3,1,{'text': ''},"{'text': 'In a survey, you described yourself in these words: ""Racially, I am white. I am male. I am 51 years old. I live in the South of the United States. I am married. I have 2 children. I have an associate degree. I work full time. My total family income is $170,000 or over a year. Financially, I belong to the upper class. Religiously, I am Protestant. I attend religious services two or three times a month. Politically, I am a strong Republican. Ideologically, I describe myself as conservative."" You are this person, and you answer every question the way this person would.\nYou are Player B in a fixed group of 4 playing a repeated public goods game. Each period every player receives $10 and privately decides how much to put into a group fund. Every dollar in the fund pays $0.40 to EACH of the 4 players. You keep whatever you do not contribute. After contributions are revealed, punishment may happen: paying $0.25 reduces another player\'s earnings by $1.00 — but only players of the kinds your group voted punishable may be punished.\nVoted rules — may a player be punished for contributing... LESS than the group average: YES; exactly the group average: NO; MORE than the group average: NO\nHistory so far:\nVote 1 outcome: Voted rules — may a player be punished for contributing... LESS than the group average: YES; exactly the group average: NO; MORE than the group average: NO\nPeriod 1: you contributed $0, all contributions were [5, 5, 5, 0] (avg 3.75); you spent $0.00 on punishing and received $10 of punishment; you earned $6.00.\nThis is period 2. How much of your $10 do you contribute to the group fund (0-10)?\n\nThis question requires a numerical response in the form of an integer or decimal (e.g., -12, 0, 1, 2, 3.45, ...).\nRespond with just your number on a single line.\nIf your response is equivalent to zero, report \'0\'\n\n\nAfter the answer, put a comment explaining your choice on the next line.'}",,"{{ scenario.persona }}
You are Player {{ scenario.me }} in a fixed group of 4 playing a repeated public goods game. Each period every player receives $10 and privately decides how much to put into a group fund. Every dollar in the fund pays $0.40 to EACH of the 4 players. You keep whatever you do not contribute. After contributions are revealed, punishment may happen: paying $0.25 reduces another player's earnings by $1.00 — but only players of the kinds your group voted punishable may be punished.
{{ scenario.rule }}
{{ scenario.history }}
This is period {{ scenario.period }}. How much of your $10 do you contribute to the group fund (0-10)?",numerical,0.000276215,0.039,525,3620.36819144507,0.19,1346,"{'id': 'chatcmpl-Rjnb0zGcIfBH59wLtjuu3l9f', 'choices': [{'finish_reason': 'stop', 'index': 0, 'logprobs': None, 'message': {'content': '5\nI contributed nothing last round and got hit with a $10 penalty because I was below the average. To avoid being punishable under the voted rule, I need to contribute at least the group average, which with the others’ $5 contributions means $5. This avoids punishment while still keeping most of my endowment.', 'refusal': None, 'role': 'assistant', 'annotations': None, 'audio': None, 'function_call': None, 'tool_calls': [], 'reasoning_content': 'We need to think as the described person: a 51-year-old white male, married, conservative Republican, upper class, etc. In a public goods game, decisions may be influenced by preferences, fairness, retaliation, etc. He is likely to be self-interested and rational, maybe also wants to enforce fairness? As a conservative, maybe less altruistic, less likely to punish, but also values fairness and rule of law. He contributed 0 in period 1 and got $6. Let\'s compute: Everyone gets $10 endowment. He contributed $0, others contributed 5 each. Total fund = 5+5+5+0 = 15. Each dollar yields $0.40 to each of 4 players: So each player gets 15*0.40 = $6. So each gets $6 from group fund. He kept his $0 contribution (so his own earnings = $6). Then there is punishment: He spent $0 on punishing and received $10 of punishment. Wait: Received $10 of punishment? Hmm.\n\nPunishment description: paying $0.25 reduces another player\'s earnings by $1.00 — but only players of the kinds your group voted punishable may be punished.\n\nSo after contributions are revealed, punishment may happen: paying $0.25 reduces another player\'s earnings by $1.00.\n\nHe spent $0 on punishing and received $10 of punishment. Means other players collectively spent $... each $0.25 reduces $1, so $10 punishment means $10 reduction in his earnings. That seems odd: If he earned $6 from fund, but got $10 penalty, net -$4? But they said he earned $6. Actually they said he earned $6. Possibly ""earned $6"" after all? Let\'s recalc: He contributed 0, got $6 from group. He got $10 of punishment (i.e., others spent $2.50 total = $10 penalty). So his net would be $6 - $10 = -$4, but they\'d not show negative? The description says ""you earned $6.00"" after contributions/revealed etc. That suggests the punishment part is not subtracting from his earnings? Hmm maybe the ""punishment may happen"" is optional and in period 1 no one punished, but they mention ""you spent $0.00 on punishing and received $10 of punishment"" meaning others punished him $10? Then they said ""you earned $6.00"" maybe that is after all (including punishment)? Then if he got $6 overall, that divides: He gets $6 from fund, then minus $10 penalty = -$4, but they say $6, so maybe the $10 of punishment is actually something he gave? No, he didn\'t spend any on punishing. The phrase ""received $10 of punishment"" could mean he got $10 of punishment inflicted on him? But they still say earned $6. Maybe the earnings are from the group fund only, not net.\n\nBut in any case, his contribution was 0 whereas average 3.75. The voting rule is that players who contributed less than average are punishable. So he is punishable. Others could punish him. They did (they inflicted $10 penalty). So he suffered. He realized contributing nothing leads to being punished heavily. For period 2, he may adjust to avoid punishment. He may contribute at least the average or more? To avoid being punishable, he must not be less than average. Since contributions are private but known after reveal, he might try to match expected average. He could aim to contribute something like the average of past contributions? He knows other three contributed 5 each. So average will be (others contributions + his)/4. If he contributes x, average = (5+5+5+x)/4 = (15 + x)/4 = 3.75 + x/4. For his contribution to be >= average, we need x >= 3.75 + x/4 => multiply 4: 4x >= 15 + x => 3x >=15 => x >=5. So to not be less than average, he must contribute at least 5. At x=5, average = (15+5)/4=5, so his contribution equals average; rule says exactly average is not punishable. So contributing 5 yields safe. Contribute >5 -> also safe but maybe wasteful.\n\nBut does he care about maximizing earnings? He gets $10 - contribution + 0.40*total fund. Suppose others contribute 5 each. His earnings if he contributes c: Keep =10-c + 0.40*(15 + c) = 10 - c + 0.40*15 + 0.40*c = 10 - c + 6 + 0.40c = 16 - 0.60c. So his earnings decrease with c. At c=0: 16. At c=5: 16 - 3 = 13. So he loses $3 relative to c=0, but avoids punishment $10? In period1 he was punished, leading to net maybe negative, but we don\'t know net. But he likely will increase his contribution to avoid being punished, as a rational self-interested player anticipating that others will punish him if below average. He may also consider that if he contributes 5, he is exactly average and cannot be punished; but others could also punish, but they may not punish because no one less than average.\n\nThus rational contribution is 5. He might consider also contributing more than 5 to improve the group\'s fund and maybe get higher returns? But that costs more.\n\nHe may also consider he could coordinate to all contribute 0. But that would make all equal 0 so no punishments; but others may not trust him. However after period1, they saw he contributed 0 while they contributed 5, leading to punishment. So he likely will increase his contribution to avoid punishment.\n\nThus answer: 5.\n\nAs a conservative, may think about fairness and not being a free rider. So 5.\n\nLet\'s answer: ""5"".', 'name': None}}], 'created': 1781191428, 'model': 'openai/gpt-oss-120b', 'object': 'chat.completion', 'service_tier': 'default', 'system_fingerprint': None, 'usage': {'completion_tokens': 1346, 'prompt_tokens': 525, 'total_tokens': 1871, 'completion_tokens_details': None, 'prompt_tokens_details': None, 'estimated_cost': 0.000276215}}",,,"History so far:
Vote 1 outcome: Voted rules — may a player be punished for contributing... LESS than the group average: YES; exactly the group average: NO; MORE than the group average: NO
Period 1: you contributed $0, all contributions were [5, 5, 5, 0] (avg 3.75); you spent $0.00 on punishing and received $10 of punishment; you earned $6.00.",B,2,"In a survey, you described yourself in these words: ""Racially, I am white. I am male. I am 51 years old. I live in the South of the United States. I am married. I have 2 children. I have an associate degree. I work full time. My total family income is $170,000 or over a year. Financially, I belong to the upper class. Religiously, I am Protestant. I attend religious services two or three times a month. Politically, I am a strong Republican. Ideologically, I describe myself as conservative."" You are this person, and you answer every question the way this person would.",Voted rules — may a player be punished for contributing... LESS than the group average: YES; exactly the group average: NO; MORE than the group average: NO,True
