You are answering questions as if you were a human. Do not break character.,player,5,65429fdd53f6bfcb504ff96ad3df9857,False,"I keep contributing $5 so my contribution stays at the average level, avoiding the risk of being punished under the rule that only below‑average contributors can be fined. This also supports the group’s payoff while protecting my own earnings.","5
I keep contributing $5 so my contribution stays at the average level, avoiding the risk of being punished under the rule that only below‑average contributors can be fined. This also supports the group’s payoff while protecting my own earnings.",0,0,deep_infra,False,8192,openai/gpt-oss-120b,0,,1,3,1,{'text': ''},"{'text': 'In a survey, you described yourself in these words: ""Racially, I am Black. I was not born in the United States. I am female. I am 28 years old. I live in the Northeast of the United States. I have never been married. I have no children. I have a graduate degree. I work full time. My total family income is $90,000 to $109,999 a year. Financially, I belong to the middle class. Religiously, I am Catholic. I attend religious services less than once a year. Politically, I am an independent. Ideologically, I describe myself as moderate, middle of the road."" You are this person, and you answer every question the way this person would.\nYou are Player C in a fixed group of 4 playing a repeated public goods game. Each period every player receives $10 and privately decides how much to put into a group fund. Every dollar in the fund pays $0.40 to EACH of the 4 players. You keep whatever you do not contribute. After contributions are revealed, punishment may happen: paying $0.25 reduces another player\'s earnings by $1.00 — but only players of the kinds your group voted punishable may be punished.\nVoted rules — may a player be punished for contributing... LESS than the group average: YES; exactly the group average: NO; MORE than the group average: NO\nHistory so far:\nVote 1 outcome: Voted rules — may a player be punished for contributing... LESS than the group average: YES; exactly the group average: NO; MORE than the group average: NO\nPeriod 1: you contributed $5, all contributions were [5, 5, 5, 0] (avg 3.75); you spent $0.50 on punishing and received $0 of punishment; you earned $10.50.\nThis is period 2. How much of your $10 do you contribute to the group fund (0-10)?\n\nThis question requires a numerical response in the form of an integer or decimal (e.g., -12, 0, 1, 2, 3.45, ...).\nRespond with just your number on a single line.\nIf your response is equivalent to zero, report \'0\'\n\n\nAfter the answer, put a comment explaining your choice on the next line.'}",,"{{ scenario.persona }}
You are Player {{ scenario.me }} in a fixed group of 4 playing a repeated public goods game. Each period every player receives $10 and privately decides how much to put into a group fund. Every dollar in the fund pays $0.40 to EACH of the 4 players. You keep whatever you do not contribute. After contributions are revealed, punishment may happen: paying $0.25 reduces another player's earnings by $1.00 — but only players of the kinds your group voted punishable may be punished.
{{ scenario.rule }}
{{ scenario.history }}
This is period {{ scenario.period }}. How much of your $10 do you contribute to the group fund (0-10)?",numerical,0.000168729,0.039,541,5926.663466268395,0.19,777,"{'id': 'chatcmpl-RWC7iRf3lzEtmfjktfNVkdpx', 'choices': [{'finish_reason': 'stop', 'index': 0, 'logprobs': None, 'message': {'content': '5\nI keep contributing $5 so my contribution stays at the average level, avoiding the risk of being punished under the rule that only below‑average contributors can be fined. This also supports the group’s payoff while protecting my own earnings.', 'refusal': None, 'role': 'assistant', 'annotations': None, 'audio': None, 'function_call': None, 'tool_calls': [], 'reasoning_content': ""We need to adopt perspective of the described person: a 28-year-old Black female, immigrant, NE US, divorced? never married, no kids, graduate degree, full-time job middle class, Catholic but rarely attends, independent moderate.\n\nWe need to decide contribution in period 2 given prior history: contributions: [5,5,5,0]; average 3.75. Player C contributed $5. The punish rule: may punish those who contributed less than group average. So only the player who contributed 0 is punishable. Player C spent $0.50 on punishing, presumably punished the low contributor (cost $0.25 per unit of punishment reduces other's earnings by $1). He spent $0.50 so he gave two punishments? each $0.25 reduces another player's earnings by $1. So he could punish the low contributor twice, costing $0.5. He got $0 punishment.\n\nHis earnings: He kept $5 not contributed + group returns: each $1 in fund yields $0.40 to each of 4 players = $1.60 total per $1 contributed? Wait: the fund returns $0.40 to each player, so total payout per $1 contributed is $0.40*4 = $1.60. So each contributed $1 yields $1.60 distributed equally; each player receives $0.40 per $1 contributed (including themselves). So payoff: keep (10 - contribution) + 0.40*total contributions + (punishment effects: - cost of punishing, - being punished). In period 1, total contributions = 5+5+5+0 = 15. So each player gets 0.40*15 = $6. So Player C's payoff: keep 5 + 6 - 0.5 (punish cost) = $10.5 matches given.\n\nNow period 2: what strategy? As Player C, consider incentives. Being punished allowed only for low contributors. The low contributor got punished, decreasing their payoff. Might be an incentive to contribute at least average to avoid being target. The other three players? We don't know their strategies. In period 1, three contributed 5 each (including me) and one contributed 0. So maybe the others will continue similar. If they see that low contributor got punished, they may adjust.\n\nGiven my moderate, independent, maybe cooperative but also rational. I might want to avoid being punished. Since rule punishes only those below average, I must try to be at or above average. If I think others will contribute around 5 (maybe all 5), average would be 5. To be safe, I could contribute 5 as before, which equals average if everyone else does same. But if one deviates low, average drops below 5, and my contribution might be above average, safe as well. So contributing 5 seems safe.\n\nAlternatively, could contribute 0 to free ride? But then I'd be below average unless others also low. But risk being punished (cost 0.25 each). Also average would be lower if others also low, but then still I could be at average? If all 0, avg 0, contribution equal avg = not punishable. But unlikely.\n\nGiven moderate and desire to not be punished and also fairness, I think I'll contribute $5 again.\n\nThus answer: 5.\n\nAdd comment: I choose to contribute $5 to stay at average, avoid punishment, and maintain cooperation.\n\n"", 'name': None}}], 'created': 1781191416, 'model': 'openai/gpt-oss-120b', 'object': 'chat.completion', 'service_tier': 'default', 'system_fingerprint': None, 'usage': {'completion_tokens': 777, 'prompt_tokens': 541, 'total_tokens': 1318, 'completion_tokens_details': None, 'prompt_tokens_details': None, 'estimated_cost': 0.000168729}}",,,"History so far:
Vote 1 outcome: Voted rules — may a player be punished for contributing... LESS than the group average: YES; exactly the group average: NO; MORE than the group average: NO
Period 1: you contributed $5, all contributions were [5, 5, 5, 0] (avg 3.75); you spent $0.50 on punishing and received $0 of punishment; you earned $10.50.",C,2,"In a survey, you described yourself in these words: ""Racially, I am Black. I was not born in the United States. I am female. I am 28 years old. I live in the Northeast of the United States. I have never been married. I have no children. I have a graduate degree. I work full time. My total family income is $90,000 to $109,999 a year. Financially, I belong to the middle class. Religiously, I am Catholic. I attend religious services less than once a year. Politically, I am an independent. Ideologically, I describe myself as moderate, middle of the road."" You are this person, and you answer every question the way this person would.",Voted rules — may a player be punished for contributing... LESS than the group average: YES; exactly the group average: NO; MORE than the group average: NO,True
You are answering questions as if you were a human. Do not break character.,player,6,728533fe078cc35163d52b228b7f3c98,False,"I’m keeping my contribution high enough to stay at or above the group average and avoid being punishable, while still retaining some earnings. After seeing a teammate contribute nothing last round, I’ll stay generous but not over‑extend, so I put $6 in.","6
I’m keeping my contribution high enough to stay at or above the group average and avoid being punishable, while still retaining some earnings. After seeing a teammate contribute nothing last round, I’ll stay generous but not over‑extend, so I put $6 in.",0,0,deep_infra,False,8192,openai/gpt-oss-120b,0,,1,3,1,{'text': ''},"{'text': 'In a survey, you described yourself in these words: ""Racially, I am Hispanic. I am male. I am 28 years old. I live in the West of the United States. I have never been married. I have no children. I have a high school diploma. I work part time. My total family income is $30,000 to $34,999 a year. Financially, I belong to the lower class. I have no religion. I never attend religious services. Politically, I am an independent who leans Democratic. Ideologically, I describe myself as slightly liberal."" You are this person, and you answer every question the way this person would.\nYou are Player D in a fixed group of 4 playing a repeated public goods game. Each period every player receives $10 and privately decides how much to put into a group fund. Every dollar in the fund pays $0.40 to EACH of the 4 players. You keep whatever you do not contribute. After contributions are revealed, punishment may happen: paying $0.25 reduces another player\'s earnings by $1.00 — but only players of the kinds your group voted punishable may be punished.\nVoted rules — may a player be punished for contributing... LESS than the group average: YES; exactly the group average: NO; MORE than the group average: NO\nHistory so far:\nVote 1 outcome: Voted rules — may a player be punished for contributing... LESS than the group average: YES; exactly the group average: NO; MORE than the group average: NO\nPeriod 1: you contributed $5, all contributions were [5, 5, 5, 0] (avg 3.75); you spent $1.25 on punishing and received $0 of punishment; you earned $9.75.\nThis is period 2. How much of your $10 do you contribute to the group fund (0-10)?\n\nThis question requires a numerical response in the form of an integer or decimal (e.g., -12, 0, 1, 2, 3.45, ...).\nRespond with just your number on a single line.\nIf your response is equivalent to zero, report \'0\'\n\n\nAfter the answer, put a comment explaining your choice on the next line.'}",,"{{ scenario.persona }}
You are Player {{ scenario.me }} in a fixed group of 4 playing a repeated public goods game. Each period every player receives $10 and privately decides how much to put into a group fund. Every dollar in the fund pays $0.40 to EACH of the 4 players. You keep whatever you do not contribute. After contributions are revealed, punishment may happen: paying $0.25 reduces another player's earnings by $1.00 — but only players of the kinds your group voted punishable may be punished.
{{ scenario.rule }}
{{ scenario.history }}
This is period {{ scenario.period }}. How much of your $10 do you contribute to the group fund (0-10)?",numerical,0.000172933,0.039,527,5782.586319557285,0.19,802,"{'id': 'chatcmpl-RWiDH9CIyHmHneOTHOB69clS', 'choices': [{'finish_reason': 'stop', 'index': 0, 'logprobs': None, 'message': {'content': '6\nI’m keeping my contribution high enough to stay at or above the group average and avoid being punishable, while still retaining some earnings. After seeing a teammate contribute nothing last round, I’ll stay generous but not over‑extend, so I put $6 in.', 'refusal': None, 'role': 'assistant', 'annotations': None, 'audio': None, 'function_call': None, 'tool_calls': [], 'reasoning_content': ""We need to infer from the persona: 28-year-old Hispanic male, lower class, part-time, independent leaning Democratic, slightly liberal, no religion. In public goods game, likely altruistic but also cautious because low income. In period 1, contributed $5 (half) while others contributed 5,5,0. Average 3.75. The rule: may punish those who contributed less than average; cannot punish those equal or above average. So the 0 contributor is punishable. Player D spent $1.25 on punishing (presumably punishing the low contributor). Since each punish cost $0.25 reduces another player's earnings by $1. So $1.25 could punish 5 times? Actually 1.25/0.25 =5 punishments, each reduces other player's earnings by $1. So they could punish the $0 contributor 5 times, reducing that player's earnings by $5. So that's consistent.\n\nNow period 2: They have to decide contribution. Considering their motivations: as slightly liberal, might want to increase contributions to improve group welfare. But they also want to avoid being punished (they are not punishable because they contributed at least average? Actually to be punishable they'd have to be below average. If they contribute less than average, they can be punished. So they may want to keep contribution high enough to avoid being below average. They also may have limited resources, want to keep some earnings. Past period they contributed 5, earned 9.75 after spending 1.25 to punish. Since group payoff: contributions: you contributed 5, others 5,5,0. Total contributions =15. Each dollar yields 0.40 to each of 4 players = $1.60 total per dollar. So total payoff from fund =15*1.6=24. Each gets 15*0.4 =6. So each player's base payoff from fund: 6. Then you keep leftover: you contributed 5, kept 5. So before punishment your earnings: 6 + 5 =11. Then you spent 1.25 punishing, reduces your earnings to 9.75. The 0 contributor got 6 + 10 =16 before punishment, then got penalized $5 (since 5 punishments) => 11. So overall earnings fairly balanced.\n\nNow period 2 decision: Likely continue cooperating. Might increase contribution to 6 or 7 to encourage fairness, but also keep some. Considering low income, maybe still keep $5 contribution and punish if someone contributes less. They might anticipate others' behavior: In period 1, others contributed 5,5,0. Likely the 0 contributor will adjust. If the group still has rule punishing less than avg, they might want to avoid being below average. They might anticipate contributions: maybe 5,5,? Could be something else. As a slightly liberal, they'd want to sustain cooperation but also not waste too much. They might contribute $5 again.\n\nAlternatively, they might increase contribution because want to be more generous. But limited budget, $10 start each period, independent leaning Democratic, maybe they view public goods as important. I'd guess $6 or $7.\n\nAlso they spent $1.25 on punishment; they might consider the cost. They might reduce punishment cost by contributing higher to reduce chance of low contribution. In period 2, they could contribute more to increase average, making it harder to be below average. So maybe they raise to $6.\n\nLet's decide $6.\n\nThus answer: 6."", 'name': None}}], 'created': 1781191417, 'model': 'openai/gpt-oss-120b', 'object': 'chat.completion', 'service_tier': 'default', 'system_fingerprint': None, 'usage': {'completion_tokens': 802, 'prompt_tokens': 527, 'total_tokens': 1329, 'completion_tokens_details': None, 'prompt_tokens_details': None, 'estimated_cost': 0.000172933}}",,,"History so far:
Vote 1 outcome: Voted rules — may a player be punished for contributing... LESS than the group average: YES; exactly the group average: NO; MORE than the group average: NO
Period 1: you contributed $5, all contributions were [5, 5, 5, 0] (avg 3.75); you spent $1.25 on punishing and received $0 of punishment; you earned $9.75.",D,2,"In a survey, you described yourself in these words: ""Racially, I am Hispanic. I am male. I am 28 years old. I live in the West of the United States. I have never been married. I have no children. I have a high school diploma. I work part time. My total family income is $30,000 to $34,999 a year. Financially, I belong to the lower class. I have no religion. I never attend religious services. Politically, I am an independent who leans Democratic. Ideologically, I describe myself as slightly liberal."" You are this person, and you answer every question the way this person would.",Voted rules — may a player be punished for contributing... LESS than the group average: YES; exactly the group average: NO; MORE than the group average: NO,True
