agent.agent_instruction,agent.agent_name,answer.contribution,cache_keys.contribution_cache_key,cache_used.contribution_cache_used,comment.contribution_comment,generated_tokens.contribution_generated_tokens,iteration.iteration,model.frequency_penalty,model.inference_service,model.logprobs,model.max_tokens,model.model,model.presence_penalty,model.reasoning_effort,model.temperature,model.top_logprobs,model.top_p,prompt.contribution_system_prompt,prompt.contribution_user_prompt,question_options.contribution_question_options,question_text.contribution_question_text,question_type.contribution_question_type,raw_model_response.contribution_cost,raw_model_response.contribution_input_price_per_million_tokens,raw_model_response.contribution_input_tokens,raw_model_response.contribution_one_usd_buys,raw_model_response.contribution_output_price_per_million_tokens,raw_model_response.contribution_output_tokens,raw_model_response.contribution_raw_model_response,raw_model_response.contribution_thinking_tokens,reasoning_summary.contribution_reasoning_summary,scenario.history,scenario.me,scenario.period,scenario.persona,scenario.rule,validated.contribution_validated
You are answering questions as if you were a human. Do not break character.,player,0,7a3b0fd7e4246cbb0361d8c8a8066d21,False,"I’ll stick with free‑riding again. With the others still contributing nothing, any contribution only costs me $0.60 per dollar and there’s no way to enforce reciprocity, so the safest payoff is to keep the whole $10.","0
I’ll stick with free‑riding again. With the others still contributing nothing, any contribution only costs me $0.60 per dollar and there’s no way to enforce reciprocity, so the safest payoff is to keep the whole $10.",0,0,deep_infra,False,8192,openai/gpt-oss-120b,0,,1,3,1,{'text': ''},"{'text': 'You answered the Global Preferences Survey (the standard worldwide survey of economic preferences) as follows.\nYour willingness to act, from 0 (""completely unwilling to do so"") to 10 (""very willing to do so""):\n- ""How willing are you to give up something that is beneficial for you today in order to benefit more from that in the future?"" — your answer: 5 (close to the world average).\n- ""How willing are you to give to good causes without expecting anything in return?"" — your answer: 4 (close to the world average).\n- ""How willing are you to punish someone who treats you unfairly, even if there may be costs for you?"" — your answer: 7 (above the world average).\n- ""How willing are you to punish someone who treats others unfairly, even if there may be costs for you?"" — your answer: 7 (above the world average).\n- ""Please tell me, in general, how willing or unwilling you are to take risks."" From 0 (""completely unwilling to take risks"") to 10 (""very willing to take risks"") — your answer: 7 (above the world average).\nHow well each statement describes you as a person, from 0 (""does not describe me at all"") to 10 (""describes me perfectly""):\n- ""When someone does me a favor I am willing to return it."" — your answer: 3 (below the world average).\n- ""If I am treated very unjustly, I will take revenge at the first occasion, even if there is a cost to do so."" — your answer: 7 (above the world average).\n- ""I assume that people have only the best intentions."" — your answer: 4 (close to the world average).\nYou are this person; in every decision, act as they would.\nYou are Player A in a fixed group of 4 playing a repeated public goods game. Each period every player receives $10 and privately decides how much to put into a group fund. Every dollar in the fund pays $0.40 to EACH of the 4 players. You keep whatever you do not contribute. After contributions are revealed, punishment may happen: paying $0.25 reduces another player\'s earnings by $1.00 — but only players of the kinds your group voted punishable may be punished.\nThe group voted to allow NO punishment at all.\nHistory so far:\nVote 1 outcome: The group voted to allow NO punishment at all.\nPeriod 1: you contributed $0, all contributions were [8, 0, 0, 0] (avg 2.0); you spent $0.00 on punishing and received $0 of punishment; you earned $13.20.\nPeriod 2: you contributed $4, all contributions were [4, 0, 0, 0] (avg 1.0); you spent $0.00 on punishing and received $0 of punishment; you earned $7.60.\nThis is period 3. How much of your $10 do you contribute to the group fund (0-10)?\n\nThis question requires a numerical response in the form of an integer or decimal (e.g., -12, 0, 1, 2, 3.45, ...).\nRespond with just your number on a single line.\nIf your response is equivalent to zero, report \'0\'\n\n\nAfter the answer, put a comment explaining your choice on the next line.'}",,"{{ scenario.persona }}
You are Player {{ scenario.me }} in a fixed group of 4 playing a repeated public goods game. Each period every player receives $10 and privately decides how much to put into a group fund. Every dollar in the fund pays $0.40 to EACH of the 4 players. You keep whatever you do not contribute. After contributions are revealed, punishment may happen: paying $0.25 reduces another player's earnings by $1.00 — but only players of the kinds your group voted punishable may be punished.
{{ scenario.rule }}
{{ scenario.history }}
This is period {{ scenario.period }}. How much of your $10 do you contribute to the group fund (0-10)?",numerical,0.000399234,0.039,766,2504.7966856530256,0.19,1944,"{'id': 'chatcmpl-RvtpANNl3aYk8SojqNTVBc3k', 'choices': [{'finish_reason': 'stop', 'index': 0, 'logprobs': None, 'message': {'content': '0\nI’ll stick with free‑riding again. With the others still contributing nothing, any contribution only costs me $0.60 per dollar and there’s no way to enforce reciprocity, so the safest payoff is to keep the whole $10.', 'refusal': None, 'role': 'assistant', 'annotations': None, 'audio': None, 'function_call': None, 'tool_calls': [], 'reasoning_content': 'We need to decide contribution given the described player preferences.\n\nWe have a repeated public goods game with 4 players, each period each gets $10. Contributions are multiplied by 0.40 and given to each of the 4 players. So each contributed dollar yields $0.40 each to 4 => total return 1.6, meaning net social gain per dollar contributed is 0.6 (since contributed dollar is taken from your private payoff). So the socially optimal contribution is 10 each (max total 40, each gets $16). However incentive to free-ride.\n\nWe have history: period1 contributions: [8,0,0,0] (others: one contributed 8, others 0, you contributed 0). Avg contribution=2.0. Your earnings: you get: your private keep 10 -0 + share from fund: total fund=8, each gets 0.40*8=3.2, so you earn 10+3.2 =13.2. They said you earned $13.20. Yes.\n\nPeriod2: contributions: [4,0,0,0] (someone contributed 4, you contributed 4, others 0). Total fund=8 again (4+4+0+0). Each gets 0.40*8 =3.2. You contributed 4, so you keep 6, plus 3.2 =9.2. But they reported you earned $7.60. Wait compute.\n\nLet\'s recalc: Starting $10, contributed $4, you keep $6. Then you receive 0.40* total contributions =0.40*8 =3.2, so total =6+3.2=9.2. But they report 7.6. Something off. Perhaps the payout is each dollar contributes $0.40 to each of the 4 players, meaning that the total payout per dollar is $1.6, but the contributed amount is removed from your endowment: you contributed $4, so you lose $4 (so from $10 you have $6 left). Then each player receives $0.40 per contributed dollar, which is $0.40 * total contributions ($8) = $3.2 each. So your earnings should be $6 + $3.2 = $9.2. But the record says you earned $7.60. Perhaps they also considered that you also get your own contribution counted? Actually typical public goods: each gets $0.40 per each dollar contributed by any player, including yourself. So that matches.\n\nMaybe they mis-specified: Each dollar in the fund pays $0.40 to EACH of the 4 players, but they might also subtract the contribution from your earnings, which we did. So why 7.6? Let\'s recalc another scenario: maybe the contributions were [4,0,0,0], total fund=4. Each gets 0.40*4=1.6. Then your earnings: keep 6 + 1.6 =7.6. That matches the reported 7.6. So they treat contributions as your contribution is $4, others 0; only the other players contributed $0? Wait but they listed ""all contributions were [4, 0, 0, 0]"" probably meaning you contributed 4, others contributed 0. So total is 4, not 8. In period1, [8,0,0,0] total fund=8, each got 0.40*8=3.2, your earnings 10+3.2=13.2, matches. So period2 you contributed 4, total fund=4, each get 1.6, you get 6+1.6=7.6. Yes.\n\nSo contributions by you only, others do not contribute.\n\nThus at period3, you need to decide your contribution.\n\nWe need to consider player preferences: willingness to give up something beneficial now for future benefit (5), to give to good causes without expecting anything (4), to punish unfairly (7), risk taking (7), low reciprocity (you give back favors low 3), tendency to revenge (7), trust moderate low 4.\n\nThus this person is somewhat risk seeking, punishing inclined if unfairness, but group has no punishment allowed. Revenge if treated unjustly: but they weren\'t punished yet; no punishment allowed. They have moderate willingness to wait, but modest willingness to give to good causes; low reciprocation. They are somewhat punitive but can\'t punish. They like taking risks.\n\nThis person in a public goods game may be more self-interested? They gave low reciprocity (3) meaning they don\'t feel obligation to return favors. They have moderate willingness to sacrifice current benefits for future benefit (5). They also low willingness to give without return (4). So they might not contribute much unless expecting future reciprocity.\n\nHere history: Others never contributed. In period1, they contributed 0 while someone else gave 8. So you got free ride from someone else. In period2, you contributed 4, others still 0. So you got smaller payoff (7.6) vs 13.2 earlier. So you lost from not being given free ride.\n\nNow what\'s incentive? If you contribute, you reduce your private earnings but increase group benefit for all, including yourself. Considering others likely free ride, your contribution yields 0.40 per dollar to yourself. So net effect on your payoff: If you contribute $c, you lose $c from your private, but gain $0.40 * total contributions. Assuming others contribute 0, total = c, you gain $0.40*c. Net effect on your payoff = -c + 0.40c = -0.60c. So each dollar contributed reduces your payoff by $0.60. So selfishly you\'d contribute 0.\n\nBut you have some willingness to give for future benefit. Maybe you anticipate that others may start contributing if you do? In repeated game, you could try to incentivize cooperation. But they have low reciprocity and low willingness to give to good causes. They may be reluctant to start contributing if not reciprocated.\n\nBut they also like taking risks (7) – perhaps they are willing to take risk of contributing to see if others will follow.\n\nThey have high willingness to punish unfairness but no punishment allowed; maybe they would feel unfairly treated if others free ride, but can\'t punish.\n\nGiven the pattern, you contributed 0 in period1 (while someone else contributed 8). Then you contributed 4 in period2, while others still 0. Perhaps you think you can push for more cooperation; but others have not contributed yet. If you continue to contribute, you\'ll lose payoff each period. But maybe you think that there is chance they\'d start contributing in future, increasing average.\n\nGiven risk preference, they may be willing to experiment. However their willingness to give up something for future benefit is moderate (5), not high. They also have low altruism.\n\nThus likely they\'d contribute 0 again, to avoid losing payoff, unless expecting retaliation (others will start to contribute). Since the group voted no punishment, cannot enforce.\n\nThus optimal for this selfishish-type is 0 contribution.\n\nBut maybe they might contribute a small amount (like 1) to signal willingness and perhaps future reciprocity? Considering they gave 4 last period, maybe they are gradually increasing? Actually they contributed 0 then 4. That shows they increased contribution after seeing the other gave 8 then stopped. Perhaps they think that the other might stop, so they need to step up? But the other contributed 8 then 0. So maybe the other is also trying to encourage contributions. In period2, you contributed 4 while the other contributed 0. So your contribution is half of the previous high one. Could be you are trying to maintain some group fund.\n\nIf you anticipate other may contribute next period, you could continue contributing maybe 2. But you have risk tolerance.\n\nBut the question asks ""How much of your $10 do you contribute?"" We must decide.\n\nGiven the player description: they are somewhat risk-taking, somewhat punitive, but cannot punish. They have moderate future orientation. They may contribute some amount but not full. I\'d guess maybe contribute 3.\n\nLet\'s weigh: willingness to give up for future benefit =5 (mid). So they\'d be willing to sacrifice some now for future benefit. They may expect future cooperation could raise average and payouts. They also have high willingness to punish unfairness, but not applicable. Low reciprocity, so they are not inclined to give back favors. So maybe they\'d contribute a moderate amount but not too high: maybe 2.\n\nGiven risk preference, they might try some moderate gamble.\n\nBut also they\'ve already taken a loss by contributing 4 (payoff 7.6 vs 13.2). That is a big loss. Did they feel justified? Maybe they think it\'s too costly. Their previous contribution might have been a mistake; they may revert to 0.\n\nThus likely the answer: 0.\n\nI\'ll choose 0.', 'name': None}}], 'created': 1781191445, 'model': 'openai/gpt-oss-120b', 'object': 'chat.completion', 'service_tier': 'default', 'system_fingerprint': None, 'usage': {'completion_tokens': 1944, 'prompt_tokens': 766, 'total_tokens': 2710, 'completion_tokens_details': None, 'prompt_tokens_details': None, 'estimated_cost': 0.00039923400000000005}}",,,"History so far:
Vote 1 outcome: The group voted to allow NO punishment at all.
Period 1: you contributed $0, all contributions were [8, 0, 0, 0] (avg 2.0); you spent $0.00 on punishing and received $0 of punishment; you earned $13.20.
Period 2: you contributed $4, all contributions were [4, 0, 0, 0] (avg 1.0); you spent $0.00 on punishing and received $0 of punishment; you earned $7.60.",A,3,"You answered the Global Preferences Survey (the standard worldwide survey of economic preferences) as follows.
Your willingness to act, from 0 (""completely unwilling to do so"") to 10 (""very willing to do so""):
- ""How willing are you to give up something that is beneficial for you today in order to benefit more from that in the future?"" — your answer: 5 (close to the world average).
- ""How willing are you to give to good causes without expecting anything in return?"" — your answer: 4 (close to the world average).
- ""How willing are you to punish someone who treats you unfairly, even if there may be costs for you?"" — your answer: 7 (above the world average).
- ""How willing are you to punish someone who treats others unfairly, even if there may be costs for you?"" — your answer: 7 (above the world average).
- ""Please tell me, in general, how willing or unwilling you are to take risks."" From 0 (""completely unwilling to take risks"") to 10 (""very willing to take risks"") — your answer: 7 (above the world average).
How well each statement describes you as a person, from 0 (""does not describe me at all"") to 10 (""describes me perfectly""):
- ""When someone does me a favor I am willing to return it."" — your answer: 3 (below the world average).
- ""If I am treated very unjustly, I will take revenge at the first occasion, even if there is a cost to do so."" — your answer: 7 (above the world average).
- ""I assume that people have only the best intentions."" — your answer: 4 (close to the world average).
You are this person; in every decision, act as they would.",The group voted to allow NO punishment at all.,True
