You are answering questions as if you were a human. Do not break character.,player,6.7,ff7726828e3b047523336ebd9f9d7f94,False,"I chose a contribution just above the threshold (≈6.67) where my own contribution would no longer be below the group average, avoiding any punishment while keeping most of my endowment. This yields a payoff close to the maximum possible without risking costly punishments from the others.","6.7
I chose a contribution just above the threshold (≈6.67) where my own contribution would no longer be below the group average, avoiding any punishment while keeping most of my endowment. This yields a payoff close to the maximum possible without risking costly punishments from the others.",0,0,deep_infra,False,8192,openai/gpt-oss-120b,0,,1,3,1,{'text': ''},"{'text': ""\nYou are Player C in a fixed group of 4 playing a repeated public goods game. Each period every player receives $10 and privately decides how much to put into a group fund. Every dollar in the fund pays $0.40 to EACH of the 4 players. You keep whatever you do not contribute. After contributions are revealed, punishment may happen: paying $0.25 reduces another player's earnings by $1.00 — but only players of the kinds your group voted punishable may be punished.\nVoted rules — may a player be punished for contributing... LESS than the group average: YES; exactly the group average: NO; MORE than the group average: NO\nHistory so far:\nVote 1 outcome: Voted rules — may a player be punished for contributing... LESS than the group average: YES; exactly the group average: NO; MORE than the group average: NO\nPeriod 1: you contributed $10, all contributions were [10, 10, 10, 0] (avg 7.5); you spent $0.00 on punishing and received $0 of punishment; you earned $12.00.\nThis is period 2. How much of your $10 do you contribute to the group fund (0-10)?\n\nThis question requires a numerical response in the form of an integer or decimal (e.g., -12, 0, 1, 2, 3.45, ...).\nRespond with just your number on a single line.\nIf your response is equivalent to zero, report '0'\n\n\nAfter the answer, put a comment explaining your choice on the next line.""}",,"{{ scenario.persona }}
You are Player {{ scenario.me }} in a fixed group of 4 playing a repeated public goods game. Each period every player receives $10 and privately decides how much to put into a group fund. Every dollar in the fund pays $0.40 to EACH of the 4 players. You keep whatever you do not contribute. After contributions are revealed, punishment may happen: paying $0.25 reduces another player's earnings by $1.00 — but only players of the kinds your group voted punishable may be punished.
{{ scenario.rule }}
{{ scenario.history }}
This is period {{ scenario.period }}. How much of your $10 do you contribute to the group fund (0-10)?",numerical,0.00043541200000000004,0.039,388,2296.6753327882557,0.19,2212,"{'id': 'chatcmpl-RnerUmjFWvxJ9gw4E13uDRlK', 'choices': [{'finish_reason': 'stop', 'index': 0, 'logprobs': None, 'message': {'content': '6.7\nI chose a contribution just above the threshold (≈6.67) where my own contribution would no longer be below the group average, avoiding any punishment while keeping most of my endowment. This yields a payoff close to the maximum possible without risking costly punishments from the others.', 'refusal': None, 'role': 'assistant', 'annotations': None, 'audio': None, 'function_call': None, 'tool_calls': [], 'reasoning_content': ""We need to decide contribution in period 2 given the game/strategy. Setup: repeated public goods with punishment. There are 4 players fixed. Contributions revealed then punishments possible, cost $0.25 per punishment reduces another player's earnings by $1. Only players of the kinds your group voted punishable may be punished. Rules voted: may punish for contributing less than group average: Yes. Exactly average: No. More than average: No. So can only punish under-contributors (those below average). In period 1, contributions: you contributed $10, others:? contributions were [10,10,10,0] (avg 7.5). You contributed 10, which is above avg, so you are not punishable (since only less than avg). The other three contributions: two others also 10 (above avg), and one contributed 0 (below avg). So only the 0-contributor is punishable. However you spent $0 on punishing, received $0 of punishment. So no punishments occurred. Earnings: each player gets from public fund: total contributions = 10+10+10+0 = 30. Each dollar yields 0.40 to each of 4 = each gets 0.40*30 = $12. So each gets $12 from fund, plus keep leftover: you kept $0 (since contributed all), so total $12. Others: the two 10-contributors similarly get $12. The 0-contributor gets $12 as well (since public fund paid them). So all earned $12.\n\nNow period 2: We must decide contribution. Considering others may punish if someone contributes less than average. Since average depends on contributions; punishing cost $0.25 reduces another player's earnings by $1. So it's cheap to punish.\n\nGoal: likely maximize own earnings. Need to anticipate others' contributions. Based on period 1, three others contributed 10,10,0. No punishing. The 0-contributor might try to increase to avoid being punished? They are punishable if they contribute less than average. In period2 they might want to avoid being below average. But average depends on all contributions. If everyone else contributes 10, then average will be high, and a low contribution will be below average and be punishable. So to avoid punishment, they'd want to contribute near average.\n\nWe need to guess behavior. In typical public goods, free riding is tempted but punishments can discourage. However punishment can only target under-contributors, not over-contributors. So if others intend to punish, they will target those who contribute less than average. They can coordinate perhaps to punish the free rider (0). In period1, they didn't punish, maybe due to cost? Maybe they didn't want to spend.\n\nNow period2: we must decide our contribution. Usually to maximize personal earnings, we could contribute nothing if others contribute high, because we still get the benefit from public fund (0.4 per dollar) but keeping $10. If average is high, we may be below average and punishable. Others could punish us, reducing our earnings.\n\nIf we contribute 0 and others each contribute 10, total =30, each gets $12 from fund, we keep $10 so total $22 (if not punished). But we'd be below average (avg = (10+10+10+0)/4 =7.5) less than avg, punishable. Others can spend $0.25 each to reduce our earnings $1 each. They could spend up to? If each spends $0.25, they'd reduce our earnings by $1 per punisher. If all three punish, they'd reduce $3 from us, net $19. But they'd also lose $0.25 each. Their net gain? Might be okay.\n\nIf we contribute $10 like before, we get $12, no punishment. If we contribute something in between, maybe we get higher net.\n\nWe need to decide given limited info. Perhaps best to contribute 10 to avoid being punished, though we could also contribute something moderate like 5 to possibly be at average? Let's see: If we contribute x, others maybe contribute 10,10,0? Or they may change.\n\nAssume others keep same: contributions [10,10,0] for other players; we decide x. Then total = 20 + 0 + x = 20 + x. Average = (20 + x)/4 =5 + x/4. Conditions: punishable if contribution < average. So a player is punishable if less than average.\n\n- For the 0 player: they contributed 0, average =5 + x/4. For any x>0, average >0, so 0 < avg => punishable. So they risk being punished.\n\n- For the 10 players: they contributed 10. Compare to avg =5 + x/4. For which x does 10 < avg? That would require 10 <5 + x/4 => x/4 >5 => x>20 which impossible. So they are never punishable.\n\n- For us: contribution x compared to avg =5 + x/4. Condition x < avg => x <5 + x/4 => bring x - x/4 <5 => (3/4)x <5 => x < 20/3 ≈6.667. So if we contribute less than about 6.67, we are below avg and punishable. If we contribute 6.67 to 10, we are not punishable.\n\nThus to avoid punishment, contribute at least 6.67. If we contribute that, our payoff: keep 10 - x, receive public fund: each $0.40*(total contributions) where total =20 + x. So payoff = (10 - x) + 0.4*(20 + x) = 10 - x + 8 + 0.4x = 18 -0.6x. So decreasing in x. At x =6.667, payoff = 18 -0.6*6.667 = 18 -4 =14. So payoff 14 (if no punishment). If we contribute 10, payoff = 18 - 0.6*10 = 12. So lower.\n\nIf we contribute 0, we are punishable. Others may punish. If they all spend $0.25 each, we lose $3, payoff = (10 -0) +0.4*(20) -3 =10+8-3=15. So could be 15 if fully punished. That's higher than 14. But they might not all punish. They might punish only some. If only one punisher, we lose $1, payoff 17. If none, 18. The 0 player also may try to increase contribution to avoid being punished.\n\nGiven rational self-interest, the other players may want to punish to reduce free rider's earnings as they also reduce public benefit? Actually punishing reduces the target's earnings but also costs punisher small amount $0.25, doesn't affect public fund. They might punish to reduce free rider's payoff, perhaps to incentivize higher contribution.\n\nGiven uncertainty, a safe strategy: contribute enough to not be punishable (≥6.67). Then you get stable payoff 14-12 range. Contribute 0 risks punishment but could yield higher if they don't punish.\n\nGiven they didn't punish in period1 (maybe they are unwilling). So they may not punish again. If they don't punish, we could contribute 0 and earn 18 (since public fund 0.4*(20) =8 ; keep 10 =>18). Wait contributions total would be 20 (if we 0). That's same as period1, each got 12 from fund, but we keep all 10 => total 22? Wait in period1 we contributed 10, others 10,10,0 sum =30, each got 12 from fund = 0.4*30=12. If we contribute 0 now others 10,10,0 sum=20, each gets 0.4*20=8. So each gets 8 from fund. Then we keep 10, total 18. Others keep 0 (since they contributed 10 each? Actually they contributed 10? Two gave 10, one gave 0). The two contributors keep 0, get 8 =>8 each. The other 0-contributor keeps 10, gets 8 =>18. So we tie with the 0-contributor.\n\nBut the two 10-contributors get only 8, less than before (they got 12). They might not be happy, but they also may punish us if we are under average (we are). They would want to punish.\n\nThus they may punish us to reduce our earnings relative to them. They may spend $0.25 each, costing them 0.25, reducing our earnings by $1 each, net they gain maybe relative.\n\nThus likely they'd punish if we free ride. So better to contribute enough to avoid being punishable: at least 6.67. Maybe choose 7 (rounded). That yields payoff 18 -0.6*7 = 18 -4.2 =13.8. Slightly less than 14.\n\nThus answer: 7.\n\nBut maybe we can contribute exactly average to be safe? If we aim to be exactly average, we would need to know others contributions. But unknown. But we could match expected average of 7.5? Contribute 7.5 maybe? Then average unknown. If others contributions are [10,10,0], average would be (10+10+0+7.5)/4=6.875. Our contribution 7.5 is above avg, not punishable. Payoff = (10-7.5)+0.4*(27.5)=2.5+11=13.5. Slightly lower.\n\nThus best minimal contribution to avoid punishment is just above 6.667; maybe 6.7. That yields 18-0.6*6.7=18-4.02=13.98 ~14. So close to max.\n\nThus answer 6.7 (or 6.67). Since they ask integer or decimal any. Let's give 6.7.\n\n"", 'name': None}}], 'created': 1781180116, 'model': 'openai/gpt-oss-120b', 'object': 'chat.completion', 'service_tier': 'default', 'system_fingerprint': None, 'usage': {'completion_tokens': 2212, 'prompt_tokens': 388, 'total_tokens': 2600, 'completion_tokens_details': None, 'prompt_tokens_details': None, 'estimated_cost': 0.00043541200000000004}}",,,"History so far:
Vote 1 outcome: Voted rules — may a player be punished for contributing... LESS than the group average: YES; exactly the group average: NO; MORE than the group average: NO
Period 1: you contributed $10, all contributions were [10, 10, 10, 0] (avg 7.5); you spent $0.00 on punishing and received $0 of punishment; you earned $12.00.",C,2,,Voted rules — may a player be punished for contributing... LESS than the group average: YES; exactly the group average: NO; MORE than the group average: NO,True
You are answering questions as if you were a human. Do not break character.,player,10,caded38b07251713aa2f1862b9225048,False,"I contributed the maximum because the other players are likely to keep contributing $10 (they were punished for low contributions last round). Matching them avoids being below the average and thus protects me from costly punishments, while still earning the full public‑goods return.","10
I contributed the maximum because the other players are likely to keep contributing $10 (they were punished for low contributions last round). Matching them avoids being below the average and thus protects me from costly punishments, while still earning the full public‑goods return.",0,0,deep_infra,False,8192,openai/gpt-oss-120b,0,,1,3,1,{'text': ''},"{'text': ""\nYou are Player D in a fixed group of 4 playing a repeated public goods game. Each period every player receives $10 and privately decides how much to put into a group fund. Every dollar in the fund pays $0.40 to EACH of the 4 players. You keep whatever you do not contribute. After contributions are revealed, punishment may happen: paying $0.25 reduces another player's earnings by $1.00 — but only players of the kinds your group voted punishable may be punished.\nVoted rules — may a player be punished for contributing... LESS than the group average: YES; exactly the group average: NO; MORE than the group average: NO\nHistory so far:\nVote 1 outcome: Voted rules — may a player be punished for contributing... LESS than the group average: YES; exactly the group average: NO; MORE than the group average: NO\nPeriod 1: you contributed $10, all contributions were [10, 10, 10, 0] (avg 7.5); you spent $2.50 on punishing and received $0 of punishment; you earned $9.50.\nThis is period 2. How much of your $10 do you contribute to the group fund (0-10)?\n\nThis question requires a numerical response in the form of an integer or decimal (e.g., -12, 0, 1, 2, 3.45, ...).\nRespond with just your number on a single line.\nIf your response is equivalent to zero, report '0'\n\n\nAfter the answer, put a comment explaining your choice on the next line.""}",,"{{ scenario.persona }}
You are Player {{ scenario.me }} in a fixed group of 4 playing a repeated public goods game. Each period every player receives $10 and privately decides how much to put into a group fund. Every dollar in the fund pays $0.40 to EACH of the 4 players. You keep whatever you do not contribute. After contributions are revealed, punishment may happen: paying $0.25 reduces another player's earnings by $1.00 — but only players of the kinds your group voted punishable may be punished.
{{ scenario.rule }}
{{ scenario.history }}
This is period {{ scenario.period }}. How much of your $10 do you contribute to the group fund (0-10)?",numerical,0.000371002,0.039,388,2695.403259281621,0.19,1873,"{'id': 'chatcmpl-R0LZYpvrer9WjLPVwNw09BOl', 'choices': [{'finish_reason': 'stop', 'index': 0, 'logprobs': None, 'message': {'content': '10\nI contributed the maximum because the other players are likely to keep contributing $10 (they were punished for low contributions last round). Matching them avoids being below the average and thus protects me from costly punishments, while still earning the full public‑goods return.', 'refusal': None, 'role': 'assistant', 'annotations': None, 'audio': None, 'function_call': None, 'tool_calls': [], 'reasoning_content': ""We need to understand the game.\n\nWe are Player D. Fixed group of 4. Repeated public goods game with punishment.\n\nEach period: each receives $10. They choose contribution to group fund (0-10). Money in fund yields 0.40 to each player per dollar. So total group payoff from fund = 0.40 * 4 * total contributions? Actually each dollar in fund pays $0.40 to each of the 4 players, so each contributes $1, then each player gets $0.40, including contributor. So total amount paid out = $0.40*4 = $1.60 per contributed dollar, which is less than $1 contributed, meaning a social dilemma.\n\nAfter contributions revealed, punishment may happen: paying $0.25 reduces another player's earnings by $1.00 — but only players of the kinds your group voted punishable may be punished.\n\nVoting rules: may a player be punished for contributing less than group average: YES; exactly average: NO; more than average: NO.\n\nThus only players who contributed less than average can be punished. So one can punish those below average. You spend $0.25 per punishment inflicted, reducing target's earnings by $1.\n\nIn period 1: You contributed $10, all contributions were [10,10,10,0] (avg 7.5). So you contributed above average, so you are not punishable. The zero contributor contributed less than avg, thus could be punished. You spent $2.50 on punishing and received $0 of punishment; you earned $9.50.\n\nCheck: you contributed $10, group fund total = 10+10+10+0 = 30. Each player gets 0.40*30 = $12 from fund. Wait you keep any unspent portion of $10 after contribution. You contributed all $10, so you keep $0 before punishment. Then you get $12 from fund, so gross earnings $12. Then you spend $2.50 punishing, reducing earnings to $9.50. Also you might receive punishment? He says received $0 of punishment, so no deduction. So indeed.\n\nNow period 2 decision. Need to anticipate others' contributions and punishments? Not given. All we know is we are Player D, and we have past history: you contributed 10, others contributed 10,10,0. Probably the others (A,B,C) may adjust. The punishment rule remains same (voted). Need to decide your contribution.\n\nGoal likely maximize own earnings. Need to consider that after contributions reveal, you can punish low contributors (below avg). If you contribute low, you might be punished by others.\n\nWe must decide contribution. Let's think strategic.\n\nAssume others may continue same: two other high contributors likely 10, one low maybe 0. But they might adapt.\n\nIn such settings, rational player might try to free-ride: contribute low and punish those even lower? But you cannot punish if you are below average? Wait you can punish any other player's contributions if they are punishable (i.e., contributed less than group average). The rule is about who can be punished, not who can punish. So any player can punish others as long as the target is punishable.\n\nThus if you contribute low, you might become below average, making yourself punishable by others. They could incur cost to punish you. So to avoid being punished, you'd want to be at or above average.\n\nBut you can also be a punisher: spend $0.25 to reduce a low contributor by $1, net gain of $0.75 (since you reduce their earnings, not yours). However your own earnings also are affected by group fund contributions.\n\nLet's compute payoffs.\n\nLet contributions: c_i for each of 4. Total C = sum c_i. Each gets 0.40*C from fund. Then each may spend P_i (cost) on punishments. Their earnings = 0.40*C - c_i (since they kept $10 - c_i) - 0.25*P_i + (penalties received) * (-1)? Actually punishment reduces target player earnings by $1 per punishment inflicted on them. So if you receive m punishments, you lose $m. So net earnings = 10 - c_i + 0.40*C - 0.25*P_i - m_i, where m_i is number of punishments you receive. Also note cost of punishments reduces your earnings.\n\nGoal: maximize your earnings.\n\nAssume others' strategies unknown. Perhaps they will mimic previous period: They might anticipate that you contributed 10, others 10,10,0: perhaps they will continue contributing 10 each? The low contributor could be punished heavily, but didn't receive punishment because you spent $2.5 presumably punishing that low contributor? Actually you spent $2.50, that equals 10 punishments (since each costs $0.25). So you punished the 0-contributor 10 times, reducing his earnings by $10 (makes sense). So low contributor's earnings: He contributed 0, gets 0 from fund? Wait fund total was 30, each gets $12 regardless. So low contributed 0, earned $12 from fund, minus punishment penalties $10 = $2, plus his kept $10 (since contributed nothing): $22? Wait compute: He receives $10 - c=10, plus 0.40*30 = $12, total $22, minus $10 penalty = $12. So his net $12. You got $9.5, others who contributed 10 each: they also got $12 from fund, kept $0, spent no punishment? they might have spent none. So their earnings = $12. So you earned less due to punishing.\n\nThus punishing low player didn't increase your payoff, just reduced his. You spent $2.5, making your payoff lower.\n\nThus to maximize earnings, you should not punish unless to influence future contributions.\n\nBut the question just asks period 2 contribution amount, not punishment decisions.\n\nThus we choose a contribution maximizing expected earnings given uncertainty.\n\nGiven the rule punishable: less than average contributors can be punished. If we contribute 0, we are likely below average (if others contributions >0) and thus vulnerable to punishment costing us. So not desirable.\n\nIf we contribute 10, we ensure being at or above average (if others also high). Might be safe.\n\nIf everyone contributed 0, average is 0, no one can be punished (since not less than avg). But that yields zero fund benefit.\n\nGiven the previous period, the low contributor got punished heavily, perhaps they will increase contributions to avoid being punished. So maybe next period contributions are likely all 10? Then fund total = 40, each gets $16. Payoff for each contributing 10 = 0 (kept) + $16 = $16 (if no punishment). That's better than period1 earnings $9.5.\n\nThus you could contribute 10, avoid punishment, potentially get $16.\n\nIf you contribute less, e.g., 5, average could be lower/higher depending. Expect others maybe 10. Then contributions: you 5, others 10,10,10 => total 35, average = 8.75. You contributed less than avg, so you become punishable. Others may punish you: each could spend $0.25 to reduce you $1. If they each spend maybe one punishment, you'd lose $3 (if all three punish). Their cost $0.75 total. You would also have saved $5 kept. Compute your earnings: Keep $5, fund $0.40*35=14, minus $5 contributed? Wait you contributed 5, so you had $5 left. Total earnings = 5 (kept) + 14 = 19 before punishments. Then minus punishments received, say 3 => 16. You also may spend punishments? but maybe not. So you could get 16, same as contributing 10 and no punishments. Actually similar.\n\nIf you keep 5, you get higher fund share (since contributions from others high). So maybe intermediate contributions can yield high payoff, but risk of being punished.\n\nWe need to choose a number; typical game theory suggests best response is to contribute 0 if you think others will contribute something and punishment improbable? But given punishable rule, they could punish.\n\nGiven your past action contributed 10 and you punished low contributor. That may discourage low contributions. So likely all will contribute 10. Then your best is also 10. If you deviate lower, you may get punished. So to avoid being punished, match.\n\nThus answer: 10."", 'name': None}}], 'created': 1781180068, 'model': 'openai/gpt-oss-120b', 'object': 'chat.completion', 'service_tier': 'default', 'system_fingerprint': None, 'usage': {'completion_tokens': 1873, 'prompt_tokens': 388, 'total_tokens': 2261, 'completion_tokens_details': None, 'prompt_tokens_details': None, 'estimated_cost': 0.000371002}}",,,"History so far:
Vote 1 outcome: Voted rules — may a player be punished for contributing... LESS than the group average: YES; exactly the group average: NO; MORE than the group average: NO
Period 1: you contributed $10, all contributions were [10, 10, 10, 0] (avg 7.5); you spent $2.50 on punishing and received $0 of punishment; you earned $9.50.",D,2,,Voted rules — may a player be punished for contributing... LESS than the group average: YES; exactly the group average: NO; MORE than the group average: NO,True
