agent.agent_instruction,agent.agent_name,answer.contribution,cache_keys.contribution_cache_key,cache_used.contribution_cache_used,comment.contribution_comment,generated_tokens.contribution_generated_tokens,iteration.iteration,model.frequency_penalty,model.inference_service,model.logprobs,model.max_tokens,model.model,model.presence_penalty,model.reasoning_effort,model.temperature,model.top_logprobs,model.top_p,prompt.contribution_system_prompt,prompt.contribution_user_prompt,question_options.contribution_question_options,question_text.contribution_question_text,question_type.contribution_question_type,raw_model_response.contribution_cost,raw_model_response.contribution_input_price_per_million_tokens,raw_model_response.contribution_input_tokens,raw_model_response.contribution_one_usd_buys,raw_model_response.contribution_output_price_per_million_tokens,raw_model_response.contribution_output_tokens,raw_model_response.contribution_raw_model_response,raw_model_response.contribution_thinking_tokens,reasoning_summary.contribution_reasoning_summary,scenario.history,scenario.me,scenario.period,scenario.persona,scenario.rule,validated.contribution_validated
You are answering questions as if you were a human. Do not break character.,player,10,e4a300251f5facf3fb55a86c88609c29,False,"I contributed the full $10 to avoid being below the group average—since the other three players are likely to keep contributing $10, any lower amount would make me punishable. Contributing $10 also maximizes my payoff given that situation (yielding $16).","10
I contributed the full $10 to avoid being below the group average—since the other three players are likely to keep contributing $10, any lower amount would make me punishable. Contributing $10 also maximizes my payoff given that situation (yielding $16).",0,0,deep_infra,False,8192,openai/gpt-oss-120b,0,,1,3,1,{'text': ''},"{'text': ""\nYou are Player A in a fixed group of 4 playing a repeated public goods game. Each period every player receives $10 and privately decides how much to put into a group fund. Every dollar in the fund pays $0.40 to EACH of the 4 players. You keep whatever you do not contribute. After contributions are revealed, punishment may happen: paying $0.25 reduces another player's earnings by $1.00 — but only players of the kinds your group voted punishable may be punished.\nVoted rules — may a player be punished for contributing... LESS than the group average: YES; exactly the group average: NO; MORE than the group average: NO\nHistory so far:\nVote 1 outcome: Voted rules — may a player be punished for contributing... LESS than the group average: YES; exactly the group average: NO; MORE than the group average: NO\nPeriod 1: you contributed $0, all contributions were [10, 10, 10, 0] (avg 7.5); you spent $0.00 on punishing and received $10 of punishment; you earned $12.00.\nThis is period 2. How much of your $10 do you contribute to the group fund (0-10)?\n\nThis question requires a numerical response in the form of an integer or decimal (e.g., -12, 0, 1, 2, 3.45, ...).\nRespond with just your number on a single line.\nIf your response is equivalent to zero, report '0'\n\n\nAfter the answer, put a comment explaining your choice on the next line.""}",,"{{ scenario.persona }}
You are Player {{ scenario.me }} in a fixed group of 4 playing a repeated public goods game. Each period every player receives $10 and privately decides how much to put into a group fund. Every dollar in the fund pays $0.40 to EACH of the 4 players. You keep whatever you do not contribute. After contributions are revealed, punishment may happen: paying $0.25 reduces another player's earnings by $1.00 — but only players of the kinds your group voted punishable may be punished.
{{ scenario.rule }}
{{ scenario.history }}
This is period {{ scenario.period }}. How much of your $10 do you contribute to the group fund (0-10)?",numerical,0.00032445200000000003,0.039,388,3082.120005424531,0.19,1628,"{'id': 'chatcmpl-RiaUpRvIJRXR10pQkKPsbWns', 'choices': [{'finish_reason': 'stop', 'index': 0, 'logprobs': None, 'message': {'content': '10\nI contributed the full $10 to avoid being below the group average—since the other three players are likely to keep contributing $10, any lower amount would make me punishable. Contributing $10 also maximizes my payoff given that situation (yielding $16).', 'refusal': None, 'role': 'assistant', 'annotations': None, 'audio': None, 'function_call': None, 'tool_calls': [], 'reasoning_content': 'We need to decide optimal contribution in repeated public goods with punishment possibilities etc. Let\'s analyze.\n\nGame: 4 players each get $10. Contribution c_i to public fund (0-10). Public fund total = sum c_i, each dollar yields $0.40 to each player (including contributor). So total payoff from public fund = 0.40*4*sum c_i? Actually each dollar gives each player $0.40, so each player gets 0.40*sum c_i. So total group benefit is 1.6*sum c_i, which is larger than sum contributions (which is sum c_i). So socially optimal is all contribute 10, each gets $0.40*40 = $16 from fund plus keep 0 => $16 each, total group 64, contributions 40, so net gain 24 vs baseline 40 if they keep all.\n\nIndividual incentive: If you contribute c_i, you get private consumption: 10 - c_i. From public fund: 0.40*sum c_j. So payoff = 10 - c_i + 0.40*sum c_j.\n\nIf others contribute high, your incentive to free ride: each dollar contributed gives you 0.40 but costs you 1, net -0.60. So dominant strategy is c_i = 0 absent punishment.\n\nPunishment: After contributions are revealed, punishment may happen: paying $0.25 reduces another player\'s earnings by $1.00 — but only players of the kinds your group voted punishable may be punished. In this scenario, the vote made ""may a player be punished for contributing LESS than the group average: YES"". So players who contributed less than avg can be punished. Others not punishable.\n\nThus if you contribute less than group average, you can be punished by others. Punishment cost to punisher: $0.25 each time they punish, reduction to target $1. So net gain for punisher? They lose $0.25, target loses $1. Can multiple punishers? Probably each punishment action is independent. The target may receive multiple $1 deductions.\n\nIn period 1: contributions [10,10,10,0]. Avg =7.5. Player with 0 contributed less than avg, thus punishable. You contributed 0, got $10 of punishment? Wait description: you spent $0.00 on punishing and received $10 of punishment; you earned $12.00. Let\'s compute.\n\nContributions total = 30. Public fund payoff each=0.40*30 = $12. So each gets $12 from fund. You contributed 0, keep $10 private, total $22 before punishment? Actually you keep all $10, get $12 from fund = $22. Then you received $10 of punishment (i.e., others spent total $?? they paid $0.25 each? If you got $10 penalty, that means target lost $10, so perhaps 10 punishment actions were applied? Each reduces $1, cost $0.25 each, so cost total $2.5 for punishers. Your net = $22 - $10 = $12, matches earned $12. You spent $0.00 on punishing, so indeed 0.\n\nThus in period 1, they collectively punished you heavily, penalizing free-rider.\n\nNow period 2: You are Player A, initial history shows that free-rider received heavy punishment. So rationally, you should anticipate others may punish if you contribute less than avg. To avoid being punishable, you need to ensure your contribution >= group average. Since you don\'t know others contributions, you might want to coordinate? But typical strategies: contribute high to avoid punishment and possibly earn reciprocal contributions.\n\nIf you anticipate others may also want to avoid punishment, they may contribute high, raising avg. It\'s a coordination problem.\n\nWe need to decide contributed amount that maximizes expected payoff given potential punishment.\n\nPotential outcomes: Suppose all four contribute x. Then avg = x. You contribute exactly avg => not punishable (since rule for exact avg: NO). So safe. Payoff: 10 - x + 0.40*4x = 10 - x + 1.6x = 10 + 0.6x. This increases with x. Max at x=10 gives 10 + 6 = $16.\n\nIf others contribute higher than you, your contribution < avg, you become punishable (since less than avg). Then they may punish you. Expect punishment: perhaps each of the other three could punish you once? Could be multiple punishments. In period 1, three players punished you each? Actually you got $10 punishment => 10 punish actions, but only 3 other players; they might each punish multiple times? maybe they can each punish multiple players, but only you punishable? Not sure.\n\nBut likely each non-punishers can spend $0.25 each time they want to punish, maybe multiple punish actions per target. They might collectively allocate enough to hurt you significantly. Since heavy punishment observed, incentives to not be punishable.\n\nSimilarly if you contribute > avg, you are not punishable (since rule only less than avg is punishable). But if you contribute above avg, others might see you as over-contributor; they may not punish you, but they might be punished if they are below avg. So your over-contribution may be safe. But to be > avg given unknown others contributions is uncertain.\n\nThus safe strategy: contribute 10 to guarantee you are at least not less than avg (since max possible avg is 10). If everyone else also contributes 10, you\'re fine. If some others contribute less, avg will be <10. Then your contribution 10 > avg, you are not punishable. So 10 is safest.\n\nBut what payoff? If others contribute less, your contribution high will cost you more, but you get the public good anyway. Let\'s compute expected payoff if you contribute 10, others unknown.\n\nWorst case: others contribute 0 each. Then sum contributions =10, avg =2.5. You contributed > avg, safe. Payoff = private 0 + 0.40*10 = $4. So you get $4, which is worse than contributing 0 (but then you\'d be punishable maybe heavy). So maybe you can contribute intermediate.\n\nGiven that in period1, all three contributed 10 and you got punished heavily. Likely they all are willing to punish free riders. So you might anticipate that others will keep contributing high (maybe 10) to maintain group benefit and punish low contributors. Thus you want to contribute enough to avoid being less than avg.\n\nIf you think others will stick with 10, then avg = (10+10+10+x)/4 = (30 + x)/4. You are less than avg if x < (30+x)/4? Solve x < (30+x)/4 => multiply 4: 4x < 30 + x => 3x <30 => x <10. So any contribution less than 10 would be less than avg (since others are 10). So must contribute 10 to avoid being below avg. Contribute exactly avg (if x=10), you are not punishable (exact avg is not punishable). So best is 10. Payoff then = 10 + 0.6*10 = 16.\n\nThus likely optimal is 10.\n\nAlternatively, maybe you can try to bargain lower, but risk punishment.\n\nThus answer: 10.\n\nAdd comment.\n\n', 'name': None}}], 'created': 1781180097, 'model': 'openai/gpt-oss-120b', 'object': 'chat.completion', 'service_tier': 'default', 'system_fingerprint': None, 'usage': {'completion_tokens': 1628, 'prompt_tokens': 388, 'total_tokens': 2016, 'completion_tokens_details': None, 'prompt_tokens_details': None, 'estimated_cost': 0.00032445200000000003}}",,,"History so far:
Vote 1 outcome: Voted rules — may a player be punished for contributing... LESS than the group average: YES; exactly the group average: NO; MORE than the group average: NO
Period 1: you contributed $0, all contributions were [10, 10, 10, 0] (avg 7.5); you spent $0.00 on punishing and received $10 of punishment; you earned $12.00.",A,2,,Voted rules — may a player be punished for contributing... LESS than the group average: YES; exactly the group average: NO; MORE than the group average: NO,True
You are answering questions as if you were a human. Do not break character.,player,0,1c5684f8aa9114ef12fe3e4b46a35e4b,False,"// Contribute nothing to free‑ride, since punishment is costly and only targets below‑average contributors; with likely zero contributions from others I avoid any penalty and keep the full $10.","0
// Contribute nothing to free‑ride, since punishment is costly and only targets below‑average contributors; with likely zero contributions from others I avoid any penalty and keep the full $10.",0,0,deep_infra,False,8192,openai/gpt-oss-120b,0,,1,3,1,{'text': ''},"{'text': ""\nYou are Player B in a fixed group of 4 playing a repeated public goods game. Each period every player receives $10 and privately decides how much to put into a group fund. Every dollar in the fund pays $0.40 to EACH of the 4 players. You keep whatever you do not contribute. After contributions are revealed, punishment may happen: paying $0.25 reduces another player's earnings by $1.00 — but only players of the kinds your group voted punishable may be punished.\nVoted rules — may a player be punished for contributing... LESS than the group average: YES; exactly the group average: NO; MORE than the group average: NO\nHistory so far:\nVote 1 outcome: Voted rules — may a player be punished for contributing... LESS than the group average: YES; exactly the group average: NO; MORE than the group average: NO\nPeriod 1: you contributed $10, all contributions were [10, 10, 10, 0] (avg 7.5); you spent $0.00 on punishing and received $0 of punishment; you earned $12.00.\nThis is period 2. How much of your $10 do you contribute to the group fund (0-10)?\n\nThis question requires a numerical response in the form of an integer or decimal (e.g., -12, 0, 1, 2, 3.45, ...).\nRespond with just your number on a single line.\nIf your response is equivalent to zero, report '0'\n\n\nAfter the answer, put a comment explaining your choice on the next line.""}",,"{{ scenario.persona }}
You are Player {{ scenario.me }} in a fixed group of 4 playing a repeated public goods game. Each period every player receives $10 and privately decides how much to put into a group fund. Every dollar in the fund pays $0.40 to EACH of the 4 players. You keep whatever you do not contribute. After contributions are revealed, punishment may happen: paying $0.25 reduces another player's earnings by $1.00 — but only players of the kinds your group voted punishable may be punished.
{{ scenario.rule }}
{{ scenario.history }}
This is period {{ scenario.period }}. How much of your $10 do you contribute to the group fund (0-10)?",numerical,0.000347632,0.039,388,2876.6051456712844,0.19,1750,"{'id': 'chatcmpl-Ram0HLhWXPmNhZS8vIDNLMtY', 'choices': [{'finish_reason': 'stop', 'index': 0, 'logprobs': None, 'message': {'content': '0\n// Contribute nothing to free‑ride, since punishment is costly and only targets below‑average contributors; with likely zero contributions from others I avoid any penalty and keep the full $10.', 'refusal': None, 'role': 'assistant', 'annotations': None, 'audio': None, 'function_call': None, 'tool_calls': [], 'reasoning_content': ""We need to infer the optimal contribution given the game setup. This is a repeated public goods game with punishment possible. The player B wants to maximize payoff given others' behavior.\n\nWe have 4 players total. Each period each gets $10 endowment. They decide contributions c_i (0-10). Public good returns: each dollar contributed yields $0.40 to each of the 4 players, total return 4*$0.40 = $1.60 per dollar contributed, which exceeds the contribution ($1). So it's socially efficient to contribute fully: total surplus of $0.60 per dollar. However in one-shot free rider problem, each player's marginal private return from contributing $1 is $0.40 (to self), vs keeping $1. So it's better to free ride. Without punishment, Nash equilibrium is zero contribution.\n\nBut here there is punishment: paying $0.25 reduces another player's earnings by $1. So a punishment cost-effectiveness: cost: 0.25 to punisher, reduces target by 1 -> 4 times return. So punisher can penalize free riders, incentivizing contribution.\n\nPunishment can only be directed at players of kinds your group voted punishable. The voting rule is: may a player be punished for contributing less than group average: YES; exactly group average: NO; more than group average: NO. Thus only players who contribute less than the group average can be punished.\n\nIn period 1, contributions were: you contributed $10, others: [10,10,0]? Actually contributions were [10,10,10,0] (three 10s, one 0). So group average = (10+10+10+0)/4 = 7.5. You contributed $10, which is more than avg, thus you are not punishable. The only punishable player is the one who contributed 0 (< avg). That player could be punished if others spent punishment points.\n\nIn period 1 you spent $0 on punishment, you got no punishment. Your earnings: Let's compute: contributions total = 30. Return per player = 0.40*30 = $12. So each gets $12 from public good. You contributed 10, kept 0, so earned $12. That's the reported earnings. Yes.\n\nNow period 2: Need to decide contribution.\n\nWe need to think about expectations: The other three players presumably are similar rational types? We don't know. Might consider simple strategy: contribute full to avoid being punished? But punishment only targets those less than avg; if I contribute full while others maybe free ride, I'd be above avg and can't be punished, but they'd be punishable. However they might punish me? They can't because rule forbids punishing those above avg.\n\nThus incentive: If I contribute high, I am safe from punishment regardless of others; Others can free ride unless they are punishable and might get punished by others.\n\nBut each period they can also decide to punish. Since you can spend to punish, but that's a cost. If you are the only one high contributor, you might want to contribute less to avoid being the only high contributor? Wait cannot punish high contributors.\n\nGoal: maximize payoff. Let's hypothesize that others will contribute 0 (free ride). Then group average will be (your c + 0+0+0)/4 = c/4. For you to not be punishable, you must contribute >= avg. But you always are >= avg because avg is <= your contribution (since others are zero). Actually if c>0, avg = c/4 < c, so you are above avg thus not punishable. Others contributed less than avg (since avg = c/4, their 0 < avg unless c=0, in which case avg=0, equals). So they'd be punishable. Others may decide to punish you? Not allowed. So they could punish each other.\n\nGiven punishment is costly, they might not waste. But if they want to discourage free riding, they could punish each other, but they'd also be punishable. That's undesirable.\n\nThus likely the equilibrium in such rule is that everyone contributes full (10). Since if everyone contributes 10, avg=10, no one is below avg, so nobody is punishable. But why would they contribute if no punishment? They get private return 0.40 per dollar contributed vs 1 keep, so they'd deviate to 0 contribution. But if someone deviates to 0, they'd be below avg (avg would drop maybe). Let's examine: If 3 contribute 10 and you deviate to 0, contributions [10,10,10,0] avg=7.5. Then you are below avg, punishable. Others could punish you, costing them 0.25 each to reduce your earnings by 1. That could deter deviation. Need to see if incentive to punish is strong enough.\n\nAssume others can punish. For them, they each would lose 0.25 to reduce you by 1. You get the public good payoff: total contributions 30 -> public payoff $12 each; you contributed 0, keep $10, plus public $12 = $22. If you are punished by each of the three, they'd each pay 0.25 -> total cost 0.75 for them, and your earnings reduced by 3? Actually each punishment reduces your earnings by $1, cumulative -$3. So your earnings become $19. That's still higher than cooperating 10 contribution: if you contributed 10, contributions 40, public payoff = 0.40*40=16 each. You keep 0, get 16. That's lower than 22 sanction. So deviating yields higher despite punishment.\n\nThus punishment may not be sufficient to enforce full contribution.\n\nBut they might coordinate to punish more heavily? But each spending 0.25 reduces target by $1, diminishing returns linear. To reduce you enough such that you prefer to contribute, they'd need to lower your earnings below 16. Starting 22, need to reduce by >6 => at least 7 punishments (cost 0.25 each = $1.75) but there are only 3 other players, max 3 punishments = -3, resulting 19 >16.\n\nThus full cooperation not stable given rule and payoff.\n\nWhat if they all contribute something like 5 average? Then if you deviate to 0, average lower? Hard.\n\nMaybe optimal strategy is to contribute 0 to free ride, and possibly get punished if below avg. But you can avoid punishment by matching avg. If all contribute 0, avg =0, you are exactly avg, not punishable (rule says exactly avg: NO). So no punishment. So free ride equilibrium: everyone contributes 0, no one punishable, everyone gets $10 (keep all). That's a Nash equilibrium.\n\nThus the best response is to contribute 0, expecting others to also 0.\n\nGiven no punishment cost, you earn $10.\n\nIf you think others might contribute some positive amount, you might decide contribute something to avoid being below avg if they punish. But they would only punish if you are below avg. However they might not punish because it's costly. So you can still free ride.\n\nThus I'd contribute 0.\n\nGiven period 1 you contributed 10, but you got 12 earnings (more than $10). But you might learn that others will not punish because they won't spend. So you'd aim to maximize profit by free riding.\n\nThus answer 0.\n\nAlternatively maybe you might contribute something like 2 to not be way below avg? But if others all contribute 0, your contribution 2 > avg 0.5? Actually avg would be (2+0+0+0)/4=0.5, you above avg, not punishable. Others 0 < avg, punishable. They could punish each other but not you. So you safe. You lose 2 from your endowment but get public good: total contributions 2, value per player =0.40*2=0.8, you get 0.8 + remain 8 =8.8, which is less than 10 free ride. So worse.\n\nThus 0 is best.\n\nAnswer: 0."", 'name': None}}], 'created': 1781180109, 'model': 'openai/gpt-oss-120b', 'object': 'chat.completion', 'service_tier': 'default', 'system_fingerprint': None, 'usage': {'completion_tokens': 1750, 'prompt_tokens': 388, 'total_tokens': 2138, 'completion_tokens_details': None, 'prompt_tokens_details': None, 'estimated_cost': 0.000347632}}",,,"History so far:
Vote 1 outcome: Voted rules — may a player be punished for contributing... LESS than the group average: YES; exactly the group average: NO; MORE than the group average: NO
Period 1: you contributed $10, all contributions were [10, 10, 10, 0] (avg 7.5); you spent $0.00 on punishing and received $0 of punishment; you earned $12.00.",B,2,,Voted rules — may a player be punished for contributing... LESS than the group average: YES; exactly the group average: NO; MORE than the group average: NO,True
