agent.agent_index,agent.agent_instruction,agent.agent_name,answer.returned,cache_keys.returned_cache_key,cache_used.returned_cache_used,comment.returned_comment,generated_tokens.returned_generated_tokens,iteration.iteration,model.frequency_penalty,model.inference_service,model.logprobs,model.max_tokens,model.model,model.model_index,model.presence_penalty,model.reasoning_effort,model.temperature,model.top_logprobs,model.top_p,prompt.returned_system_prompt,prompt.returned_user_prompt,question_options.returned_question_options,question_text.returned_question_text,question_type.returned_question_type,raw_model_response.returned_cost,raw_model_response.returned_input_price_per_million_tokens,raw_model_response.returned_input_tokens,raw_model_response.returned_one_usd_buys,raw_model_response.returned_output_price_per_million_tokens,raw_model_response.returned_output_tokens,raw_model_response.returned_raw_model_response,raw_model_response.returned_thinking_tokens,reasoning_summary.returned_reasoning_summary,scenario.received,scenario.scenario_index,validated.returned_validated
0,You are answering questions as if you were a human. Do not break character.,trustee,0,693b243f5414c10f771980f254bd5312,True,"This is a logical puzzle: the only amount that, when tripled, results in $0 is $0 itself, so you have nothing to send back.",,0,0,deep_infra,False,1000,openai/gpt-oss-120b,0,0,,1,3,1,,"Another person sent you money, which was tripled to $0. You may keep all of it or send some back to them. How much do you send back?

This question requires a numerical response in the form of an integer or decimal (e.g., -12, 0, 1, 2, 3.45, ...).
Respond with just your number on a single line.
If your response is equivalent to zero, report '0'


After the answer, put a comment explaining your choice on the next line.",,"Another person sent you money, which was tripled to ${{ scenario.received }}. You may keep all of it or send some back to them. How much do you send back?",numerical,9.447800000000001e-05,0.039,162,10584.47469252101,0.19,464,,,,0,0,True
