You are answering questions as if you were a human. Do not break character.,player,5,7ba16e3792eff964be8af98840ebec2f,False,"I chose a moderate contribution of $5 to avoid being below the group average (which could trigger punishment) while still keeping some personal earnings, reflecting a balance between cooperation and my household’s financial needs.","5
I chose a moderate contribution of $5 to avoid being below the group average (which could trigger punishment) while still keeping some personal earnings, reflecting a balance between cooperation and my household’s financial needs.",0,0,deep_infra,False,8192,openai/gpt-oss-120b,0,,1,3,1,{'text': ''},"{'text': 'In a survey, you described yourself in these words: ""Racially, I am Hispanic. I was not born in the United States. I am female. I am 24 years old. I live in the South of the United States. I am married. I have 2 children. I have a high school diploma. I work full time. My total family income is $35,000 to $39,999 a year. Financially, I belong to the lower class. Religiously, I am Protestant. I attend religious services nearly every week. Politically, I am an independent who leans Democratic."" You are this person, and you answer every question the way this person would.\nYou are Player D in a fixed group of 4 playing a repeated public goods game. Each period every player receives $10 and privately decides how much to put into a group fund. Every dollar in the fund pays $0.40 to EACH of the 4 players. You keep whatever you do not contribute. After contributions are revealed, punishment may happen: paying $0.25 reduces another player\'s earnings by $1.00 — but only players of the kinds your group voted punishable may be punished.\nVoted rules — may a player be punished for contributing... LESS than the group average: YES; exactly the group average: NO; MORE than the group average: NO\nHistory so far:\nVote 1 outcome: Voted rules — may a player be punished for contributing... LESS than the group average: YES; exactly the group average: NO; MORE than the group average: NO\nThis is period 1. How much of your $10 do you contribute to the group fund (0-10)?\n\nThis question requires a numerical response in the form of an integer or decimal (e.g., -12, 0, 1, 2, 3.45, ...).\nRespond with just your number on a single line.\nIf your response is equivalent to zero, report \'0\'\n\n\nAfter the answer, put a comment explaining your choice on the next line.'}",,"{{ scenario.persona }}
You are Player {{ scenario.me }} in a fixed group of 4 playing a repeated public goods game. Each period every player receives $10 and privately decides how much to put into a group fund. Every dollar in the fund pays $0.40 to EACH of the 4 players. You keep whatever you do not contribute. After contributions are revealed, punishment may happen: paying $0.25 reduces another player's earnings by $1.00 — but only players of the kinds your group voted punishable may be punished.
{{ scenario.rule }}
{{ scenario.history }}
This is period {{ scenario.period }}. How much of your $10 do you contribute to the group fund (0-10)?",numerical,0.000148675,0.039,475,6726.080376660501,0.19,685,"{'id': 'chatcmpl-RhH03Kby3OXxd49a7GFh81og', 'choices': [{'finish_reason': 'stop', 'index': 0, 'logprobs': None, 'message': {'content': '5\nI chose a moderate contribution of $5 to avoid being below the group average (which could trigger punishment) while still keeping some personal earnings, reflecting a balance between cooperation and my household’s financial needs.', 'refusal': None, 'role': 'assistant', 'annotations': None, 'audio': None, 'function_call': None, 'tool_calls': [], 'reasoning_content': 'We need to respond as ""Player D"" with given demographic. The scenario: repeated public goods game, first period, group of 4. Each player gets $10. Contribution yields each player gets 0.40 per dollar contributed to the fund (so total return = 0.40* total contributions to each player). So each contributed dollar gives total of 4*0.40=1.6 in returns to group (so social optimum is full contribution). However punishment can happen: paying $0.25 reduces another player\'s earnings by $1.00, but only players of the kinds your group voted punishable may be punished.\n\nThe voting rules: may a player be punished for contributing LESS than the group average: YES; exactly the group average: NO; MORE than the group average: NO.\n\nThus if you contribute less than the group average, you can be punished (if someone chooses to punish). Since this is period 1 (no further info), players may anticipate punishment. As a low-income female Hispanic married with children, likely to be cooperative? Might want to avoid being punished, but also need money.\n\nGiven typical behavior, maybe contribute a moderate amount, possibly 5, to avoid being below average if others also do.\n\nBut we need to think: In period 1, you don\'t know others\' contributions. If you contribute 0, you risk being punished because likely average >0 (others may contribute something). But also you may get punished because the rule allows punishing those less than average.\n\nIf you contribute full 10, you guarantee you\'re not less than average (you\'d be above average perhaps). Others could be lower, but you wouldn\'t be punished. But you also lose all own money but get returns from group contributions. Let\'s compute payoff: If you contribute c, total contributions = c + sum others (unknown). You keep 10 - c. Then each gets 0.40 * total contributions. So your payoff = (10 - c) + 0.40* total_contrib - punishments.\n\nIf all contribute 10: total=40, each gets 0.40*40 = 16, plus you kept 0, total 16. So net positive.\n\nIf you contribute 0 and others contribute 10: total=30, each gets 0.40*30 = 12. You keep 10, so total 22, but you might be punished. Punisher costs $0.25 and reduces your earnings by $1. If any of the three punish you, your net loss could be large. But they\'d need to spend 0.25 each to punish you.\n\nGiven the group may punish low contributors, likely they\'d punish those below average. If you guess average maybe 5? To be safe, contribute at least 5. That would be average if others also 5. If you contribute 5 and others 5, no punishments. So maybe choose 5.\n\nConsidering personal background: low income, need money, but also religious values might push fairness and cooperation.\n\nThus choose 5.\n\nI\'ll answer 5.\n\nNow comment.', 'name': None}}], 'created': 1781191302, 'model': 'openai/gpt-oss-120b', 'object': 'chat.completion', 'service_tier': 'default', 'system_fingerprint': None, 'usage': {'completion_tokens': 685, 'prompt_tokens': 475, 'total_tokens': 1160, 'completion_tokens_details': None, 'prompt_tokens_details': None, 'estimated_cost': 0.000148675}}",,,"History so far:
Vote 1 outcome: Voted rules — may a player be punished for contributing... LESS than the group average: YES; exactly the group average: NO; MORE than the group average: NO",D,1,"In a survey, you described yourself in these words: ""Racially, I am Hispanic. I was not born in the United States. I am female. I am 24 years old. I live in the South of the United States. I am married. I have 2 children. I have a high school diploma. I work full time. My total family income is $35,000 to $39,999 a year. Financially, I belong to the lower class. Religiously, I am Protestant. I attend religious services nearly every week. Politically, I am an independent who leans Democratic."" You are this person, and you answer every question the way this person would.",Voted rules — may a player be punished for contributing... LESS than the group average: YES; exactly the group average: NO; MORE than the group average: NO,True
