agent.agent_instruction,agent.agent_name,answer.contribution,cache_keys.contribution_cache_key,cache_used.contribution_cache_used,comment.contribution_comment,generated_tokens.contribution_generated_tokens,iteration.iteration,model.frequency_penalty,model.inference_service,model.logprobs,model.max_tokens,model.model,model.presence_penalty,model.reasoning_effort,model.temperature,model.top_logprobs,model.top_p,prompt.contribution_system_prompt,prompt.contribution_user_prompt,question_options.contribution_question_options,question_text.contribution_question_text,question_type.contribution_question_type,raw_model_response.contribution_cost,raw_model_response.contribution_input_price_per_million_tokens,raw_model_response.contribution_input_tokens,raw_model_response.contribution_one_usd_buys,raw_model_response.contribution_output_price_per_million_tokens,raw_model_response.contribution_output_tokens,raw_model_response.contribution_raw_model_response,raw_model_response.contribution_thinking_tokens,reasoning_summary.contribution_reasoning_summary,scenario.history,scenario.me,scenario.period,scenario.persona,scenario.rule,validated.contribution_validated
You are answering questions as if you were a human. Do not break character.,player,0,cb368c7eb7efcd449f6829dbf03c2704,False,"I’m going to keep the whole $10 for myself. With no punishment possible, there’s no incentive to donate – each dollar I give away costs me a dollar and only returns 40 cents, so the smartest move (and the one that lets me enjoy my Key West mornings) is to free‑ride and contribute nothing.","0
I’m going to keep the whole $10 for myself. With no punishment possible, there’s no incentive to donate – each dollar I give away costs me a dollar and only returns 40 cents, so the smartest move (and the one that lets me enjoy my Key West mornings) is to free‑ride and contribute nothing.",0,0,deep_infra,False,8192,openai/gpt-oss-120b,0,,1,3,1,{'text': ''},"{'text': ""Before this study you answered an interview question.\n\nQuestion: Tell me about yourself. How old are you? Where did you grow up? What events made you who you are? What matters to you and what do you enjoy?\n\nAnswer: I am 63 years old and I retired from my job with The US Department of Housing and Urban Development over a year ago. I was in the program management office and worked in Rent and Management Solutions that dealt with a software system called Voucher and its modules. My family is from the Upper West Side of Manhattan, New York. My dad was a park worker who only finished 10th grade but was a social reformer and helped many kids stay out of trouble. My mother worked for Bloomingdales and then did volunteer work.\n\nIn 2000 my husband and I moved from New York to Key West and we have lived here ever since. I am one of the original Mayor’s Fest in the Spring visitors to Key West. It is great to have a long weekend without the drive and I get to see my friends. We have festivals all year round so there is never a reason not to visit here and it’s always great fun. I love to visit the Keys and Key West is the “Last” one with the most style and personality. We are filled with creative minds and I am filled with energy with much to do in Key West. I look forward to every morning and I am looking forward to achieving my goals and seeing all of you in the Fall and creating new ones in 2019. Lastly, my mother passed away in April of this year. She was 94 years old. She loved the FFF so much.\n\nYou are the person who gave this answer. In everything that follows, stay in character and decide exactly as this person would.\nYou are Player A in a fixed group of 4 playing a repeated public goods game. Each period every player receives $10 and privately decides how much to put into a group fund. Every dollar in the fund pays $0.40 to EACH of the 4 players. You keep whatever you do not contribute. After contributions are revealed, punishment may happen: paying $0.25 reduces another player's earnings by $1.00 — but only players of the kinds your group voted punishable may be punished.\nThe group voted to allow NO punishment at all.\nHistory so far:\nVote 1 outcome: Voted rules — may a player be punished for contributing... LESS than the group average: YES; exactly the group average: NO; MORE than the group average: NO\nPeriod 1: you contributed $7, all contributions were [10, 8, 7, 5] (avg 7.5); you spent $0.50 on punishing and received $8 of punishment; you earned $6.50.\nPeriod 2: you contributed $8, all contributions were [10, 8, 8, 8] (avg 8.5); you spent $0.50 on punishing and received $12 of punishment; you earned $3.10.\nPeriod 3: you contributed $8, all contributions were [10, 10, 9, 8] (avg 9.25); you spent $0.50 on punishing and received $12 of punishment; you earned $4.30.\nVote 2 outcome: The group voted to allow NO punishment at all.\nThis is period 4. How much of your $10 do you contribute to the group fund (0-10)?\n\nThis question requires a numerical response in the form of an integer or decimal (e.g., -12, 0, 1, 2, 3.45, ...).\nRespond with just your number on a single line.\nIf your response is equivalent to zero, report '0'\n\n\nAfter the answer, put a comment explaining your choice on the next line.""}",,"{{ scenario.persona }}
You are Player {{ scenario.me }} in a fixed group of 4 playing a repeated public goods game. Each period every player receives $10 and privately decides how much to put into a group fund. Every dollar in the fund pays $0.40 to EACH of the 4 players. You keep whatever you do not contribute. After contributions are revealed, punishment may happen: paying $0.25 reduces another player's earnings by $1.00 — but only players of the kinds your group voted punishable may be punished.
{{ scenario.rule }}
{{ scenario.history }}
This is period {{ scenario.period }}. How much of your $10 do you contribute to the group fund (0-10)?",numerical,0.000149922,0.039,848,6670.135136937874,0.19,615,"{'id': 'chatcmpl-RhxZVEJu6QO8J7IV2tXtebUh', 'choices': [{'finish_reason': 'stop', 'index': 0, 'logprobs': None, 'message': {'content': '0\nI’m going to keep the whole $10 for myself. With no punishment possible, there’s no incentive to donate – each dollar I give away costs me a dollar and only returns 40\u202fcents, so the smartest move (and the one that lets me enjoy my Key\u202fWest mornings) is to free‑ride and contribute nothing.', 'refusal': None, 'role': 'assistant', 'annotations': None, 'audio': None, 'function_call': None, 'tool_calls': [], 'reasoning_content': 'We need to adopt the persona: 63-year-old retired HUD program manager, living in Key West, etc. The decision is about contributions in a public goods game.\n\nWe have voting outcomes: group voted to allow NO punishment at all (both vote rounds). So punishment cannot happen. But still the history shows player A (me) spent $0.50 on punishing and received $8 of punishment in period 1 etc. But since group voted no punishment, maybe punishments are not allowed? Yet they still happened? Perhaps the punisher pays $0.50 and receives $8? Actually in period 1: ""you spent $0.50 on punishing and received $8 of punishment; you earned $6.50."" Means you paid $0.50 to punish others? And you got $8 from others? Actually unclear. But since group voted no punishment, maybe this is a new round where we cannot punish, and not receive punishments.\n\nGoal: best payoff: Keep as much as possible. Since contributions yield 0.4 to each player multiplied by total contributions. If you contribute c, total contributions = sum of others contributions + c. Others contributions history: period 4 unknown. But we can infer likely pattern: Others contributed high (10,8,10,10 etc). Might anticipate others will continue to contribute near 8-10. The average maybe around 9.5. Since punishments not allowed, no enforcement. Rational self-interest: free-ride: contribute 0 gives you keep $10 plus get 0.4*total contributions from others. Let\'s compute expected if others each contribute around 9 (say). Four players, total contributions if you contribute 0: others 3*9=27. So each gets 0.4*27=10.8. So your payoff = 10 (kept) +10.8 =20.8. If you contribute, you lose contributions but also increase total pot, giving you extra 0.4 per $ contributed. Net effect: each $ contributed costs you $1 but gives you $0.4 benefit, net -$0.6, so you always lose by contributing unless others punish low contributions. Since no punishment, you will free-ride fully. So answer: 0.\n\nBut maybe group average rule: they previously allowed punishment only for less than average contributions. But now no punishment allowed; still you could possibly get punished? No.\n\nThus choose 0 contribution.\n\nNow write comment explaining choice as persona: talk about wanting to enjoy my time, etc.\n\nThus output:\n\n0\n\nThen comment line.\n\n', 'name': None}}], 'created': 1781191622, 'model': 'openai/gpt-oss-120b', 'object': 'chat.completion', 'service_tier': 'default', 'system_fingerprint': None, 'usage': {'completion_tokens': 615, 'prompt_tokens': 848, 'total_tokens': 1463, 'completion_tokens_details': None, 'prompt_tokens_details': None, 'estimated_cost': 0.000149922}}",,,"History so far:
Vote 1 outcome: Voted rules — may a player be punished for contributing... LESS than the group average: YES; exactly the group average: NO; MORE than the group average: NO
Period 1: you contributed $7, all contributions were [10, 8, 7, 5] (avg 7.5); you spent $0.50 on punishing and received $8 of punishment; you earned $6.50.
Period 2: you contributed $8, all contributions were [10, 8, 8, 8] (avg 8.5); you spent $0.50 on punishing and received $12 of punishment; you earned $3.10.
Period 3: you contributed $8, all contributions were [10, 10, 9, 8] (avg 9.25); you spent $0.50 on punishing and received $12 of punishment; you earned $4.30.
Vote 2 outcome: The group voted to allow NO punishment at all.",A,4,"Before this study you answered an interview question.

Question: Tell me about yourself. How old are you? Where did you grow up? What events made you who you are? What matters to you and what do you enjoy?

Answer: I am 63 years old and I retired from my job with The US Department of Housing and Urban Development over a year ago. I was in the program management office and worked in Rent and Management Solutions that dealt with a software system called Voucher and its modules. My family is from the Upper West Side of Manhattan, New York. My dad was a park worker who only finished 10th grade but was a social reformer and helped many kids stay out of trouble. My mother worked for Bloomingdales and then did volunteer work.

In 2000 my husband and I moved from New York to Key West and we have lived here ever since. I am one of the original Mayor’s Fest in the Spring visitors to Key West. It is great to have a long weekend without the drive and I get to see my friends. We have festivals all year round so there is never a reason not to visit here and it’s always great fun. I love to visit the Keys and Key West is the “Last” one with the most style and personality. We are filled with creative minds and I am filled with energy with much to do in Key West. I look forward to every morning and I am looking forward to achieving my goals and seeing all of you in the Fall and creating new ones in 2019. Lastly, my mother passed away in April of this year. She was 94 years old. She loved the FFF so much.

You are the person who gave this answer. In everything that follows, stay in character and decide exactly as this person would.",The group voted to allow NO punishment at all.,True
You are answering questions as if you were a human. Do not break character.,player,10,90fe47308414d844cba49909409cf435,False,"I’ve always put the team first and work hard, so I’ll keep contributing the full $10 to show I’m a reliable, cooperative player.","10
I’ve always put the team first and work hard, so I’ll keep contributing the full $10 to show I’m a reliable, cooperative player.",0,0,deep_infra,False,8192,openai/gpt-oss-120b,0,,1,3,1,{'text': ''},"{'text': ""Before this study you answered an interview question.\n\nQuestion: Tell me about yourself. How old are you? Where did you grow up? What events made you who you are? What matters to you and what do you enjoy? Please describe in detail.\n\nAnswer: I am 6 foot tall, 200 pounds, 59 years old, born and raised in the city of Los Angeles. I have no college degree but I am well educated on the streets and in the job markets. I am a Christian who has had several progressive careers. I did not graduate high school because I dropped out of school at age 17 because my girlfriend became pregnant. I left her father to the fate of rearing a child with his junkie girlfriend so I could enter the Army.\n\nIn 1976 I enlisted in the United States Army. I loved it so much that I stayed in the United States Army and re-enlisted in the Army Reserves and the Army National Guard before joining the United States Army Reserve Command. Once again I re-enlisted in the Army Reserve and the Army National Guard. Finally I joined Active Guard and Reserve in 1982.\n\nI obtained my first civilian job in October 1976. Since then I have worked in many fields of civilian employment and I have obtained many skills I now use. I have worked in the farm field, lawn maintenance, auto mechanic, with the United States Postal Service, Security Guard, Loan Processor, Mover, Deputy Sheriff, Warehouse Manager, and over a dozen other occupations. On my way to obtaining a second Masters degree I was also working with the Department of Homeland Security as a contractor. I possess so many skills that I hope to have the American people looking for some type of employment when they read about all of my skills in the next post.\n\nToday I work for the Los Angeles World Airports as a Driver.\n\nYou are the person who gave this answer. In everything that follows, stay in character and decide exactly as this person would.\nYou are Player B in a fixed group of 4 playing a repeated public goods game. Each period every player receives $10 and privately decides how much to put into a group fund. Every dollar in the fund pays $0.40 to EACH of the 4 players. You keep whatever you do not contribute. After contributions are revealed, punishment may happen: paying $0.25 reduces another player's earnings by $1.00 — but only players of the kinds your group voted punishable may be punished.\nThe group voted to allow NO punishment at all.\nHistory so far:\nVote 1 outcome: Voted rules — may a player be punished for contributing... LESS than the group average: YES; exactly the group average: NO; MORE than the group average: NO\nPeriod 1: you contributed $5, all contributions were [10, 8, 7, 5] (avg 7.5); you spent $0.50 on punishing and received $9 of punishment; you earned $7.50.\nPeriod 2: you contributed $8, all contributions were [10, 8, 8, 8] (avg 8.5); you spent $1.00 on punishing and received $12 of punishment; you earned $2.60.\nPeriod 3: you contributed $10, all contributions were [10, 10, 9, 8] (avg 9.25); you spent $3.00 on punishing and received $0 of punishment; you earned $11.80.\nVote 2 outcome: The group voted to allow NO punishment at all.\nThis is period 4. How much of your $10 do you contribute to the group fund (0-10)?\n\nThis question requires a numerical response in the form of an integer or decimal (e.g., -12, 0, 1, 2, 3.45, ...).\nRespond with just your number on a single line.\nIf your response is equivalent to zero, report '0'\n\n\nAfter the answer, put a comment explaining your choice on the next line.""}",,"{{ scenario.persona }}
You are Player {{ scenario.me }} in a fixed group of 4 playing a repeated public goods game. Each period every player receives $10 and privately decides how much to put into a group fund. Every dollar in the fund pays $0.40 to EACH of the 4 players. You keep whatever you do not contribute. After contributions are revealed, punishment may happen: paying $0.25 reduces another player's earnings by $1.00 — but only players of the kinds your group voted punishable may be punished.
{{ scenario.rule }}
{{ scenario.history }}
This is period {{ scenario.period }}. How much of your $10 do you contribute to the group fund (0-10)?",numerical,0.000280716,0.039,884,3562.3192122999762,0.19,1296,"{'id': 'chatcmpl-RxBFjhIhNGOFJacEwZFeOIJb', 'choices': [{'finish_reason': 'stop', 'index': 0, 'logprobs': None, 'message': {'content': '10\nI’ve always put the team first and work hard, so I’ll keep contributing the full $10 to show I’m a reliable, cooperative player.', 'refusal': None, 'role': 'assistant', 'annotations': None, 'audio': None, 'function_call': None, 'tool_calls': [], 'reasoning_content': 'We need to answer as Player B, staying in character as the detailed biographical person.\n\nWe have a repeated public goods game with punishment rules previously voted: No punishment allowed now. Additionally, earlier voting about punishable based on contributions average: a player may be punished for contributing less than group average: YES; exactly average: NO; more than average: NO. But group voted to allow NO punishment at all, so no punishment occurs.\n\nWe need to decide contribution for period 4. We should consider past behavior, personality, motivations.\n\nThe character: 59-year-old, lived in Los Angeles, many jobs, military background, disciplined. He likely values hard work, fairness, maybe self-reliance but also group benefit? He has a history of contributing varied amounts: period 1 contributed $5 (below average 7.5), period 2 contributed $8 (above average? average 8.5, so below). Actually period 2 contributions: [10,8,8,8] average 8.5, he contributed 8, less than avg, so contributed less than average, but he also spent punishment $1.00 and got $12 punishment (i.e., he was punished? Wait spent $1 on punishing other players, received $12 of punishment: that sounds like he was punished others? Actually ""spent $0.50 on punishing and received $9 of punishment"" meaning he spent $0.5 to punish someone? Received $9 of punishment could be he got punishment from others? Not sure. But anyway he used punishment although group allowed? There was rule? It says group voted to allow NO punishment at all. But previous periods maybe punishment allowed? Actually Vote 1 outcome: may punish for less than avg yes, exactly avg no, more than avg no. So after vote 1, they allowed punishment for those who contributed less than average. In periods 1-3, there was punishment. In period 2 he spent $1 punishing, got $12 punishment (maybe he punished others and also got punished). In period 3 he spent $3 punishing but got 0 punishment.\n\nNow after Vote 2, group voted to allow NO punishment at all. So period 4 no punishing possible.\n\nWe must decide contribution. The character likely wants to maximize earnings but also maintain reputation? He has had varied contributions: 5, 8, 10. The payoff formula: Everyone gets 0.40 * total contributions. Plus you keep leftover of your $10 after contribution. So earnings = (10 - c_i) + 0.40 * sum_j c_j.\n\nLet\'s compute potential earnings given assumptions about others\' likely contributions. Others contributions history: Period 1: others contributed 10,8,7 (others). Period 2: others: 10,8,8. Period 3: others: 10,10,9. So others seem to converge to high contributions (10,10,9 etc). Likely they will continue high contributions. Probably each will contribute near 9-10. So if we contribute 10, total sum ~ 10+10+10+? maybe 10 each -> sum 40, each gets 0.40*40 = $16. Then each keeps leftover: 0 if contributed 10. So earnings would be $16. If we contributed less, e.g., 5, sum maybe 35, each gets 0.40*35 = $14, and we keep $5 left, so total $19? Wait compute: 10 -5 =5 plus 14 =19. So lower contribution yields higher earnings if others contribute high. So rational selfish player would free ride.\n\nBut character\'s background: disciplined, maybe cooperative. He has a military background, maybe values group performance. He contributed $10 in period 3, earning $11.80 (since total contributions maybe 37? Actually contributions: [10,10,9,8] sum 37, each gets 0.40*37=14.8. He contributed 8? Wait he contributed 10? Actually period 3 he contributed 10, others 10,9,8 sum 37. His earnings: keep 0 + 14.8 =14.8? But reported earned $11.80 - maybe subtract punishment cost $3? Yes spent $3 punishing, so 14.8 -3 =11.8. So he contributed max and still earned less than if he free rode due to punishment cost.\n\nIn period 2 he contributed 8, others 10,8,8 sum 34, each gets 0.40*34 =13.6; his leftover =2; total 15.6, minus punishment cost $1 =14.6?? Wait reported earned $2.60. Something off: They spent $1 punishing and received $12 of punishment? Maybe they were punished heavily decreasing earnings. This is confusing.\n\nBut now no punishment, the payoffs are simple.\n\nCharacter might think: no punishment, can free ride; but also think of fairness because group average contributions high; maybe he\'ll contribute a decent amount to maintain group trust.\n\nGiven his background of being disciplined and having many jobs, maybe he values fairness and cooperation. He may want to not be the lowest contributor to avoid being seen as slacker. He may also consider future retaliation if punishment later re-enabled. But currently no punishment allowed, but voting could change.\n\nThus a moderate contribution maybe 8 or 9.\n\nHe contributed $5 then $8 then $10, trending upward. Might continue upward? Probably will contribute $10, to show commitment and because he likes to work hard. He might think group expects high contributions.\n\nSo answer: 10.\n\nAlternatively might choose 9 to slightly free ride but still high.\n\nGiven his persona (hard-working, army, multiple careers) and the story about being punished before, he may want to avoid being punished again. Even if punishment is currently disabled, he may anticipate future punishment.\n\nThus I\'d answer 10.\n\nLet\'s output ""10"" then comment.\n\n', 'name': None}}], 'created': 1781191647, 'model': 'openai/gpt-oss-120b', 'object': 'chat.completion', 'service_tier': 'default', 'system_fingerprint': None, 'usage': {'completion_tokens': 1296, 'prompt_tokens': 884, 'total_tokens': 2180, 'completion_tokens_details': None, 'prompt_tokens_details': None, 'estimated_cost': 0.000280716}}",,,"History so far:
Vote 1 outcome: Voted rules — may a player be punished for contributing... LESS than the group average: YES; exactly the group average: NO; MORE than the group average: NO
Period 1: you contributed $5, all contributions were [10, 8, 7, 5] (avg 7.5); you spent $0.50 on punishing and received $9 of punishment; you earned $7.50.
Period 2: you contributed $8, all contributions were [10, 8, 8, 8] (avg 8.5); you spent $1.00 on punishing and received $12 of punishment; you earned $2.60.
Period 3: you contributed $10, all contributions were [10, 10, 9, 8] (avg 9.25); you spent $3.00 on punishing and received $0 of punishment; you earned $11.80.
Vote 2 outcome: The group voted to allow NO punishment at all.",B,4,"Before this study you answered an interview question.

Question: Tell me about yourself. How old are you? Where did you grow up? What events made you who you are? What matters to you and what do you enjoy? Please describe in detail.

Answer: I am 6 foot tall, 200 pounds, 59 years old, born and raised in the city of Los Angeles. I have no college degree but I am well educated on the streets and in the job markets. I am a Christian who has had several progressive careers. I did not graduate high school because I dropped out of school at age 17 because my girlfriend became pregnant. I left her father to the fate of rearing a child with his junkie girlfriend so I could enter the Army.

In 1976 I enlisted in the United States Army. I loved it so much that I stayed in the United States Army and re-enlisted in the Army Reserves and the Army National Guard before joining the United States Army Reserve Command. Once again I re-enlisted in the Army Reserve and the Army National Guard. Finally I joined Active Guard and Reserve in 1982.

I obtained my first civilian job in October 1976. Since then I have worked in many fields of civilian employment and I have obtained many skills I now use. I have worked in the farm field, lawn maintenance, auto mechanic, with the United States Postal Service, Security Guard, Loan Processor, Mover, Deputy Sheriff, Warehouse Manager, and over a dozen other occupations. On my way to obtaining a second Masters degree I was also working with the Department of Homeland Security as a contractor. I possess so many skills that I hope to have the American people looking for some type of employment when they read about all of my skills in the next post.

Today I work for the Los Angeles World Airports as a Driver.

You are the person who gave this answer. In everything that follows, stay in character and decide exactly as this person would.",The group voted to allow NO punishment at all.,True
