You are answering questions as if you were a human. Do not break character.,player,5,e8645d25fc034e895431497cb58d72c7,False,"I chose a moderate contribution that keeps me at or above the likely group average, avoiding punishment and supporting a fair outcome, while still retaining enough personal earnings.","5
I chose a moderate contribution that keeps me at or above the likely group average, avoiding punishment and supporting a fair outcome, while still retaining enough personal earnings.",0,0,deep_infra,False,8192,openai/gpt-oss-120b,0,,1,3,1,{'text': ''},"{'text': ""On a scale from 1 to 10, your efficiency level is: 7. 10 means you strongly prioritize maximizing combined payoffs, and 1 means you don't care. On a scale from 1 to 10, your self-interest level is: 10. 10 means you strongly prioritize your own payoffs, and 1 means you don't care. On a scale from 1 to 10, your inequity aversion level is: 10. 10 means you strongly prioritize fairness between players, and 1 means you don't care.\nYou are Player D in a fixed group of 4 playing a repeated public goods game. Each period every player receives $10 and privately decides how much to put into a group fund. Every dollar in the fund pays $0.40 to EACH of the 4 players. You keep whatever you do not contribute. After contributions are revealed, punishment may happen: paying $0.25 reduces another player's earnings by $1.00 — but only players of the kinds your group voted punishable may be punished.\nVoted rules — may a player be punished for contributing... LESS than the group average: YES; exactly the group average: NO; MORE than the group average: NO\nHistory so far:\nVote 1 outcome: Voted rules — may a player be punished for contributing... LESS than the group average: YES; exactly the group average: NO; MORE than the group average: NO\nPeriod 1: you contributed $10, all contributions were [10, 6, 5, 0] (avg 5.25); you spent $1.25 on punishing and received $0 of punishment; you earned $7.15.\nThis is period 2. How much of your $10 do you contribute to the group fund (0-10)?\n\nThis question requires a numerical response in the form of an integer or decimal (e.g., -12, 0, 1, 2, 3.45, ...).\nRespond with just your number on a single line.\nIf your response is equivalent to zero, report '0'\n\n\nAfter the answer, put a comment explaining your choice on the next line.""}",,"{{ scenario.persona }}
You are Player {{ scenario.me }} in a fixed group of 4 playing a repeated public goods game. Each period every player receives $10 and privately decides how much to put into a group fund. Every dollar in the fund pays $0.40 to EACH of the 4 players. You keep whatever you do not contribute. After contributions are revealed, punishment may happen: paying $0.25 reduces another player's earnings by $1.00 — but only players of the kinds your group voted punishable may be punished.
{{ scenario.rule }}
{{ scenario.history }}
This is period {{ scenario.period }}. How much of your $10 do you contribute to the group fund (0-10)?",numerical,0.00026539900000000004,0.039,501,3767.911710292804,0.19,1294,"{'id': 'chatcmpl-RDsUseFjMDfnz3Z7EeYaoPhE', 'choices': [{'finish_reason': 'stop', 'index': 0, 'logprobs': None, 'message': {'content': '5\nI chose a moderate contribution that keeps me at or above the likely group average, avoiding punishment and supporting a fair outcome, while still retaining enough personal earnings.', 'refusal': None, 'role': 'assistant', 'annotations': None, 'audio': None, 'function_call': None, 'tool_calls': [], 'reasoning_content': ""We need to decide contribution given preferences: efficiency 7, self-interest 10, inequity aversion 10. So they strongly care about own payoff and fairness.\n\nThe game: each period each gets $10 endowment. Contribute c_i, gets returned 0.40 * total contribution to each player. So each player's payoff = 10 - c_i + 0.40 * Σ c_j - punishment costs (if they pay) - punishment received (if others punish them). Punishment ability: after contributions revealed, can pay $0.25 to reduce another player's earnings by $1.00, but only players of the kinds your group voted punishable may be punished. The voted rule says: may punish for contributing less than group average: YES; exactly average: NO; more than average: NO. So any player who contributed less than average can be punished. In period 1, contributions were [10,6,5,0]; average 5.25. Those less than avg: 5 and 0 (players C and D?). Actually we are Player D. The contributions list likely corresponds to players A,B,C,D? Not defined. We contributed 10. Others contributed 6,5,0. So we contributed 10 > avg, cannot be punished. Others less than avg: 5 and 0 (players C and D maybe). So they could be punished.\n\nWe spent $1.25 on punishing: that means we paid 5 times $0.25 each? That's 5 punish actions, each reduces target's earnings by $1. Probably we punished players who contributed less (maybe both). But we cannot punish ourselves. So we used $1.25 to punish (cost) and received 0 punishment.\n\nOur earnings: 7.15. Let's compute to verify: total contributions = 10+6+5+0 =21. Return per player = 0.40*21 =8.4. Our payoff = 10 -10 +8.4 -1.25 =7.15. Yes.\n\nNow period 2: we need to decide how much to contribute. Preferences: high self-interest (10) means we want to maximize own payoff. Efficiency 7 means we care some about total payoff. Inequity aversion 10 means we strongly care about fairness between players (i.e., we dislike payoff inequality). So we need to balance.\n\nGiven we can punish those who contribute less than average. If we contribute low, we might be punishable. If we contribute high relative to others, we cannot be punished but may be unfairly advantaged? Actually fairness aversion suggests we want equal payoffs. So we might want to contribute something close to expected average to avoid being punished and to be fair.\n\nBut we also have self-interest: we want higher payoff. Contributing less than average yields higher personal payoff (since you keep more) but you risk being punished (others can punish you). They can punish if you are less than average. So we may need to anticipate others' contributions and potential punishments.\n\nWe know others' past contributions: 6,5,0. Player who contributed 0 is extremely low; likely to be punished. The one who contributed 5 is below average also punishable. Player who contributed 6 is above average (avg 5.25). So they were not punishable.\n\nOur own contribution 10, high.\n\nNow period 2, assuming others might adjust. Since they saw we punished low contributors, they may adjust to avoid being punished. They also know punishment cost is cheap (0.25 to reduce $1). So might increase contributions to avoid being below average. But they may also try to free ride.\n\nGiven we are strong self-interest, we likely will still keep as much as possible but ensure we are not punishable (i.e., contribute at least average). However we don't know others; we could also punish them after.\n\nIf we contribute 0, we will definitely be below average (unless all also 0). Then others can punish us, reducing our earnings by $1 each time they spend $0.25. They may do so because they have self-interest to punish low contributors (they get $0.25 cost but reduce our payoff by $1, increasing relative payoff). But they may also care about fairness (inequity aversion). Punishing is a way to enforce fairness? They may punish low contributors to raise contributions.\n\nThus likely others will punish low contributions. So contributing 0 is risky.\n\nContribute max 10 ensures we are not punishable, but we also lose money contributed: 0.40 * total gives back some. If others contribute low, we still get some return.\n\nWe might want to target average around maybe 5? If we contribute 5, we might be near average if others also around 5. That yields personal payoff = 10-5 +0.40*total. If total is around 5+others total say 5+5+5+5=20, return 8 each. Then payoff =5+8=13 (no punish). That's high.\n\nBut if we contribute 5 and others contribute less, e.g., 2,2,2 avg=~2.75, we are above avg, safe, but return lower because total lower.\n\nOur goal: maximize own payoff while being fair. Probably contribute 5? However we need to consider that if we contribute low relative to others, we could be punished. So choose contribution equal to expected average of others. But we don't know.\n\nGiven we can also punish others after contributions: self-interest means we might punish low contributors to increase relative advantage. But since we also have inequity aversion, we might not want to create large disparity.\n\nWe have high fairness aversion, so we may want outcomes where everyone's payoff similar. That suggests cooperating at moderate contribution.\n\nThus I think contribute 5 (maybe 5.25?). Provide integer or decimal. I'll choose 5.\n\nExplain: Contribute moderate amount to avoid being punishable and promote fairness while still earning decent payoff."", 'name': None}}], 'created': 1781191495, 'model': 'openai/gpt-oss-120b', 'object': 'chat.completion', 'service_tier': 'default', 'system_fingerprint': None, 'usage': {'completion_tokens': 1294, 'prompt_tokens': 501, 'total_tokens': 1795, 'completion_tokens_details': None, 'prompt_tokens_details': None, 'estimated_cost': 0.00026539900000000004}}",,,"History so far:
Vote 1 outcome: Voted rules — may a player be punished for contributing... LESS than the group average: YES; exactly the group average: NO; MORE than the group average: NO
Period 1: you contributed $10, all contributions were [10, 6, 5, 0] (avg 5.25); you spent $1.25 on punishing and received $0 of punishment; you earned $7.15.",D,2,"On a scale from 1 to 10, your efficiency level is: 7. 10 means you strongly prioritize maximizing combined payoffs, and 1 means you don't care. On a scale from 1 to 10, your self-interest level is: 10. 10 means you strongly prioritize your own payoffs, and 1 means you don't care. On a scale from 1 to 10, your inequity aversion level is: 10. 10 means you strongly prioritize fairness between players, and 1 means you don't care.",Voted rules — may a player be punished for contributing... LESS than the group average: YES; exactly the group average: NO; MORE than the group average: NO,True
