You are answering questions as if you were a human. Do not break character.,player,5,2b11998feefbd95d0dd000b1df05836b,False,"I’m keeping the same moderate contribution as before. With low emphasis on efficiency and self‑interest, and only a mild concern for fairness, staying around the past level (5) avoids being the clear low‑contributor while not sacrificing too much personal payoff.","5
I’m keeping the same moderate contribution as before. With low emphasis on efficiency and self‑interest, and only a mild concern for fairness, staying around the past level (5) avoids being the clear low‑contributor while not sacrificing too much personal payoff.",0,0,deep_infra,False,8192,openai/gpt-oss-120b,0,,1,3,1,{'text': ''},"{'text': ""On a scale from 1 to 10, your efficiency level is: 3. 10 means you strongly prioritize maximizing combined payoffs, and 1 means you don't care. On a scale from 1 to 10, your self-interest level is: 1. 10 means you strongly prioritize your own payoffs, and 1 means you don't care. On a scale from 1 to 10, your inequity aversion level is: 3. 10 means you strongly prioritize fairness between players, and 1 means you don't care.\nYou are Player B in a fixed group of 4 playing a repeated public goods game. Each period every player receives $10 and privately decides how much to put into a group fund. Every dollar in the fund pays $0.40 to EACH of the 4 players. You keep whatever you do not contribute. After contributions are revealed, punishment may happen: paying $0.25 reduces another player's earnings by $1.00 — but only players of the kinds your group voted punishable may be punished.\nVoted rules — may a player be punished for contributing... LESS than the group average: YES; exactly the group average: NO; MORE than the group average: NO\nHistory so far:\nVote 1 outcome: Voted rules — may a player be punished for contributing... LESS than the group average: YES; exactly the group average: NO; MORE than the group average: NO\nPeriod 1: you contributed $5, all contributions were [10, 6, 5, 0] (avg 5.25); you spent $0.25 on punishing and received $0 of punishment; you earned $13.15.\nThis is period 2. How much of your $10 do you contribute to the group fund (0-10)?\n\nThis question requires a numerical response in the form of an integer or decimal (e.g., -12, 0, 1, 2, 3.45, ...).\nRespond with just your number on a single line.\nIf your response is equivalent to zero, report '0'\n\n\nAfter the answer, put a comment explaining your choice on the next line.""}",,"{{ scenario.persona }}
You are Player {{ scenario.me }} in a fixed group of 4 playing a repeated public goods game. Each period every player receives $10 and privately decides how much to put into a group fund. Every dollar in the fund pays $0.40 to EACH of the 4 players. You keep whatever you do not contribute. After contributions are revealed, punishment may happen: paying $0.25 reduces another player's earnings by $1.00 — but only players of the kinds your group voted punishable may be punished.
{{ scenario.rule }}
{{ scenario.history }}
This is period {{ scenario.period }}. How much of your $10 do you contribute to the group fund (0-10)?",numerical,0.00023632900000000002,0.039,501,4231.389292046257,0.19,1141,"{'id': 'chatcmpl-RVoEUlnunScEJAAnKGbCqDGj', 'choices': [{'finish_reason': 'stop', 'index': 0, 'logprobs': None, 'message': {'content': '5\nI’m keeping the same moderate contribution as before. With low emphasis on efficiency and self‑interest, and only a mild concern for fairness, staying around the past level (5) avoids being the clear low‑contributor while not sacrificing too much personal payoff.', 'refusal': None, 'role': 'assistant', 'annotations': None, 'audio': None, 'function_call': None, 'tool_calls': [], 'reasoning_content': ""We need to decide contribution given preferences: efficiency level 3 (low priority on maximizing combined payoffs), self-interest 1 (low priority on own payoff), inequity aversion 3 (some fairness). So they care a bit about efficiency and fairness but not much about self.\n\nGame: each gets $10, contributes c_i, group fund sum S. Each dollar yields $0.40 to each of 4 players, total payout per $ is 4*0.40 = $1.6, so net group return 1.6 per $ contributed, which is higher than 1, so socially efficient to contribute full $10 each (total 40, payout 64, each gets 16). But contributions are private, and can be punished if below average.\n\nPunishment rule: can punish those who contributed less than group average. You can spend $0.25 to reduce another player's earnings by $1. In period 1 you spent $0.25 to punish someone (presumably someone contributed less than average). You got $0 punishment.\n\nContributions period1: [10,6,5,0] average 5.25. You contributed 5 (below avg). So you were eligible to be punished. You were not punished? You earned $13.15. Let's compute: contributions total S =21. Each gets 0.4*21=8.4. Your private keep: 10-5=5. So base earnings =5+8.4=13.4. You spent $0.25 punishing, reduces earnings to 13.15. So you were not punished by others (they didn't spend on you). Others may have spent too? You spent $0.25, presumably on the 0 contributor (or 6?). Anyway.\n\nNow period2 decision. Consider expectations of others? We have no data on other players' strategies beyond period1: contributions were 10,6,5,0. Player A contributed 10, B contributed 6, you contributed 5, D contributed 0. We are B? Actually you are Player B. In period1 you contributed 5. Others: three others: someone contributed 10, one 6, one 0. As player B, you were 5. So likely Player A (maybe the 10), Player C (6), Player D (0). We don't know roles.\n\nNow for period2, we have preferences: low efficiency, low self-interest, low fairness. Probably will contribute low, maybe 0, to maximize personal? But self-interest is low (1) meaning they don't care about own payoff. Efficiency also low, so not caring about group. Inequity aversion moderate: 3, they care some about fairness but not strong.\n\nGiven rule punishes below avg contributions, if you contribute low, you might be punished by others if they contribute higher. In period1, you were below avg and were not punished. Others maybe didn't punish you? But you spent on someone else. So maybe they are lenient. For period2, you might want to avoid being punished (cost 0.25 to punish, but others could spend causing you -$1 per 0.25 they spend). Since you care little about own payoff (self-interest 1), you may accept being punished? But you could also punish others.\n\nGoal: maximize some weighted utility: combine efficiency * total payoffs + self * own + fairness * inequality measure. But numbers low. Probably choose moderate contribution like 5 again? Or maybe 0 to be cheap.\n\nLet's compute payoff if contribute c, assuming others contributions unknown. Possibly they will mimic previous? Could be 10,6,0 etc. Hard.\n\nIf you contribute 0, you keep 10, group fund reduces no addition, others sum maybe? But you risk punishment if average >0, likely average >0 if others contribute >0. Then you can be punished by others. If average maybe around 5? Then you'd be below avg, they could punish you. They may each spend $0.25 to reduce you $1 each. Unclear.\n\nGiven low self-interest, you might not care about being punished. But you also have inefficiency, fairness. If you contribute 0 and get punished, you would earn less. But fairness aversion maybe you'd want not to be lower than others? Hmm.\n\nGiven uncertainty, perhaps choose 5 again, as baseline.\n\nAlternatively, consider that you care slightly about fairness, you might want to not be the lowest contributor. Others contributed 10,6,0. You contributed 5, standing above 0 but below others. So you are not the lowest. In period2 maybe similar distribution, you may want to stay above lowest. So maybe contribute something like 2? But if others contribute similar, average maybe >2, you'd be below avg and punishable. But fairness aversion maybe moderate, you'd want to avoid being below avg because can't be punished? Actually rule punishes only those below avg—so being below avg makes you punishable. But others might not punish. But fairness may prefer not to be punished.\n\nGiven inefficiency low, maybe you just replicate previous contribution, 5.\n\nThus answer: 5."", 'name': None}}], 'created': 1781191493, 'model': 'openai/gpt-oss-120b', 'object': 'chat.completion', 'service_tier': 'default', 'system_fingerprint': None, 'usage': {'completion_tokens': 1141, 'prompt_tokens': 501, 'total_tokens': 1642, 'completion_tokens_details': None, 'prompt_tokens_details': None, 'estimated_cost': 0.00023632900000000002}}",,,"History so far:
Vote 1 outcome: Voted rules — may a player be punished for contributing... LESS than the group average: YES; exactly the group average: NO; MORE than the group average: NO
Period 1: you contributed $5, all contributions were [10, 6, 5, 0] (avg 5.25); you spent $0.25 on punishing and received $0 of punishment; you earned $13.15.",B,2,"On a scale from 1 to 10, your efficiency level is: 3. 10 means you strongly prioritize maximizing combined payoffs, and 1 means you don't care. On a scale from 1 to 10, your self-interest level is: 1. 10 means you strongly prioritize your own payoffs, and 1 means you don't care. On a scale from 1 to 10, your inequity aversion level is: 3. 10 means you strongly prioritize fairness between players, and 1 means you don't care.",Voted rules — may a player be punished for contributing... LESS than the group average: YES; exactly the group average: NO; MORE than the group average: NO,True
You are answering questions as if you were a human. Do not break character.,player,5,0863b2c245248c4af3162d5ebe705399,False,"I chose a moderate contribution. Contributing 0 maximizes my personal earnings but makes me far ahead of the low contributors, which I dislike given my strong inequity aversion. Contributing the full $10 would lower my payoff and put me behind the $5‑contributor, also undesirable. A $5 contribution balances my self‑interest with fairness considerations and also improves total efficiency.","5
I chose a moderate contribution. Contributing 0 maximizes my personal earnings but makes me far ahead of the low contributors, which I dislike given my strong inequity aversion. Contributing the full $10 would lower my payoff and put me behind the $5‑contributor, also undesirable. A $5 contribution balances my self‑interest with fairness considerations and also improves total efficiency.",0,0,deep_infra,False,8192,openai/gpt-oss-120b,0,,1,3,1,{'text': ''},"{'text': ""On a scale from 1 to 10, your efficiency level is: 7. 10 means you strongly prioritize maximizing combined payoffs, and 1 means you don't care. On a scale from 1 to 10, your self-interest level is: 10. 10 means you strongly prioritize your own payoffs, and 1 means you don't care. On a scale from 1 to 10, your inequity aversion level is: 10. 10 means you strongly prioritize fairness between players, and 1 means you don't care.\nYou are Player C in a fixed group of 4 playing a repeated public goods game. Each period every player receives $10 and privately decides how much to put into a group fund. Every dollar in the fund pays $0.40 to EACH of the 4 players. You keep whatever you do not contribute. After contributions are revealed, punishment may happen: paying $0.25 reduces another player's earnings by $1.00 — but only players of the kinds your group voted punishable may be punished.\nVoted rules — may a player be punished for contributing... LESS than the group average: YES; exactly the group average: NO; MORE than the group average: NO\nHistory so far:\nVote 1 outcome: Voted rules — may a player be punished for contributing... LESS than the group average: YES; exactly the group average: NO; MORE than the group average: NO\nPeriod 1: you contributed $6, all contributions were [10, 6, 5, 0] (avg 5.25); you spent $2.00 on punishing and received $0 of punishment; you earned $10.40.\nThis is period 2. How much of your $10 do you contribute to the group fund (0-10)?\n\nThis question requires a numerical response in the form of an integer or decimal (e.g., -12, 0, 1, 2, 3.45, ...).\nRespond with just your number on a single line.\nIf your response is equivalent to zero, report '0'\n\n\nAfter the answer, put a comment explaining your choice on the next line.""}",,"{{ scenario.persona }}
You are Player {{ scenario.me }} in a fixed group of 4 playing a repeated public goods game. Each period every player receives $10 and privately decides how much to put into a group fund. Every dollar in the fund pays $0.40 to EACH of the 4 players. You keep whatever you do not contribute. After contributions are revealed, punishment may happen: paying $0.25 reduces another player's earnings by $1.00 — but only players of the kinds your group voted punishable may be punished.
{{ scenario.rule }}
{{ scenario.history }}
This is period {{ scenario.period }}. How much of your $10 do you contribute to the group fund (0-10)?",numerical,0.000513349,0.039,501,1947.9924963329042,0.19,2599,"{'id': 'chatcmpl-RpKA3y9aWXQW72l3ONMOVUuE', 'choices': [{'finish_reason': 'stop', 'index': 0, 'logprobs': None, 'message': {'content': '5\nI chose a moderate contribution. Contributing 0 maximizes my personal earnings but makes me far ahead of the low contributors, which I dislike given my strong inequity aversion. Contributing the full $10 would lower my payoff and put me behind the $5‑contributor, also undesirable. A $5 contribution balances my self‑interest with fairness considerations and also improves total efficiency.', 'refusal': None, 'role': 'assistant', 'annotations': None, 'audio': None, 'function_call': None, 'tool_calls': [], 'reasoning_content': 'We need to decide contribution based on preferences: efficiency =7, self-interest=10, inequity aversion=10. So strong self-interest, strong fairness, decent efficiency. Also we have ability to punish at cost $0.25 reduces others by $1.\n\nWe are Player C. Others contributions: period1 contributions were [10,6,5,0]; we contributed 6. So we are player C? Let\'s label: contributions list likely in order A, B, C, D or something. They say you contributed $6, all contributions were [10,6,5,0]. So ""you contributed $6"" corresponds to second element? Actually list includes your 6, so maybe order is [A,B,C,D] where you are C? But you contributed 6 which is second element? Wait list: [10,6,5,0]; you contributed 6; so you are second element. So you are player B? But they say you are Player C. Possibly ordering is arbitrary. Regardless, we have other contributions: one contributed 10 (high), one contributed 5 (close), one contributed 0 (free rider). Avg=5.25.\n\nPunishment: you spent $2.00 on punishing and received $0 of punishment; you earned $10.40. Let\'s compute earnings: you keep your endowment minus contribution minus punishment cost + return from public good + any punishment received? Actually public good: each $ in fund yields $0.40 to each of 4 players, so total return = 0.40*total contributions per player. Contribution amounts: 10+6+5+0=21. So each gets 0.40*21=8.4. You kept 10 - contribution - punishment cost + public good return = 10 -6 -2 +8.4 =10.4, matches.\n\nOk.\n\nNow period2, we need to decide contribution. We anticipate future? repeated game but unknown horizon. We have preferences: self-interest highest, want maximize own payoff, but also inequity aversion strongly wants fairness, which may cause us to want to punish or contribute to reduce inequality.\n\nWe also have ability to punish only those who contributed less than group average (as per rule). So can punish low contributors. In period1, the player who contributed 0 contributed less than average 5.25, so punishable. The 5 contributed less than average? Actually 5 <5.25, also punishable. So two players punishable: those who contributed less than average = contributions 5 and 0. The 10 is above average (not punishable), 6 is above average (since 6>5.25). So we could have punished the low contributors. You spent $2 spending on punishing, likely punishing both? Each $0.25 reduces one player\'s earnings by $1. So $2 can be 8 punishments, maybe targeting low contributors heavily. You got no punishment.\n\nNow we need to decide contribution to maximize own payoff given preferences. Self-interest suggests we want to free ride as much as possible (contribute 0). But inefficiency: contribution yields $0.40*4 = $1.60 total return to society, but you only get $0.40, cost $1, net -$0.60 to you. So contribution reduces your payoff unless you care about fairness or expect punishment.\n\nInequity aversion strong: you dislike being better off than others? Usually aversion to disadvantageous inequity (you being worse) and advantageous inequity (you being better). Given strong inequity aversion, you may want to avoid large payoff differences.\n\nCurrently expects others might contribute similar amounts. If you contribute 0 and others contribute high, you\'ll be better off? Actually if others contribute, you still get public good benefits anyway. So you might get higher payoff relative to others if you free ride and others contribute. That would cause advantageous inequity, which you dislike. So you might want to contribute to reduce gap.\n\nBut also could punish low contributors to bring them down, making you relatively ahead? No, punishing reduces others, increasing your advantage, which you dislike. So you may not punish? But you have strong inequity aversion, so you\'d avoid punishing.\n\nThus maybe you aim for fairness: contribute similar to others.\n\nWe need to predict others\' contributions based on previous pattern. Player who contributed 10 maybe high type; player 5 low; 0 free rider. Might adjust.\n\nGiven ability to punish, they may be deterred from free riding. But you as others may also punish. For period2, maybe expected average contributions might be lower if they punish reluctant. Hard.\n\nGiven self-interest strongly prioritized, I\'d still likely free ride unless fairness outweighs.\n\nBut the weights: efficiency 7, self-interest 10, inequity aversion 10. Self-interest highest but fairness also high equal.\n\nIf I free ride (contribute 0), my payoff = keep $10 - punishment cost (maybe none) + public good return = 10 + 0.40*total contributions. If others contribute maybe average 5? Suppose others: 10,5,0 as before but they might adjust. If they stay same, total=15. Then my payoff =10+0.40*15=10+6=16. Others\' payoff: high contributor (10) gets 0 +0.40*15 =6, plus maybe punishment they get? They could be punished if contributed less than avg? Their contribution 10 > avg? avg would be (10+5+0+0)/4=3.75? Actually my contribution =0, others contributions maybe 10,5,0 => sum 15, avg 3.75. Then punishable: those less than avg: contributions 0 (two players: me and the other 0) are < avg, so punishable. They could be punished by others (including me). If I punish them, cost reduces my payoff. But I might not punish.\n\nSo if I free ride, I end up with payoff 16, which is higher than others (6). That\'s advantageous inequity, disliked. I\'d incur discomfort. To avoid that, I might contribute something.\n\nIf I contribute 5 (matching one other), then total becomes 20, avg 5. Payoff: keep 5 + public good 0.40*20=8 => total 13. Others: 10 contributes 10, gets 8, net 8; 5 contributor gets 8, net 13? Actually they keep 5+8=13; the 0 contributor gets 8. So payoffs: me13, high=8, mid=13, zero=8. So I am equal to mid contributor, but above low contributor. If I care about inequality, maybe I want to reduce gap with low contributor too, maybe contribute more to raise total, making low contributor also get higher return.\n\nIf I contribute 10, total 25, avg 6.25, payoff: keep 0 + 0.40*25=10 =>10. Others: 10 contributor get 0+10=10; 5 gets5+10=15; 0 gets0+10=10. Actually each keeps remaining endowment after contribution. So high 10: keep0 +10=10. 5: keep5+10=15. So I get10, lower than mid (15). That is disadvantageous inequity for me (I get less). Not good.\n\nThus maybe optimal fairness is to contribute such that all get similar. Want to equalize payoffs. Let contributions vector unknown. Goal: final payoff = endowment - contribution + 0.40*total contributions (excluding punish). Suppose we contribute x, others contributions unknown. Assume others keep same as period1: 10,5,0. Then total = x+15. My payoff =10 - x +0.40*(x+15) = 10 - x +0.40x +6 = 16 -0.60x. Others: for 10 contributor: payoff =0 +0.40*(x+15)=0.40x+6. For 5 contributor: =5 +0.40*(x+15) =5+0.40x+6=11+0.40x. For 0: =0+0.40x+6 =0.40x+6.\n\nSo my payoff decreases with x. At x=0, I get 16, others: 6, 11, 6. At x=5, I get 16-3=13; others: 0.40*5+6=8, 11+2=13, 8. So then I am equal to middle, above low. At x=6, I get 16-3.6=12.4; others: 0.40*6+6=8.4, 11+2.4=13.4, 8.4. So I lower. So to minimize inequity I might pick x that makes my payoff equal to lowest? That would mean my payoff = low payoff (others 0 and 10 contributor). low payoff =0.40x+6. set 16-0.60x = 0.40x+6 =>16-0.60x = 0.40x+6 =>16-6 = 1.0x =>10 = x. So x=10 yields payoff 16-6=10, low payoff =0.40*10+6=10 as well. So at x=10, all get payoff 10 (except middle who gets 11+4=15?). Actually for mid contributor (5) payoff =11+0.40*10=15. So not equal. So can\'t equalize all.\n\nMaybe aim to make my payoff equal to highest? That would be high payoff among others. Highest payoff among others currently is middle with 11+0.40x. Setting my payoff 16-0.60x = 11+0.40x => 5 = 1.0x => x=5. So at x=5, I equal middle (13). Good.\n\nThus x=5 achieves equal with 5-contributor, while low contributors get less though. To improve fairness further, possibly punish low contributors? But that would increase inequality.\n\nGiven strong inequity aversion, I\'d prefer to not be ahead of anyone. At x=10 I match low, but still ahead of middle? Actually middle has 15 >10, so I\'m disadvantaged, which you also dislike (disadvantageous inequity). Strong inequity aversion means both types. So you\'d want to equalize as much as possible. Perhaps best is to make all equal: need to solve for contributions of others such that final payoffs equal. But we can\'t control theirs.\n\nGiven uncertainty, perhaps pick moderate contribution 5 to balance.\n\nAlso efficiency weight 7 suggests you care about total payoff somewhat. Contribute 5 yields total contributions 20, total social payoff = each gets 8 => total 32. Free riding yields total contributions 15, each gets 6 => total 24. So contribution 5 increases total welfare. So efficiency pushes you to contribute more.\n\nGiven self-interest highest, if you care about your own relative to others equally, perhaps you choose contribution that maximizes your own payoff given fairness penalty. A utility function maybe: U = payoff - α * (advantageous inequity) - β * (disadvantageous inequity). With high α, β maybe large.\n\nIf you anticipate others contributions same as previous, payoff is decreasing in x. So self-interest would push x=0, but inequity aversion pushes x up. You have to weigh trade-off. Since self-interest weight 10 > inequity aversion 10? Actually both 10. But maybe they combine? Hard.\n\nGiven they are equal, maybe choose a compromise like 5.\n\nThus I will contribute 5.', 'name': None}}], 'created': 1781191516, 'model': 'openai/gpt-oss-120b', 'object': 'chat.completion', 'service_tier': 'default', 'system_fingerprint': None, 'usage': {'completion_tokens': 2599, 'prompt_tokens': 501, 'total_tokens': 3100, 'completion_tokens_details': None, 'prompt_tokens_details': None, 'estimated_cost': 0.0005133490000000001}}",,,"History so far:
Vote 1 outcome: Voted rules — may a player be punished for contributing... LESS than the group average: YES; exactly the group average: NO; MORE than the group average: NO
Period 1: you contributed $6, all contributions were [10, 6, 5, 0] (avg 5.25); you spent $2.00 on punishing and received $0 of punishment; you earned $10.40.",C,2,"On a scale from 1 to 10, your efficiency level is: 7. 10 means you strongly prioritize maximizing combined payoffs, and 1 means you don't care. On a scale from 1 to 10, your self-interest level is: 10. 10 means you strongly prioritize your own payoffs, and 1 means you don't care. On a scale from 1 to 10, your inequity aversion level is: 10. 10 means you strongly prioritize fairness between players, and 1 means you don't care.",Voted rules — may a player be punished for contributing... LESS than the group average: YES; exactly the group average: NO; MORE than the group average: NO,True
