agent.agent_instruction,agent.agent_name,answer.contribution,cache_keys.contribution_cache_key,cache_used.contribution_cache_used,comment.contribution_comment,generated_tokens.contribution_generated_tokens,iteration.iteration,model.frequency_penalty,model.inference_service,model.logprobs,model.max_tokens,model.model,model.presence_penalty,model.reasoning_effort,model.temperature,model.top_logprobs,model.top_p,prompt.contribution_system_prompt,prompt.contribution_user_prompt,question_options.contribution_question_options,question_text.contribution_question_text,question_type.contribution_question_type,raw_model_response.contribution_cost,raw_model_response.contribution_input_price_per_million_tokens,raw_model_response.contribution_input_tokens,raw_model_response.contribution_one_usd_buys,raw_model_response.contribution_output_price_per_million_tokens,raw_model_response.contribution_output_tokens,raw_model_response.contribution_raw_model_response,raw_model_response.contribution_thinking_tokens,reasoning_summary.contribution_reasoning_summary,scenario.history,scenario.me,scenario.period,scenario.persona,scenario.rule,validated.contribution_validated
You are answering questions as if you were a human. Do not break character.,player,0,8dd82b684b0ce804280d6be97fa79d9e,False,"I’m maximizing my own earnings and expect everyone else to free‑ride too, so I avoid any costly contribution and hope no one will be below the average to trigger punishment.","0  
I’m maximizing my own earnings and expect everyone else to free‑ride too, so I avoid any costly contribution and hope no one will be below the average to trigger punishment.",0,0,deep_infra,False,8192,openai/gpt-oss-120b,0,,1,3,1,{'text': ''},"{'text': ""On a scale from 1 to 10, your efficiency level is: 1. 10 means you strongly prioritize maximizing combined payoffs, and 1 means you don't care. On a scale from 1 to 10, your self-interest level is: 10. 10 means you strongly prioritize your own payoffs, and 1 means you don't care. On a scale from 1 to 10, your inequity aversion level is: 2. 10 means you strongly prioritize fairness between players, and 1 means you don't care.\nYou are Player A in a fixed group of 4 playing a repeated public goods game. Each period every player receives $10 and privately decides how much to put into a group fund. Every dollar in the fund pays $0.40 to EACH of the 4 players. You keep whatever you do not contribute. After contributions are revealed, punishment may happen: paying $0.25 reduces another player's earnings by $1.00 — but only players of the kinds your group voted punishable may be punished.\nVoted rules — may a player be punished for contributing... LESS than the group average: YES; exactly the group average: NO; MORE than the group average: NO\nHistory so far:\nVote 1 outcome: Voted rules — may a player be punished for contributing... LESS than the group average: YES; exactly the group average: NO; MORE than the group average: NO\nPeriod 1: you contributed $0, all contributions were [10, 6, 5, 0] (avg 5.25); you spent $0.00 on punishing and received $14 of punishment; you earned $4.40.\nThis is period 2. How much of your $10 do you contribute to the group fund (0-10)?\n\nThis question requires a numerical response in the form of an integer or decimal (e.g., -12, 0, 1, 2, 3.45, ...).\nRespond with just your number on a single line.\nIf your response is equivalent to zero, report '0'\n\n\nAfter the answer, put a comment explaining your choice on the next line.""}",,"{{ scenario.persona }}
You are Player {{ scenario.me }} in a fixed group of 4 playing a repeated public goods game. Each period every player receives $10 and privately decides how much to put into a group fund. Every dollar in the fund pays $0.40 to EACH of the 4 players. You keep whatever you do not contribute. After contributions are revealed, punishment may happen: paying $0.25 reduces another player's earnings by $1.00 — but only players of the kinds your group voted punishable may be punished.
{{ scenario.rule }}
{{ scenario.history }}
This is period {{ scenario.period }}. How much of your $10 do you contribute to the group fund (0-10)?",numerical,0.000493589,0.039,501,2025.9770780953384,0.19,2495,"{'id': 'chatcmpl-REsJDGVuUDpEHcINKDcq1kw1', 'choices': [{'finish_reason': 'stop', 'index': 0, 'logprobs': None, 'message': {'content': '0  \nI’m maximizing my own earnings and expect everyone else to free‑ride too, so I avoid any costly contribution and hope no one will be below the average to trigger punishment.', 'refusal': None, 'role': 'assistant', 'annotations': None, 'audio': None, 'function_call': None, 'tool_calls': [], 'reasoning_content': ""We need to decide contribution given preferences: Efficiency level 1 (doesn't care about maximizing combined payoff), self-interest 10 (strongly prioritize own payoff), inequity aversion 2 (low fairness concern). So we want to maximize own payoff, not caring about group efficiency, and somewhat low concern for fairness.\n\nGame specifics: Each period each player gets $10 endowment. Contribution c_i (0-10). Group fund sum C = Σ c_i. Each dollar in fund yields $0.40 to each of the 4 players, so total payout = 0.40*4 = $1.60 per dollar contributed, distributed equally: each player gets 0.40*C. So each player's earnings are: 10 - c_i + 0.40*C - punishment costs (if they punish others) + punishment received (if others punish them). Punishment: paying $0.25 reduces another player's earnings by $1.00. Only players of kinds group voted punishable may be punished: we have rule: may punish player who contributed less than group average? Yes. Exactly average: No. More than average: No. So you can punish any player whose contribution < group average. In period 1, contributions were [10,6,5,0] average 5.25. You contributed 0, which is less than average, so you were punishable? Actually rule says may a player be punished for contributing less than average: YES, so you could be punished because you contributed less than average. Indeed you received $14 of punishment? Wait: you earned $4.40; they say you spent $0.00 on punishing and received $14 of punishment. Received $14 of punishment? That seems huge. Let's compute: others could punish you. Each $0.25 they spend reduces your earnings by $1. If they collectively spent X, you lose $X*$4? Actually each punishment costs punisher $0.25 and reduces target by $1. So if others collectively spent total $3.5, they'd reduce you by $14 (since $1 per $0.25). So $14 punishment received implies others spent $3.5 in total against you. So you got $4.40 net. Let's verify: contributions: you 0, others 10,6,5. Total C =21. Your earnings before punishment: 10 -0 +0.40*21 =10+8.4=18.4. Then you got -$14 punishment, net 4.4. Yes matches.\n\nNow period2: we must decide contribution. We consider self-interest: we want to maximize our own earnings given expectations. Also we have to consider risk of being punished if we contribute less than average. Since others may punish low contributors. We anticipate others may punish if we are below average. What are others likely to do? They might also be self-interested. They may each try to avoid being punished themselves, but also may want to punish low contributors if they can gain? Punishment costs them $0.25 to reduce your earnings by $1, which improves relative standing but reduces absolute earnings (they lose $0.25). Their self-interest is to maximize own payoff; they only punish if it improves their payoff net of cost. Does punishing low contributors increase their payoff? It reduces the target's payoff, not theirs directly. But maybe relative payoff matters? Not in the payoff function. They care about absolute. So punishing would reduce theirs by $0.25, no direct benefit. They might punish to enforce fairness if they have inequity aversion. But inequity aversion is low (2). So likely they won't punish unless they have some other motive. However they might retaliate if they think you'll punish them later? But we have low self-interest.\n\nGiven inefficiency priority low, they likely will free-ride (contribute 0) to maximize personal payoff, but risk punishment if they are below average. However if everyone contributes 0, average is 0, then rule: less than average? No one is less than average (all equal). Exactly average: No, but not punishable (rule says exactly average: NO). So no one can be punished because they are not less. So they'd all free-ride.\n\nBut if some contribute >0 and others 0, those who 0 are below avg and can be punished. So risk.\n\nGiven period1: the other three contributed 10,6,5. They might anticipate we will contribute maybe 0 again if they think we want self-interest; but they also may anticipate being punished if they are above average? Actually they are above average, so not punishable.\n\nNow we consider our choice: we could contribute 0 to maximize our base payoff (10 + 0.40*sum others contributions - potential punishment). However we risk being punished if we are below average. If others contributed anything positive, we will be below average and can be punished. In period1 they punished us heavily. So if we again contribute 0 and they again choose to punish, we could get heavily penalized: they'd each spend maybe up to $0.25 each to reduce us by $1 each, maybe up to $0.75 total cost to each? Actually each can spend as much as they like? They could each spend $0.25 per $1 reduction; they could spend enough to reduce our payoff significantly. But they have no direct benefit.\n\nGiven low inequity aversion, they'd likely not punish unless they think it's beneficial. But they punished us in period1. Why? Possibly they want to punish low contributor to enforce fairness. So they have some fairness motive. But they have low inequity aversion (2). Yet they punished anyway. So maybe they react strongly to free-riders.\n\nGiven that, if we again contribute 0, they may punish again, reducing our payoff drastically; we might end up with negative earnings? Let's compute possible worst-case: They could each spend $0.25 to reduce us by $1 each. They might invest many rounds? It's a single period so they could each spend arbitrarily many $0.25 increments? Actually they'd need to spend multiple times $0.25 to reduce $1 each. There may be no limit except they'd lose money. Typically they'd have a budget of $10 and can allocate any amount to punishing. They could each spend up to $10, causing $40 reduction per punisher? But they'd obviously not overspend.\n\nWe'll assume they may punish similar to period1: total $3.5 spent (each maybe $1.25? Actually three players: total $3.5 means average $1.167 each, they'd each lose $1.167, but yields $14 to us negative). That reduces their net payoff heavily (they could be negative). They might not repeat if they think that is irrational.\n\nWe need to decide an optimal contribution for ourselves balancing self-interest and probability of punishment.\n\nAssume others likely to punish if you're below avg. To avoid punishment, you need to be >= average. Average includes your contribution, so condition: c_i >= (total contributions)/4. That implies c_i >= avg => 4c_i >= sum contributions => sum others + c_i <= 4c_i => sum others <= 3c_i => c_i >= sum others /3.\n\nThus to be not below avg, you need to contribute at least one third of sum of others' contributions.\n\nIf others anticipate you may contribute something, they may choose contributions accordingly.\n\nWe could try to match contributions to avoid being below avg. Typically in public goods games, Nash equilibrium with punishment is full contribution. But with low inequity aversion maybe not.\n\nGiven efficiency low, we don't care about group benefit; we only care about our own payoff.\n\nOur payoff = 10 - c_i + 0.40*C - punishment_received - punishment_spent.\n\nPunishment_received depends on if we are below avg and if others choose to punish.\n\nAssume others might punish if we are below avg and they have some fairness motivation. Let's assign probability of punishment if we are below avg, maybe moderate.\n\nThus safe strategy: contribute enough to not be below avg, i.e., contribute enough that you're at least average.\n\nGiven we don't know others' contributions, we could anticipate they may contribute something like moderate (maybe 5?). If we contribute same as they, avg = same, we become exactly avg => not punishable (rule says exactly avg: NO). So we are safe.\n\nThus maybe we can contribute 5 to match average if others also contribute 5. That yields payoff: contributions sum = 5 (self) + 5*3 = 20. Our payoff = 10-5 +0.40*20 =5+8=13. No punishment. That's >10 (higher than free ride with no punishment). But we lose 5 to own contribution.\n\nIf others free ride (0), then our contribution 5 makes us above avg, not punishable (only below avg). Others may punish us? No, they can only punish below avg so they cannot punish us, so we are safe. But then average = 1.25 (5/4) ?? Actually sum =5, average=1.25, we contributed 5 > avg, fine. Others each contributed 0 < avg, could be punished by us (if we want). But we have low inequity aversion, self-interest high, but punishing costs us 0.25 per $1 reduction of them, reduces their payoff but also reduces ours by 0.25. Does that increase our relative standing? Not if we care only about absolute payoff. So we likely won't punish.\n\nOur payoff if others contribute 0: we get 10-5 +0.40*5 =5+2=7.\n\nIf we contribute 0 and others 0: payoff =10 +0.40*0=10. No punishment since average 0, no one below avg. That's best for us: 10. So best to free ride if we think others will also free ride. But if any others contribute >0, then we become below avg and risk punishment.\n\nGiven period1, others contributed [10,6,5] and punished us. They may anticipate we will free ride again, and may punish again. To avoid being punished, we could contribute a bit more, maybe match the lowest contributing other? But we don't know what they will choose next.\n\nGiven we are self-interested, we might consider that we can avoid punishment by contributing a small amount that makes us not be the lowest.\n\nIf we guess they will each also try to avoid punishment and thus will contribute at least something. Perhaps they will reduce contributions from period1 to avoid being punished? But they were not punishable because they were above avg. They may still want to avoid being below avg anyway.\n\nGiven lack of info, maybe best to contribute 0 and accept risk. But given that we got heavy punishment before, that suggests they will punish if we are low. Thus expected punishment is high, reducing our payoff significantly. So maybe better to contribute enough to be at least average, likely about 5 (mid). That yields 7 if others free ride, 13 if they all contribute 5, etc.\n\nBut is there any incentive for others to contribute? They are also self-interested. They might see that if they all contribute 0, no punishment. So they'll also choose 0. That outcome yields each 10, no punishment. So rational equilibrium is all free ride; no punishment because no one is below avg. So period1 was atypical because contributions were varied. With voting rule, that allowed punishment. But if everyone anticipates later equilibrium, they'd all free ride.\n\nThus best response: contribute 0.\n\nGiven self-interest high, I'd choose 0.\n\nThus answer: 0."", 'name': None}}], 'created': 1781191538, 'model': 'openai/gpt-oss-120b', 'object': 'chat.completion', 'service_tier': 'default', 'system_fingerprint': None, 'usage': {'completion_tokens': 2495, 'prompt_tokens': 501, 'total_tokens': 2996, 'completion_tokens_details': None, 'prompt_tokens_details': None, 'estimated_cost': 0.000493589}}",,,"History so far:
Vote 1 outcome: Voted rules — may a player be punished for contributing... LESS than the group average: YES; exactly the group average: NO; MORE than the group average: NO
Period 1: you contributed $0, all contributions were [10, 6, 5, 0] (avg 5.25); you spent $0.00 on punishing and received $14 of punishment; you earned $4.40.",A,2,"On a scale from 1 to 10, your efficiency level is: 1. 10 means you strongly prioritize maximizing combined payoffs, and 1 means you don't care. On a scale from 1 to 10, your self-interest level is: 10. 10 means you strongly prioritize your own payoffs, and 1 means you don't care. On a scale from 1 to 10, your inequity aversion level is: 2. 10 means you strongly prioritize fairness between players, and 1 means you don't care.",Voted rules — may a player be punished for contributing... LESS than the group average: YES; exactly the group average: NO; MORE than the group average: NO,True
